;Acao;Data;Hora;Descrição;Link
0;AZEV4;15/08/2025;08:42;Concessão Rota Agro;https://www.rad.cvm.gov.br/ENET/frmDownloadDocumento.aspx?Tela=ext&numProtocolo=1413942&descTipo=IPE&CodigoInstituicao=1
1;AZEV4;10/07/2025;09:01;Habilitação em Licitação com o Departamento de Estradas de Rodagem de Pernambuco ? DER/PE;https://www.rad.cvm.gov.br/ENET/frmDownloadDocumento.aspx?Tela=ext&numProtocolo=1399444&descTipo=IPE&CodigoInstituicao=1
2;AZEV4;08/07/2025;08:48;Assinatura de Contrato;https://www.rad.cvm.gov.br/ENET/frmDownloadDocumento.aspx?Tela=ext&numProtocolo=1398575&descTipo=IPE&CodigoInstituicao=1
3;AZEV4;07/07/2025;15:49;Assuntos	Ações Live com Participação de Executivo;https://www.rad.cvm.gov.br/ENET/frmDownloadDocumento.aspx?Tela=ext&numProtocolo=1398277&descTipo=IPE&CodigoInstituicao=1
4;AZEV4;07/07/2025;09:43;Assinatura de Contrato;https://www.rad.cvm.gov.br/ENET/frmDownloadDocumento.aspx?Tela=ext&numProtocolo=1398174&descTipo=IPE&CodigoInstituicao=1
5;AZEV4;07/07/2025;08:58;Assinatura de Contrato;https://www.rad.cvm.gov.br/ENET/frmDownloadDocumento.aspx?Tela=ext&numProtocolo=1398153&descTipo=IPE&CodigoInstituicao=1
6;AZEV4;23/05/2025;20:30;Plano para Reenquadramento das Ações ao Regulamento da B3;https://www.rad.cvm.gov.br/ENET/frmDownloadDocumento.aspx?Tela=ext&numProtocolo=1382653&descTipo=IPE&CodigoInstituicao=1
7;AZEV4;05/05/2025;18:22;Alteração Diretoria Estatutária ;https://www.rad.cvm.gov.br/ENET/frmDownloadDocumento.aspx?Tela=ext&numProtocolo=1371859&descTipo=IPE&CodigoInstituicao=1
8;AZEV4;31/03/2025;08:48;Assinatura do contrato de concessão referente ao lote rodoviário Rota Verde (CN1) com a Agência Nacional de Transportes  Terrestres (ANTT).;https://www.rad.cvm.gov.br/ENET/frmDownloadDocumento.aspx?Tela=ext&numProtocolo=1354333&descTipo=IPE&CodigoInstituicao=1
9;AZEV4;28/02/2025;08:28;Concessão Rota Verde - Implementação de Condições Precedentes;https://www.rad.cvm.gov.br/ENET/frmDownloadDocumento.aspx?Tela=ext&numProtocolo=1341078&descTipo=IPE&CodigoInstituicao=1
10;AZEV4;20/02/2025;08:31;Emissão de Novas Ações em Função da Conclusão das Incorporações;https://www.rad.cvm.gov.br/ENET/frmDownloadDocumento.aspx?Tela=ext&numProtocolo=1337196&descTipo=IPE&CodigoInstituicao=1
11;AZEV4;10/02/2025;08:49;Aquisição dos Ativos Polo Porto Carão e Polo Barrinha pela Azevedo & Travassos Petróleo S.A.;https://www.rad.cvm.gov.br/ENET/frmDownloadDocumento.aspx?Tela=ext&numProtocolo=1332348&descTipo=IPE&CodigoInstituicao=1
12;AZEV4;30/01/2025;21:50;Azevedo & Travassos Energia S.A. - Cisão e Início das Negociações;https://www.rad.cvm.gov.br/ENET/frmDownloadDocumento.aspx?Tela=ext&numProtocolo=1329063&descTipo=IPE&CodigoInstituicao=1
13;AZEV4;20/01/2025;21:40;Assinatura de Contrato com Petrobras;https://www.rad.cvm.gov.br/ENET/frmDownloadDocumento.aspx?Tela=ext&numProtocolo=1326264&descTipo=IPE&CodigoInstituicao=1
14;AZEV4;15/01/2025;21:57;Conversão do registro de companhia aberta da Companhia de categoria ?B? para  categoria ?A?.;https://www.rad.cvm.gov.br/ENET/frmDownloadDocumento.aspx?Tela=ext&numProtocolo=1325434&descTipo=IPE&CodigoInstituicao=1
15;AZEV4;07/01/2025;09:10;Declaração de Comercialidade de Novo Campo;https://www.rad.cvm.gov.br/ENET/frmDownloadDocumento.aspx?Tela=ext&numProtocolo=1322529&descTipo=IPE&CodigoInstituicao=1
16;AZEV4;31/12/2024;10:20;Ata de Abertura do Envelope de Qualificação da Proponente Primeira Colocada no Leilão do Edital de Concessão nº 04/2024, referente à concessão do Sistema Rodoviário da Rodovia BR-060/452/GO;https://www.rad.cvm.gov.br/ENET/frmDownloadDocumento.aspx?Tela=ext&numProtocolo=1320792&descTipo=IPE&CodigoInstituicao=1
17;AZEV4;17/12/2024;10:06;Contrato de Exclusividade;https://www.rad.cvm.gov.br/ENET/frmDownloadDocumento.aspx?Tela=ext&numProtocolo=1316366&descTipo=IPE&CodigoInstituicao=1
18;AZEV4;12/12/2024;21:01;Leilão Rota Verde BR-060/452/GO;https://www.rad.cvm.gov.br/ENET/frmDownloadDocumento.aspx?Tela=ext&numProtocolo=1315149&descTipo=IPE&CodigoInstituicao=1
19;AZEV4;03/12/2024;08:24;Alteração Diretoria Estatutária ;https://www.rad.cvm.gov.br/ENET/frmDownloadDocumento.aspx?Tela=ext&numProtocolo=1310439&descTipo=IPE&CodigoInstituicao=1
20;AZEV4;02/12/2024;18:39;Assinatura de Contrato com o Departamento de Estradas de Rodagem do Estado de Minas Gerais (DER-MG);https://www.rad.cvm.gov.br/ENET/frmDownloadDocumento.aspx?Tela=ext&numProtocolo=1310184&descTipo=IPE&CodigoInstituicao=1
21;AZEV4;22/11/2024;08:24;Nova Composição da Diretoria Estatutária;https://www.rad.cvm.gov.br/ENET/frmDownloadDocumento.aspx?Tela=ext&numProtocolo=1307045&descTipo=IPE&CodigoInstituicao=1
22;AZEV4;18/11/2024;08:20;Esclarecimento sobre Informações Divulgadas Relativas à Homologação de Concorrência;https://www.rad.cvm.gov.br/ENET/frmDownloadDocumento.aspx?Tela=ext&numProtocolo=1305325&descTipo=IPE&CodigoInstituicao=1
23;AZEV4;11/11/2024;20:41;Eleição de Membros do CA.;https://www.rad.cvm.gov.br/ENET/frmDownloadDocumento.aspx?Tela=ext&numProtocolo=1302414&descTipo=IPE&CodigoInstituicao=1
24;AZEV4;01/11/2024;20:25;Encerramento de Contrato com Formador de Mercado;https://www.rad.cvm.gov.br/ENET/frmDownloadDocumento.aspx?Tela=ext&numProtocolo=1297477&descTipo=IPE&CodigoInstituicao=1
25;AZEV4;24/10/2024;22:18;Relatório de Atividades Operacionais - Azevedo e Travassos Petróleo S/A;https://www.rad.cvm.gov.br/ENET/frmDownloadDocumento.aspx?Tela=ext&numProtocolo=1294617&descTipo=IPE&CodigoInstituicao=1
26;AZEV4;24/10/2024;21:56;Principais destaques dos atuais poços detidos pela Phoenix Óleo & Gás;https://www.rad.cvm.gov.br/ENET/frmDownloadDocumento.aspx?Tela=ext&numProtocolo=1294597&descTipo=IPE&CodigoInstituicao=1
27;AZEV4;18/10/2024;18:32;Aprovação da Combinação de Negócios;https://www.rad.cvm.gov.br/ENET/frmDownloadDocumento.aspx?Tela=ext&numProtocolo=1292861&descTipo=IPE&CodigoInstituicao=1
28;AZEV4;10/10/2024;22:48;Protocolos para a Combinação de Negócios Termos e Condições Atualizados e Convocação de AGE;https://www.rad.cvm.gov.br/ENET/frmDownloadDocumento.aspx?Tela=ext&numProtocolo=1290834&descTipo=IPE&CodigoInstituicao=1
29;AZEV4;10/10/2024;17:40;Participação de membro do Conselho de Administração em evento online;https://www.rad.cvm.gov.br/ENET/frmDownloadDocumento.aspx?Tela=ext&numProtocolo=1290477&descTipo=IPE&CodigoInstituicao=1
30;AZEV4;30/09/2024;08:53;Eleição de Diretoria Executiva e Conselho de Administração da A&T Energia;https://www.rad.cvm.gov.br/ENET/frmDownloadDocumento.aspx?Tela=ext&numProtocolo=1286245&descTipo=IPE&CodigoInstituicao=1
31;AZEV4;27/09/2024;12:08;Celebração dos Protocolos para a Combinação de Negócios;https://www.rad.cvm.gov.br/ENET/frmDownloadDocumento.aspx?Tela=ext&numProtocolo=1285855&descTipo=IPE&CodigoInstituicao=1
32;AZEV4;27/09/2024;09:01;Celebração dos Protocolos para a Combinação de Negócios;https://www.rad.cvm.gov.br/ENET/frmDownloadDocumento.aspx?Tela=ext&numProtocolo=1285784&descTipo=IPE&CodigoInstituicao=1
33;AZEV4;25/09/2024;21:38;Aquisição A&T Engenharia e Manutenção S.A.;https://www.rad.cvm.gov.br/ENET/frmDownloadDocumento.aspx?Tela=ext&numProtocolo=1285303&descTipo=IPE&CodigoInstituicao=1
34;AZEV4;24/09/2024;19:36;Homologação de Aumento de Capital Social;https://www.rad.cvm.gov.br/ENET/frmDownloadDocumento.aspx?Tela=ext&numProtocolo=1284900&descTipo=IPE&CodigoInstituicao=1
35;AZEV4;23/09/2024;18:07;Participação de Membro do CA em Live.;https://www.rad.cvm.gov.br/ENET/frmDownloadDocumento.aspx?Tela=ext&numProtocolo=1284420&descTipo=IPE&CodigoInstituicao=1
36;AZEV4;17/09/2024;17:50;Participação de membro do Conselho de Administração em evento online;https://www.rad.cvm.gov.br/ENET/frmDownloadDocumento.aspx?Tela=ext&numProtocolo=1283000&descTipo=IPE&CodigoInstituicao=1
37;AZEV4;10/09/2024;07:38;Assinatura de Acordo de Associação para Combinação de Negócios;https://www.rad.cvm.gov.br/ENET/frmDownloadDocumento.aspx?Tela=ext&numProtocolo=1280471&descTipo=IPE&CodigoInstituicao=1
38;AZEV4;04/09/2024;21:50;Prorrogação Prazo MOU;https://www.rad.cvm.gov.br/ENET/frmDownloadDocumento.aspx?Tela=ext&numProtocolo=1278801&descTipo=IPE&CodigoInstituicao=1
39;AZEV4;22/08/2024;08:36;Novo Diretor Operacional e Diretor Financeiro;https://www.rad.cvm.gov.br/ENET/frmDownloadDocumento.aspx?Tela=ext&numProtocolo=1274711&descTipo=IPE&CodigoInstituicao=1
40;AZEV4;05/08/2024;18:13;Homologação de Aumento de Capital Social;https://www.rad.cvm.gov.br/ENET/frmDownloadDocumento.aspx?Tela=ext&numProtocolo=1266795&descTipo=IPE&CodigoInstituicao=1
41;AZEV4;04/07/2024;08:09;Assinatura de Memorando de Entendimentos Vinculante para Combinação de Negócios;https://www.rad.cvm.gov.br/ENET/frmDownloadDocumento.aspx?Tela=ext&numProtocolo=1256736&descTipo=IPE&CodigoInstituicao=1
42;AZEV4;27/06/2024;20:02;Recebimento de Proposta para Combinação de Negócios;https://www.rad.cvm.gov.br/ENET/frmDownloadDocumento.aspx?Tela=ext&numProtocolo=1254406&descTipo=IPE&CodigoInstituicao=1
43;AZEV4;24/06/2024;08:44;Contrato de Parceria e Opção de Cessão de Participação;https://www.rad.cvm.gov.br/ENET/frmDownloadDocumento.aspx?Tela=ext&numProtocolo=1252764&descTipo=IPE&CodigoInstituicao=1
44;AZEV4;21/06/2024;19:29;Homologação de Aumento de Capital Social;https://www.rad.cvm.gov.br/ENET/frmDownloadDocumento.aspx?Tela=ext&numProtocolo=1252599&descTipo=IPE&CodigoInstituicao=1
45;AZEV4;17/06/2024;22:21;Aquisição da Phoenix Óleo e Gás Ltda;https://www.rad.cvm.gov.br/ENET/frmDownloadDocumento.aspx?Tela=ext&numProtocolo=1250940&descTipo=IPE&CodigoInstituicao=1
46;AZEV4;11/06/2024;16:01;Homologação Parcial de Aumento de Capital Social;https://www.rad.cvm.gov.br/ENET/frmDownloadDocumento.aspx?Tela=ext&numProtocolo=1248994&descTipo=IPE&CodigoInstituicao=1
47;AZEV4;10/06/2024;18:31;Homologação Parcial de Aumento de Capital Social;https://www.rad.cvm.gov.br/ENET/frmDownloadDocumento.aspx?Tela=ext&numProtocolo=1248466&descTipo=IPE&CodigoInstituicao=1
48;AZEV4;22/05/2024;18:37;Alteração do Calendário Anual de Eventos Corporativos;https://www.rad.cvm.gov.br/ENET/frmDownloadDocumento.aspx?Tela=ext&numProtocolo=1241496&descTipo=IPE&CodigoInstituicao=1
49;AZEV4;14/05/2024;18:40;Alteração do Calendário Anual de Eventos Corporativos;https://www.rad.cvm.gov.br/ENET/frmDownloadDocumento.aspx?Tela=ext&numProtocolo=1238131&descTipo=IPE&CodigoInstituicao=1
50;AZEV4;06/05/2024;09:00;Entrada no Índice SMALL CAPS (B3);https://www.rad.cvm.gov.br/ENET/frmDownloadDocumento.aspx?Tela=ext&numProtocolo=1232841&descTipo=IPE&CodigoInstituicao=1
51;AZEV4;03/05/2024;20:36;Alteração dos Prazos de Exercício dos Bônus de Subscrição;https://www.rad.cvm.gov.br/ENET/frmDownloadDocumento.aspx?Tela=ext&numProtocolo=1232523&descTipo=IPE&CodigoInstituicao=1
52;AZEV4;23/04/2024;22:43;Alteração do Calendário Anual de Eventos Corporativos;https://www.rad.cvm.gov.br/ENET/frmDownloadDocumento.aspx?Tela=ext&numProtocolo=1224941&descTipo=IPE&CodigoInstituicao=1
53;AZEV4;03/04/2024;23:18;Aquisição de Contratos de Concessão de Exploração e Óleo e Gás Natural;https://www.rad.cvm.gov.br/ENET/frmDownloadDocumento.aspx?Tela=ext&numProtocolo=1217916&descTipo=IPE&CodigoInstituicao=1
54;AZEV4;02/04/2024;08:26;Nomeação de Diretor Executivo de Exploração & Produção da Azevedo & Travassos Petróleo;https://www.rad.cvm.gov.br/ENET/frmDownloadDocumento.aspx?Tela=ext&numProtocolo=1216695&descTipo=IPE&CodigoInstituicao=1
55;AZEV4;01/04/2024;08:25;Assinatura de Contrato EPCIC com a Equinor;https://www.rad.cvm.gov.br/ENET/frmDownloadDocumento.aspx?Tela=ext&numProtocolo=1215868&descTipo=IPE&CodigoInstituicao=1
56;AZEV4;29/03/2024;22:18;Divulgação das Demonstrações Financeira (não auditadas) referentes ao Exercício Social de 2023;https://www.rad.cvm.gov.br/ENET/frmDownloadDocumento.aspx?Tela=ext&numProtocolo=1215762&descTipo=IPE&CodigoInstituicao=1
57;AZEV4;22/03/2024;19:48;Alteração do Calendário Anual de Eventos Corporativos;https://www.rad.cvm.gov.br/ENET/frmDownloadDocumento.aspx?Tela=ext&numProtocolo=1211318&descTipo=IPE&CodigoInstituicao=1
58;AZEV4;09/03/2024;12:48;Esclarecimentos sobre questionamentos da CVM/B3  Notícia divulgada na mídia;https://www.rad.cvm.gov.br/ENET/frmDownloadDocumento.aspx?Tela=ext&numProtocolo=1205482&descTipo=IPE&CodigoInstituicao=1
59;AZEV4;06/03/2024;10:00;ASSINATURA DE MEMORANDO DE ENTENDIMENTO (MOU) COM A EMPRESA GBC PARTICIPAÇÕES LTDA;https://www.rad.cvm.gov.br/ENET/frmDownloadDocumento.aspx?Tela=ext&numProtocolo=1203526&descTipo=IPE&CodigoInstituicao=1
60;AZEV4;30/01/2024;18:07;Live com Mercado;https://www.rad.cvm.gov.br/ENET/frmDownloadDocumento.aspx?Tela=ext&numProtocolo=1187583&descTipo=IPE&CodigoInstituicao=1
61;AZEV4;19/12/2023;08:48;Carta de Intenção com a Equinor;https://www.rad.cvm.gov.br/ENET/frmDownloadDocumento.aspx?Tela=ext&numProtocolo=1175173&descTipo=IPE&CodigoInstituicao=1
62;AZEV4;28/11/2023;19:28;Início de Negociação dos Bônus de Subscrição;https://www.rad.cvm.gov.br/ENET/frmDownloadDocumento.aspx?Tela=ext&numProtocolo=1167091&descTipo=IPE&CodigoInstituicao=1
63;AZEV4;21/11/2023;18:03;Participação de Executivo em Live;https://www.rad.cvm.gov.br/ENET/frmDownloadDocumento.aspx?Tela=ext&numProtocolo=1165341&descTipo=IPE&CodigoInstituicao=1
64;AZEV4;17/11/2023;08:27;Homologação do Aumento de Capital Privado;https://www.rad.cvm.gov.br/ENET/frmDownloadDocumento.aspx?Tela=ext&numProtocolo=1163823&descTipo=IPE&CodigoInstituicao=1
65;AZEV4;25/10/2023;21:32;Renuncia Conselho de Administração;https://www.rad.cvm.gov.br/ENET/frmDownloadDocumento.aspx?Tela=ext&numProtocolo=1154332&descTipo=IPE&CodigoInstituicao=1
66;AZEV4;20/10/2023;19:15;Encerramento do Prazo para Exercício do Direito de Preferência e Abertura do Prazo para Subscrição de Sobras;https://www.rad.cvm.gov.br/ENET/frmDownloadDocumento.aspx?Tela=ext&numProtocolo=1153326&descTipo=IPE&CodigoInstituicao=1
67;AZEV4;17/10/2023;22:19;Homologação Bônus Subscrição;https://www.rad.cvm.gov.br/ENET/frmDownloadDocumento.aspx?Tela=ext&numProtocolo=1152379&descTipo=IPE&CodigoInstituicao=1
68;AZEV4;09/10/2023;08:48;ASSINATURA DE MEMORANDO DE ENTENDIMENTO (MOU) COM A EMPRESA BTV CAPITAL E NION ENERGY LLC;https://www.rad.cvm.gov.br/ENET/frmDownloadDocumento.aspx?Tela=ext&numProtocolo=1149706&descTipo=IPE&CodigoInstituicao=1
69;AZEV4;05/10/2023;19:44;Homologação Bônus Subscrição;https://www.rad.cvm.gov.br/ENET/frmDownloadDocumento.aspx?Tela=ext&numProtocolo=1149196&descTipo=IPE&CodigoInstituicao=1
70;AZEV4;03/10/2023;17:19;Participação de Membro do Conselho em Live;https://www.rad.cvm.gov.br/ENET/frmDownloadDocumento.aspx?Tela=ext&numProtocolo=1148256&descTipo=IPE&CodigoInstituicao=1
71;AZEV4;25/09/2023;21:46;Prorrogação do Prazo de Exercício do Direito de Preferência e Subscrição de Ações no  Aumento do Capital Social da Companhia deliberado pelo Conselho de Administração em 28  de agosto de 2023;https://www.rad.cvm.gov.br/ENET/frmDownloadDocumento.aspx?Tela=ext&numProtocolo=1145966&descTipo=IPE&CodigoInstituicao=1
72;AZEV4;14/09/2023;08:34;Consolidação dos Valores Incluídos na Transação Individual Proposta perante à Procuradoria da Fazenda Nacional;https://www.rad.cvm.gov.br/ENET/frmDownloadDocumento.aspx?Tela=ext&numProtocolo=1143203&descTipo=IPE&CodigoInstituicao=1
73;AZEV4;31/08/2023;09:48;Plano Prévio de Liquidação das Execuções (PPLE) ;https://www.rad.cvm.gov.br/ENET/frmDownloadDocumento.aspx?Tela=ext&numProtocolo=1138902&descTipo=IPE&CodigoInstituicao=1
74;AZEV4;28/08/2023;18:11;Aumento de Capital Privado e Emissão de Bônus de Subscrição;https://www.rad.cvm.gov.br/ENET/frmDownloadDocumento.aspx?Tela=ext&numProtocolo=1137890&descTipo=IPE&CodigoInstituicao=1
75;AZEV4;24/08/2023;08:02;ASSINATURA DE MEMORANDO DE ENTENDIMENTO (MOU) COM A EMPRESA PETROIL ÓLEO E GÁS LTDA;https://www.rad.cvm.gov.br/ENET/frmDownloadDocumento.aspx?Tela=ext&numProtocolo=1136806&descTipo=IPE&CodigoInstituicao=1
76;AZEV4;16/08/2023;17:26;Participação de Membro do Conselho da Companhia em Evento Online;https://www.rad.cvm.gov.br/ENET/frmDownloadDocumento.aspx?Tela=ext&numProtocolo=1134758&descTipo=IPE&CodigoInstituicao=1
77;AZEV4;08/08/2023;08:30;Celebração de acordo com o Ministério Público do Trabalho perante a Justiça do Trabalho de Florianópolis;https://www.rad.cvm.gov.br/ENET/frmDownloadDocumento.aspx?Tela=ext&numProtocolo=1130462&descTipo=IPE&CodigoInstituicao=1
78;AZEV4;27/07/2023;17:39;Participação de Executivo em Live;https://www.rad.cvm.gov.br/ENET/frmDownloadDocumento.aspx?Tela=ext&numProtocolo=1126061&descTipo=IPE&CodigoInstituicao=1
79;AZEV4;25/07/2023;19:06;Homologação de Aumento de Capital Social;https://www.rad.cvm.gov.br/ENET/frmDownloadDocumento.aspx?Tela=ext&numProtocolo=1125184&descTipo=IPE&CodigoInstituicao=1
80;AZEV4;24/07/2023;23:28;Homologação de Aumento de Capital Social;https://www.rad.cvm.gov.br/ENET/frmDownloadDocumento.aspx?Tela=ext&numProtocolo=1124907&descTipo=IPE&CodigoInstituicao=1
81;AZEV4;19/07/2023;08:43;Bonus de Subscrição;https://www.rad.cvm.gov.br/ENET/frmDownloadDocumento.aspx?Tela=ext&numProtocolo=1123647&descTipo=IPE&CodigoInstituicao=1
82;AZEV4;10/07/2023;08:45;Obras Contorno Viário de Florianópolis;https://www.rad.cvm.gov.br/ENET/frmDownloadDocumento.aspx?Tela=ext&numProtocolo=1120921&descTipo=IPE&CodigoInstituicao=1
83;AZEV4;04/07/2023;18:11;Assinatura de Contrato com a Ecorodovias;https://www.rad.cvm.gov.br/ENET/frmDownloadDocumento.aspx?Tela=ext&numProtocolo=1119363&descTipo=IPE&CodigoInstituicao=1
84;AZEV4;27/06/2023;18:37;CONTRATAÇÃO DE FORMADOR DE MERCADO;https://www.rad.cvm.gov.br/ENET/frmDownloadDocumento.aspx?Tela=ext&numProtocolo=1117105&descTipo=IPE&CodigoInstituicao=1
85;AZEV4;22/06/2023;20:44;Incorporação da subsidiária integral Azevedo e Travassos Petróleo e Azevedo e Travassos Internacional;https://www.rad.cvm.gov.br/ENET/frmDownloadDocumento.aspx?Tela=ext&numProtocolo=1115951&descTipo=IPE&CodigoInstituicao=1
86;AZEV4;21/06/2023;20:32;Assinatura de Contrato para Realização de Projeto com a Petrobras.;https://www.rad.cvm.gov.br/ENET/frmDownloadDocumento.aspx?Tela=ext&numProtocolo=1115590&descTipo=IPE&CodigoInstituicao=1
87;AZEV4;20/06/2023;18:30; Prorrogação do Prazo de Exercício dos Bônus de Subscrição;https://www.rad.cvm.gov.br/ENET/frmDownloadDocumento.aspx?Tela=ext&numProtocolo=1115068&descTipo=IPE&CodigoInstituicao=1
88;AZEV4;30/05/2023;17:58;Deferimento da Transação Individual Proposta perante à Procuradoria da Fazenda Nacional;https://www.rad.cvm.gov.br/ENET/frmDownloadDocumento.aspx?Tela=ext&numProtocolo=1107721&descTipo=IPE&CodigoInstituicao=1
89;AZEV4;04/04/2023;09:20;Novo Diretor Financeiro e de Governança Corporativa;https://www.rad.cvm.gov.br/ENET/frmDownloadDocumento.aspx?Tela=ext&numProtocolo=1082259&descTipo=IPE&CodigoInstituicao=1
90;AZEV4;28/03/2023;17:17;Apresentação de Webinar dos Resultados Referentes ao Exercício Social de 2022;https://www.rad.cvm.gov.br/ENET/frmDownloadDocumento.aspx?Tela=ext&numProtocolo=1078433&descTipo=IPE&CodigoInstituicao=1
91;AZEV4;27/03/2023;18:00;Alteração do Calendário Anual de Eventos Corporativos;https://www.rad.cvm.gov.br/ENET/frmDownloadDocumento.aspx?Tela=ext&numProtocolo=1077639&descTipo=IPE&CodigoInstituicao=1
92;AZEV4;29/12/2022;18:39;Novo Diretor Presidente;https://www.rad.cvm.gov.br/ENET/frmDownloadDocumento.aspx?Tela=ext&numProtocolo=1045568&descTipo=IPE&CodigoInstituicao=1
93;AZEV4;26/12/2022;07:47;Assinatura de Contrato para Construção de Gasodutos;https://www.rad.cvm.gov.br/ENET/frmDownloadDocumento.aspx?Tela=ext&numProtocolo=1044430&descTipo=IPE&CodigoInstituicao=1
94;AZEV4;30/11/2022;20:34;Projeções Divulgadas;https://www.rad.cvm.gov.br/ENET/frmDownloadDocumento.aspx?Tela=ext&numProtocolo=1037076&descTipo=IPE&CodigoInstituicao=1
95;AZEV4;11/11/2022;18:35;Divulgação e Apresentação de Webinar dos Resultados do Terceiro Trimestre de 2022;https://www.rad.cvm.gov.br/ENET/frmDownloadDocumento.aspx?Tela=ext&numProtocolo=1032160&descTipo=IPE&CodigoInstituicao=1
96;AZEV4;19/10/2022;20:40;Nota de Falecimento de Membro Efetivo do Conselho Fiscal;https://www.rad.cvm.gov.br/ENET/frmDownloadDocumento.aspx?Tela=ext&numProtocolo=1023195&descTipo=IPE&CodigoInstituicao=1
97;AZEV4;19/10/2022;18:39;Início de Negociação dos Bônus de Subscrição;https://www.rad.cvm.gov.br/ENET/frmDownloadDocumento.aspx?Tela=ext&numProtocolo=1023117&descTipo=IPE&CodigoInstituicao=1
98;AZEV4;13/10/2022;19:51;Assinatura de Contrato para Realização de Obras do Contorno Viário de Florianópolis e Interseções com a BR 282 e BR 101;https://www.rad.cvm.gov.br/ENET/frmDownloadDocumento.aspx?Tela=ext&numProtocolo=1022004&descTipo=IPE&CodigoInstituicao=1
99;AZEV4;04/10/2022;18:13;Eleição de Diretores;https://www.rad.cvm.gov.br/ENET/frmDownloadDocumento.aspx?Tela=ext&numProtocolo=1019578&descTipo=IPE&CodigoInstituicao=1
