;Acao;Data;Hora;Descrição;Link
0;AZTE3;15/01/2026;08:36;Boletim de Resultados Operacionais - Dezembro de 2025;https://www.rad.cvm.gov.br/ENET/frmDownloadDocumento.aspx?Tela=ext&numProtocolo=1467347&descTipo=IPE&CodigoInstituicao=1
1;AZTE3;14/01/2026;15:44;Participação do Presidente do Conselho de Administração em Live;https://www.rad.cvm.gov.br/ENET/frmDownloadDocumento.aspx?Tela=ext&numProtocolo=1467106&descTipo=IPE&CodigoInstituicao=1
2;AZTE3;19/12/2025;18:14;Resultados Operacionais - Novembro de 2025;https://www.rad.cvm.gov.br/ENET/frmDownloadDocumento.aspx?Tela=ext&numProtocolo=1459609&descTipo=IPE&CodigoInstituicao=1
3;AZTE3;19/11/2025;19:23;Resultados Operacionais | Outubro de 2025;https://www.rad.cvm.gov.br/ENET/frmDownloadDocumento.aspx?Tela=ext&numProtocolo=1447535&descTipo=IPE&CodigoInstituicao=1
4;AZTE3;29/10/2025;18:45;Prorrogação do prazo de enquadramento do valor de cotação das ações;https://www.rad.cvm.gov.br/ENET/frmDownloadDocumento.aspx?Tela=ext&numProtocolo=1437117&descTipo=IPE&CodigoInstituicao=1
5;AZTE3;14/10/2025;19:25;Resultados Operacionais | Setembro de 2025;https://www.rad.cvm.gov.br/ENET/frmDownloadDocumento.aspx?Tela=ext&numProtocolo=1432740&descTipo=IPE&CodigoInstituicao=1
6;AZTE3;01/10/2025;18:50;Aquisição de Participação Relevante;https://www.rad.cvm.gov.br/ENET/frmDownloadDocumento.aspx?Tela=ext&numProtocolo=1428540&descTipo=IPE&CodigoInstituicao=1
7;AZTE3;19/09/2025;11:07;Conclusão da Avaliação do Poço 3-AND-5-RN;https://www.rad.cvm.gov.br/ENET/frmDownloadDocumento.aspx?Tela=ext&numProtocolo=1424949&descTipo=IPE&CodigoInstituicao=1
8;AZTE3;19/09/2025;08:22;Atualização Sobre o Memorando de Entendimentos Vinculante (MOU) com a Empresa Petro-Victory Energy Corp;https://www.rad.cvm.gov.br/ENET/frmDownloadDocumento.aspx?Tela=ext&numProtocolo=1424901&descTipo=IPE&CodigoInstituicao=1
9;AZTE3;17/09/2025;20:56;Conclusão da perfuração do poço 3-AND-5-RN;https://www.rad.cvm.gov.br/ENET/frmDownloadDocumento.aspx?Tela=ext&numProtocolo=1424518&descTipo=IPE&CodigoInstituicao=1
10;AZTE3;16/09/2025;18:35;Resultados Operacionais | Agosto de 2025;https://www.rad.cvm.gov.br/ENET/frmDownloadDocumento.aspx?Tela=ext&numProtocolo=1424072&descTipo=IPE&CodigoInstituicao=1
11;AZTE3;03/09/2025;09:12;Qualificação da Subsidiária Azevedo & Travassos Petróleo S.A. pela ANP como Operadora C;https://www.rad.cvm.gov.br/ENET/frmDownloadDocumento.aspx?Tela=ext&numProtocolo=1419500&descTipo=IPE&CodigoInstituicao=1
12;AZTE3;25/08/2025;20:36;Início de Negociação dos Bônus de Subscrição;https://www.rad.cvm.gov.br/ENET/frmDownloadDocumento.aspx?Tela=ext&numProtocolo=1416893&descTipo=IPE&CodigoInstituicao=1
13;AZTE3;25/08/2025;20:36;Início de Negociação dos Bônus de Subscrição;https://www.rad.cvm.gov.br/ENET/frmDownloadDocumento.aspx?Tela=ext&numProtocolo=1416894&descTipo=IPE&CodigoInstituicao=1
14;AZTE3;25/08/2025;20:03;Início de Negociação dos Bônus de Subscrição;https://www.rad.cvm.gov.br/ENET/frmDownloadDocumento.aspx?Tela=ext&numProtocolo=1416889&descTipo=IPE&CodigoInstituicao=1
15;AZTE3;25/08/2025;19:52;Início de Negociação dos Bônus de Subscrição;https://www.rad.cvm.gov.br/ENET/frmDownloadDocumento.aspx?Tela=ext&numProtocolo=1416888&descTipo=IPE&CodigoInstituicao=1
16;AZTE3;13/08/2025;08:40;Resultados Operacionais | Julho de 2025;https://www.rad.cvm.gov.br/ENET/frmDownloadDocumento.aspx?Tela=ext&numProtocolo=1412382&descTipo=IPE&CodigoInstituicao=1
17;AZTE3;06/08/2025;18:27;Homologação de Aumento de Capital Privado e Emissão de Bônus de Subscrição ;https://www.rad.cvm.gov.br/ENET/frmDownloadDocumento.aspx?Tela=ext&numProtocolo=1408924&descTipo=IPE&CodigoInstituicao=1
18;AZTE3;06/08/2025;18:27;Homologação de Aumento de Capital Privado e Emissão de Bônus de Subscrição;https://www.rad.cvm.gov.br/ENET/frmDownloadDocumento.aspx?Tela=ext&numProtocolo=1408929&descTipo=IPE&CodigoInstituicao=1
19;AZTE3;24/07/2025;19:53;Resultados Operacionais | Junho de 2025;https://www.rad.cvm.gov.br/ENET/frmDownloadDocumento.aspx?Tela=ext&numProtocolo=1403912&descTipo=IPE&CodigoInstituicao=1
20;AZTE3;24/07/2025;19:31;Resultados Operacionais | Junho de 2025;https://www.rad.cvm.gov.br/ENET/frmDownloadDocumento.aspx?Tela=ext&numProtocolo=1403904&descTipo=IPE&CodigoInstituicao=1
21;AZTE3;17/07/2025;20:19;Encerramento do Prazo para Exercício do Direito de Preferência e Abertura do Prazo para Subscrição de Sobras;https://www.rad.cvm.gov.br/ENET/frmDownloadDocumento.aspx?Tela=ext&numProtocolo=1401883&descTipo=IPE&CodigoInstituicao=1
22;AZTE3;17/07/2025;20:19;Encerramento do Prazo para Exercício do Direito de Preferência e Abertura do Prazo para Subscrição de Sobras;https://www.rad.cvm.gov.br/ENET/frmDownloadDocumento.aspx?Tela=ext&numProtocolo=1401884&descTipo=IPE&CodigoInstituicao=1
23;AZTE3;08/07/2025;20:05;Comunicado ao Mercado | ATE realiza live para esclarecimentos sobre Memorando com Petro-Victory;https://www.rad.cvm.gov.br/ENET/frmDownloadDocumento.aspx?Tela=ext&numProtocolo=1399044&descTipo=IPE&CodigoInstituicao=1
24;AZTE3;08/07/2025;09:21;Comunicado ao Mercado | Conclusão da perfuração do poço 3-AND-5-RN;https://www.rad.cvm.gov.br/ENET/frmDownloadDocumento.aspx?Tela=ext&numProtocolo=1398579&descTipo=IPE&CodigoInstituicao=1
25;AZTE3;07/07/2025;20:53;Comunicado ao Mercado | ATE realiza live para esclarecimentos sobre Memorando com Petro-Victory;https://www.rad.cvm.gov.br/ENET/frmDownloadDocumento.aspx?Tela=ext&numProtocolo=1398531&descTipo=IPE&CodigoInstituicao=1
26;AZTE3;03/07/2025;19:21;Fato Relevante | Assinatura de Memorando de Entendimentos com a empresa Petro-Victory Energy Corp.;https://www.rad.cvm.gov.br/ENET/frmDownloadDocumento.aspx?Tela=ext&numProtocolo=1397797&descTipo=IPE&CodigoInstituicao=1
27;AZTE3;03/07/2025;18:48;Fato Relevante | Assinatura de Memorando de Entendimentos com a empresa Petro-Victory Energy Corp.;https://www.rad.cvm.gov.br/ENET/frmDownloadDocumento.aspx?Tela=ext&numProtocolo=1397783&descTipo=IPE&CodigoInstituicao=1
28;AZTE3;03/07/2025;08:43;Fato Relevante | Assinatura de Memorando de Entendimentos com a empresa Petro-Victory Energy Corp.;https://www.rad.cvm.gov.br/ENET/frmDownloadDocumento.aspx?Tela=ext&numProtocolo=1397424&descTipo=IPE&CodigoInstituicao=1
29;AZTE3;30/06/2025;09:02;Comunicado ao Mercado | Contrato de compra e venda do gás produzido no Polo Periquito;https://www.rad.cvm.gov.br/ENET/frmDownloadDocumento.aspx?Tela=ext&numProtocolo=1395158&descTipo=IPE&CodigoInstituicao=1
30;AZTE3;24/06/2025;19:34;Resultados Operacionais | Maio de 2025;https://www.rad.cvm.gov.br/ENET/frmDownloadDocumento.aspx?Tela=ext&numProtocolo=1393725&descTipo=IPE&CodigoInstituicao=1
31;AZTE3;20/06/2025;08:19;Comunicado ao Mercado | Início de nova campanha de perfuração no Campo de Andorinha;https://www.rad.cvm.gov.br/ENET/frmDownloadDocumento.aspx?Tela=ext&numProtocolo=1392091&descTipo=IPE&CodigoInstituicao=1
32;AZTE3;14/06/2025;18:40;Plano para Reenquadramento das Ações ao Regulamento da B3;https://www.rad.cvm.gov.br/ENET/frmDownloadDocumento.aspx?Tela=ext&numProtocolo=1390734&descTipo=IPE&CodigoInstituicao=1
33;AZTE3;06/06/2025;23:40;Aumento de Capital Privado e Emissão de Bônus de Subscrição;https://www.rad.cvm.gov.br/ENET/frmDownloadDocumento.aspx?Tela=ext&numProtocolo=1388133&descTipo=IPE&CodigoInstituicao=1
34;AZTE3;06/06/2025;22:45;Aumento do capital social da companhia e emissão de bônus de subscrição;https://www.rad.cvm.gov.br/ENET/frmDownloadDocumento.aspx?Tela=ext&numProtocolo=1388121&descTipo=IPE&CodigoInstituicao=1
35;AZTE3;02/06/2025;08:34;Comunicado ao Mercado | Redução da alíquota de royalties de Tanatau e prorrogação do contrato de concessão bloco 610;https://www.rad.cvm.gov.br/ENET/frmDownloadDocumento.aspx?Tela=ext&numProtocolo=1385399&descTipo=IPE&CodigoInstituicao=1
36;AZTE3;19/05/2025;19:53;Resultados Operacionais | Abril de 2025;https://www.rad.cvm.gov.br/ENET/frmDownloadDocumento.aspx?Tela=ext&numProtocolo=1380675&descTipo=IPE&CodigoInstituicao=1
37;AZTE3;16/04/2025;07:03;Resultados operacionais - Março de 2025;https://www.rad.cvm.gov.br/ENET/frmDownloadDocumento.aspx?Tela=ext&numProtocolo=1361849&descTipo=IPE&CodigoInstituicao=1
38;AZTE3;28/03/2025;09:29;Início da Produção Antecipada do Campo de Tanatau;https://www.rad.cvm.gov.br/ENET/frmDownloadDocumento.aspx?Tela=ext&numProtocolo=1353130&descTipo=IPE&CodigoInstituicao=1
39;AZTE3;18/03/2025;18:18;Boletim de resultados operacionais | Fevereiro de 2025;https://www.rad.cvm.gov.br/ENET/frmDownloadDocumento.aspx?Tela=ext&numProtocolo=1348235&descTipo=IPE&CodigoInstituicao=1
40;AZTE3;05/03/2025;08:00;Conclusão da Construção e Comissionamento das Instalações de Produção Comercial de Gás na Estação Coletora do Campo de Periquito;https://www.rad.cvm.gov.br/ENET/frmDownloadDocumento.aspx?Tela=ext&numProtocolo=1341872&descTipo=IPE&CodigoInstituicao=1
41;AZTE3;12/02/2025;09:02;Alteração do DRI;https://www.rad.cvm.gov.br/ENET/frmDownloadDocumento.aspx?Tela=ext&numProtocolo=1333797&descTipo=IPE&CodigoInstituicao=1
42;AZTE3;10/02/2025;08:49;Aquisição dos Ativos Polo Porto Carão e Polo Barrinha pela Azevedo & Travassos Petróleo S.A.;https://www.rad.cvm.gov.br/ENET/frmDownloadDocumento.aspx?Tela=ext&numProtocolo=1332350&descTipo=IPE&CodigoInstituicao=1
43;AZTE3;31/01/2025;07:11;Reorganização Societária - Incorporação, Cisão ou Fusão da Companhia;https://www.rad.cvm.gov.br/ENET/frmDownloadDocumento.aspx?Tela=ext&numProtocolo=1329073&descTipo=IPE&CodigoInstituicao=1
44;AZTE3;15/01/2025;22:19;Obtenção do registro de companhia aberta na categoria ?A? pela Azevedo & Travassos Energia S.A;https://www.rad.cvm.gov.br/ENET/frmDownloadDocumento.aspx?Tela=ext&numProtocolo=1325454&descTipo=IPE&CodigoInstituicao=1
45;AZTE3;18/10/2024;18:43;Aprovação da Combinação de Negócios;https://www.rad.cvm.gov.br/ENET/frmDownloadDocumento.aspx?Tela=ext&numProtocolo=1292873&descTipo=IPE&CodigoInstituicao=1
