;Acao;Data;Hora;Descrição;Link
0;CAML3;16/12/2025;18:33;Dividendos/Juros sobre Capital Próprio;https://www.rad.cvm.gov.br/ENET/frmDownloadDocumento.aspx?Tela=ext&numProtocolo=1458125&descTipo=IPE&CodigoInstituicao=1
1;CAML3;27/11/2025;18:14;Dividendos/Juros sobre Capital Próprio;https://www.rad.cvm.gov.br/ENET/frmDownloadDocumento.aspx?Tela=ext&numProtocolo=1450582&descTipo=IPE&CodigoInstituicao=1
2;CAML3;25/11/2025;18:12;Comunicado Transação Partes Relacionadas;https://www.rad.cvm.gov.br/ENET/frmDownloadDocumento.aspx?Tela=ext&numProtocolo=1449386&descTipo=IPE&CodigoInstituicao=1
3;CAML3;21/11/2025;18:08;Conclusão da 15ª Emissão de Debentures;https://www.rad.cvm.gov.br/ENET/frmDownloadDocumento.aspx?Tela=ext&numProtocolo=1448073&descTipo=IPE&CodigoInstituicao=1
4;CAML3;13/10/2025;20:30;APROVAÇÃO DA 15ª EMISSÃO DE DEBÊNTURES;https://www.rad.cvm.gov.br/ENET/frmDownloadDocumento.aspx?Tela=ext&numProtocolo=1432291&descTipo=IPE&CodigoInstituicao=1
5;CAML3;01/09/2025;22:33;Conclusão Da Aquisição Pela Camilatam Da Rice Paraguay S.A. E Da Villa Oliva Rice S.A. ;https://www.rad.cvm.gov.br/ENET/frmDownloadDocumento.aspx?Tela=ext&numProtocolo=1418932&descTipo=IPE&CodigoInstituicao=1
6;CAML3;28/08/2025;18:38;Dividendos/Juros sobre Capital Próprio;https://www.rad.cvm.gov.br/ENET/frmDownloadDocumento.aspx?Tela=ext&numProtocolo=1418120&descTipo=IPE&CodigoInstituicao=1
7;CAML3;04/07/2025;19:22;Alteração Calendário de Eventos Corporativo;https://www.rad.cvm.gov.br/ENET/frmDownloadDocumento.aspx?Tela=ext&numProtocolo=1398099&descTipo=IPE&CodigoInstituicao=1
8;CAML3;27/06/2025;19:15;Plano de Outorga de Opção de Compra de Ações;https://www.rad.cvm.gov.br/ENET/frmDownloadDocumento.aspx?Tela=ext&numProtocolo=1395074&descTipo=IPE&CodigoInstituicao=1
9;CAML3;13/06/2025;18:17;Dividendos/Juros sobre Capital Próprio;https://www.rad.cvm.gov.br/ENET/frmDownloadDocumento.aspx?Tela=ext&numProtocolo=1390611&descTipo=IPE&CodigoInstituicao=1
10;CAML3;27/02/2025;18:10;Dividendos/Juros sobre Capital Próprio;https://www.rad.cvm.gov.br/ENET/frmDownloadDocumento.aspx?Tela=ext&numProtocolo=1340688&descTipo=IPE&CodigoInstituicao=1
11;CAML3;15/01/2025;10:02;Diminuição de Participação Acionária Relevante;https://www.rad.cvm.gov.br/ENET/frmDownloadDocumento.aspx?Tela=ext&numProtocolo=1325049&descTipo=IPE&CodigoInstituicao=1
12;CAML3;19/11/2024;08:21;Closing da operação Villa Oliva ;https://www.rad.cvm.gov.br/ENET/frmDownloadDocumento.aspx?Tela=ext&numProtocolo=1305852&descTipo=IPE&CodigoInstituicao=1
13;CAML3;19/11/2024;08:21;Comunicado sobre transação partes relacionadas;https://www.rad.cvm.gov.br/ENET/frmDownloadDocumento.aspx?Tela=ext&numProtocolo=1305853&descTipo=IPE&CodigoInstituicao=1
14;CAML3;14/11/2024;07:32;Dividendos/Juros sobre Capital Próprio;https://www.rad.cvm.gov.br/ENET/frmDownloadDocumento.aspx?Tela=ext&numProtocolo=1303948&descTipo=IPE&CodigoInstituicao=1
15;CAML3;09/09/2024;19:43;Nova aquisição;https://www.rad.cvm.gov.br/ENET/frmDownloadDocumento.aspx?Tela=ext&numProtocolo=1280325&descTipo=IPE&CodigoInstituicao=1
16;CAML3;05/09/2024;18:22;Nova aquisição;https://www.rad.cvm.gov.br/ENET/frmDownloadDocumento.aspx?Tela=ext&numProtocolo=1279219&descTipo=IPE&CodigoInstituicao=1
17;CAML3;29/08/2024;18:27;Dividendos/Juros sobre Capital Próprio;https://www.rad.cvm.gov.br/ENET/frmDownloadDocumento.aspx?Tela=ext&numProtocolo=1276928&descTipo=IPE&CodigoInstituicao=1
18;CAML3;28/06/2024;18:41;Alteração de jornal de grande circulação;https://www.rad.cvm.gov.br/ENET/frmDownloadDocumento.aspx?Tela=ext&numProtocolo=1254873&descTipo=IPE&CodigoInstituicao=1
19;CAML3;18/06/2024;08:34;Conclusão da 14ª emissão de debentures;https://www.rad.cvm.gov.br/ENET/frmDownloadDocumento.aspx?Tela=ext&numProtocolo=1251064&descTipo=IPE&CodigoInstituicao=1
20;CAML3;21/05/2024;09:59;Emissão de valores mobiliários - CRA;https://www.rad.cvm.gov.br/ENET/frmDownloadDocumento.aspx?Tela=ext&numProtocolo=1240784&descTipo=IPE&CodigoInstituicao=1
21;CAML3;09/05/2024;20:14;Aviso de Pagamentos de JCP + Dividendos;https://www.rad.cvm.gov.br/ENET/frmDownloadDocumento.aspx?Tela=ext&numProtocolo=1235916&descTipo=IPE&CodigoInstituicao=1
22;CAML3;09/05/2024;20:03;Mudança do Escriturador;https://www.rad.cvm.gov.br/ENET/frmDownloadDocumento.aspx?Tela=ext&numProtocolo=1235905&descTipo=IPE&CodigoInstituicao=1
23;CAML3;07/02/2024;19:43;Dividendos/Juros sobre Capital Próprio;https://www.rad.cvm.gov.br/ENET/frmDownloadDocumento.aspx?Tela=ext&numProtocolo=1190912&descTipo=IPE&CodigoInstituicao=1
24;CAML3;24/01/2024;18:45;Encerramento do Programa de Recompra;https://www.rad.cvm.gov.br/ENET/frmDownloadDocumento.aspx?Tela=ext&numProtocolo=1185830&descTipo=IPE&CodigoInstituicao=1
25;CAML3;18/12/2023;18:08;ISE B3 - Camil Alimentos;https://www.rad.cvm.gov.br/ENET/frmDownloadDocumento.aspx?Tela=ext&numProtocolo=1174861&descTipo=IPE&CodigoInstituicao=1
26;CAML3;01/12/2023;19:52;Comunicado ao Mercado - Conclusão da 13ª Emissão (CRA);https://www.rad.cvm.gov.br/ENET/frmDownloadDocumento.aspx?Tela=ext&numProtocolo=1168449&descTipo=IPE&CodigoInstituicao=1
27;CAML3;27/11/2023;18:20;Atualização Valor Bruto Unitário;https://www.rad.cvm.gov.br/ENET/frmDownloadDocumento.aspx?Tela=ext&numProtocolo=1166698&descTipo=IPE&CodigoInstituicao=1
28;CAML3;22/11/2023;18:26;Dividendos/Juros sobre Capital Próprio;https://www.rad.cvm.gov.br/ENET/frmDownloadDocumento.aspx?Tela=ext&numProtocolo=1165816&descTipo=IPE&CodigoInstituicao=1
29;CAML3;07/11/2023;21:18;Aprovação da 13ª Emissão de Debentures;https://www.rad.cvm.gov.br/ENET/frmDownloadDocumento.aspx?Tela=ext&numProtocolo=1159009&descTipo=IPE&CodigoInstituicao=1
30;CAML3;04/09/2023;18:53;Dividendos/Juros sobre Capital Próprio;https://www.rad.cvm.gov.br/ENET/frmDownloadDocumento.aspx?Tela=ext&numProtocolo=1139908&descTipo=IPE&CodigoInstituicao=1
31;CAML3;30/08/2023;18:57;Dividendos/Juros sobre Capital Próprio;https://www.rad.cvm.gov.br/ENET/frmDownloadDocumento.aspx?Tela=ext&numProtocolo=1138671&descTipo=IPE&CodigoInstituicao=1
32;CAML3;30/06/2023;19:02;Comunicado ao Mercado - Conclusão CRA ;https://www.rad.cvm.gov.br/ENET/frmDownloadDocumento.aspx?Tela=ext&numProtocolo=1118464&descTipo=IPE&CodigoInstituicao=1
33;CAML3;29/06/2023;18:19;Conclusão 12ª Emissão de Debenture - Camil ;https://www.rad.cvm.gov.br/ENET/frmDownloadDocumento.aspx?Tela=ext&numProtocolo=1117901&descTipo=IPE&CodigoInstituicao=1
34;CAML3;02/06/2023;18:12;Dividendos/Juros sobre Capital Próprio;https://www.rad.cvm.gov.br/ENET/frmDownloadDocumento.aspx?Tela=ext&numProtocolo=1109379&descTipo=IPE&CodigoInstituicao=1
35;CAML3;30/05/2023;08:04;Dividendos/Juros sobre Capital Próprio;https://www.rad.cvm.gov.br/ENET/frmDownloadDocumento.aspx?Tela=ext&numProtocolo=1107507&descTipo=IPE&CodigoInstituicao=1
36;CAML3;23/05/2023;08:30;12a Emissão de Debêntures/ Lastro CRA;https://www.rad.cvm.gov.br/ENET/frmDownloadDocumento.aspx?Tela=ext&numProtocolo=1105339&descTipo=IPE&CodigoInstituicao=1
37;CAML3;27/02/2023;18:27;Dividendos/Juros sobre Capital Próprio;https://www.rad.cvm.gov.br/ENET/frmDownloadDocumento.aspx?Tela=ext&numProtocolo=1065854&descTipo=IPE&CodigoInstituicao=1
38;CAML3;15/02/2023;19:38;Dividendos/Juros sobre Capital Próprio;https://www.rad.cvm.gov.br/ENET/frmDownloadDocumento.aspx?Tela=ext&numProtocolo=1061420&descTipo=IPE&CodigoInstituicao=1
39;CAML3;01/02/2023;20:41;Cancelamento de Ações em Tesouraria;https://www.rad.cvm.gov.br/ENET/frmDownloadDocumento.aspx?Tela=ext&numProtocolo=1054343&descTipo=IPE&CodigoInstituicao=1
40;CAML3;12/01/2023;18:31;Aquisição de Ações de Emissão da Própria Companhia;https://www.rad.cvm.gov.br/ENET/frmDownloadDocumento.aspx?Tela=ext&numProtocolo=1049355&descTipo=IPE&CodigoInstituicao=1
41;CAML3;08/12/2022;18:07;Encerramento do 7o Programa de Recompra;https://www.rad.cvm.gov.br/ENET/frmDownloadDocumento.aspx?Tela=ext&numProtocolo=1039480&descTipo=IPE&CodigoInstituicao=1
42;CAML3;24/11/2022;18:15;Dividendos/Juros sobre Capital Próprio;https://www.rad.cvm.gov.br/ENET/frmDownloadDocumento.aspx?Tela=ext&numProtocolo=1035543&descTipo=IPE&CodigoInstituicao=1
43;CAML3;01/11/2022;08:47;Conclusão da Aquisição da Mabel;https://www.rad.cvm.gov.br/ENET/frmDownloadDocumento.aspx?Tela=ext&numProtocolo=1026378&descTipo=IPE&CodigoInstituicao=1
44;CAML3;01/09/2022;18:13;Dividendos/Juros sobre Capital Próprio;https://www.rad.cvm.gov.br/ENET/frmDownloadDocumento.aspx?Tela=ext&numProtocolo=1012452&descTipo=IPE&CodigoInstituicao=1
45;CAML3;25/08/2022;19:45;Dividendos/Juros sobre Capital Próprio;https://www.rad.cvm.gov.br/ENET/frmDownloadDocumento.aspx?Tela=ext&numProtocolo=1011020&descTipo=IPE&CodigoInstituicao=1
46;CAML3;24/08/2022;23:24;Aquisição da Mabel e Licenciamento da Marca Toddy para Cookies;https://www.rad.cvm.gov.br/ENET/frmDownloadDocumento.aspx?Tela=ext&numProtocolo=1010763&descTipo=IPE&CodigoInstituicao=1
47;CAML3;23/08/2022;05:25;Aquisição da Mabel e Licenciamento da Marca Toddy para Cookies;https://www.rad.cvm.gov.br/ENET/frmDownloadDocumento.aspx?Tela=ext&numProtocolo=1010263&descTipo=IPE&CodigoInstituicao=1
48;CAML3;14/07/2022;19:14;Política de Cumprimento de Sanções Norte-Americanas (OFAC) ;https://www.rad.cvm.gov.br/ENET/frmDownloadDocumento.aspx?Tela=ext&numProtocolo=998188&descTipo=IPE&CodigoInstituicao=1
49;CAML3;02/06/2022;18:10;Dividendos/Juros sobre Capital Próprio;https://www.rad.cvm.gov.br/ENET/frmDownloadDocumento.aspx?Tela=ext&numProtocolo=987289&descTipo=IPE&CodigoInstituicao=1
50;CAML3;19/05/2022;21:59;Dividendos/Juros sobre Capital Próprio;https://www.rad.cvm.gov.br/ENET/frmDownloadDocumento.aspx?Tela=ext&numProtocolo=983676&descTipo=IPE&CodigoInstituicao=1
51;CAML3;17/05/2022;22:40;Publicação das Demonstrações Financeiras;https://www.rad.cvm.gov.br/ENET/frmDownloadDocumento.aspx?Tela=ext&numProtocolo=982849&descTipo=IPE&CodigoInstituicao=1
52;CAML3;13/04/2022;18:15;Cancelamento de Ações em Tesouraria;https://www.rad.cvm.gov.br/ENET/frmDownloadDocumento.aspx?Tela=ext&numProtocolo=967139&descTipo=IPE&CodigoInstituicao=1
53;CAML3;07/04/2022;19:26;DESISTÊNCIA DA OPERAÇÃO DE AQUISIÇÃO DA UNIDADE DE NEGÓCIOS DE  PET FOOD DA EMPRESAS IANSA NO CHILE;https://www.rad.cvm.gov.br/ENET/frmDownloadDocumento.aspx?Tela=ext&numProtocolo=965093&descTipo=IPE&CodigoInstituicao=1
54;CAML3;31/03/2022;18:24;Aprovação do Novo Programa de Recompra de ações e cancelamento do saldo de ações em tesouraria;https://www.rad.cvm.gov.br/ENET/frmDownloadDocumento.aspx?Tela=ext&numProtocolo=962319&descTipo=IPE&CodigoInstituicao=1
55;CAML3;30/03/2022;18:12;Conclusão da Aquisição da Silcom S.A. no Uruguai;https://www.rad.cvm.gov.br/ENET/frmDownloadDocumento.aspx?Tela=ext&numProtocolo=961315&descTipo=IPE&CodigoInstituicao=1
56;CAML3;15/03/2022;18:08;Política de Brindes, Presentes, Entretenimentos, Hospitalidades e Refeições de Negócios;https://www.rad.cvm.gov.br/ENET/frmDownloadDocumento.aspx?Tela=ext&numProtocolo=954238&descTipo=IPE&CodigoInstituicao=1
57;CAML3;15/03/2022;18:08;Política Anticorrupção e Antissuborno;https://www.rad.cvm.gov.br/ENET/frmDownloadDocumento.aspx?Tela=ext&numProtocolo=954241&descTipo=IPE&CodigoInstituicao=1
58;CAML3;15/03/2022;18:08;Política de Gestão de Conflito de Interesses;https://www.rad.cvm.gov.br/ENET/frmDownloadDocumento.aspx?Tela=ext&numProtocolo=954243&descTipo=IPE&CodigoInstituicao=1
59;CAML3;03/03/2022;08:57;Encerramento do Prazo para Exercício do Direito de Retirada;https://www.rad.cvm.gov.br/ENET/frmDownloadDocumento.aspx?Tela=ext&numProtocolo=949502&descTipo=IPE&CodigoInstituicao=1
60;CAML3;24/02/2022;18:44;Política do Programa de Privacidade;https://www.rad.cvm.gov.br/ENET/frmDownloadDocumento.aspx?Tela=ext&numProtocolo=947304&descTipo=IPE&CodigoInstituicao=1
61;CAML3;24/02/2022;18:33;Dividendos/Juros sobre Capital Próprio;https://www.rad.cvm.gov.br/ENET/frmDownloadDocumento.aspx?Tela=ext&numProtocolo=947284&descTipo=IPE&CodigoInstituicao=1
62;CAML3;24/02/2022;18:33;Política Canal de Ética;https://www.rad.cvm.gov.br/ENET/frmDownloadDocumento.aspx?Tela=ext&numProtocolo=947296&descTipo=IPE&CodigoInstituicao=1
63;CAML3;08/02/2022;18:23;Conclusão do Programa de Recompra;https://www.rad.cvm.gov.br/ENET/frmDownloadDocumento.aspx?Tela=ext&numProtocolo=939973&descTipo=IPE&CodigoInstituicao=1
64;CAML3;30/12/2021;19:55;RATIFICAÇÃO DA AQUISIÇÃO SANTA AMÁLIA E EXERCÍCIO DO DIREITO DE RETIRADA;https://www.rad.cvm.gov.br/ENET/frmDownloadDocumento.aspx?Tela=ext&numProtocolo=929937&descTipo=IPE&CodigoInstituicao=1
65;CAML3;21/12/2021;22:09;Adesão ao Pacto Global da ONU;https://www.rad.cvm.gov.br/ENET/frmDownloadDocumento.aspx?Tela=ext&numProtocolo=928041&descTipo=IPE&CodigoInstituicao=1
66;CAML3;20/12/2021;22:30;Conclusão do Investimento Estratégico na Café Bom Dia e Agro Coffee;https://www.rad.cvm.gov.br/ENET/frmDownloadDocumento.aspx?Tela=ext&numProtocolo=927722&descTipo=IPE&CodigoInstituicao=1
67;CAML3;15/12/2021;23:09;Investimento Estratégico na Café Bom Dia e Agro Coffee;https://www.rad.cvm.gov.br/ENET/frmDownloadDocumento.aspx?Tela=ext&numProtocolo=926337&descTipo=IPE&CodigoInstituicao=1
68;CAML3;09/12/2021;21:35;Aprovação da Convocação de Assembleia Geral Extraordinária da Companhia;https://www.rad.cvm.gov.br/ENET/frmDownloadDocumento.aspx?Tela=ext&numProtocolo=924195&descTipo=IPE&CodigoInstituicao=1
69;CAML3;09/12/2021;18:06;Aquisição da Silcom S.A.;https://www.rad.cvm.gov.br/ENET/frmDownloadDocumento.aspx?Tela=ext&numProtocolo=923998&descTipo=IPE&CodigoInstituicao=1
70;CAML3;30/11/2021;19:03;Projeto de Geração Própria de Energia Renovável;https://www.rad.cvm.gov.br/ENET/frmDownloadDocumento.aspx?Tela=ext&numProtocolo=921084&descTipo=IPE&CodigoInstituicao=1
71;CAML3;25/11/2021;18:58;Dividendos/Juros sobre Capital Próprio;https://www.rad.cvm.gov.br/ENET/frmDownloadDocumento.aspx?Tela=ext&numProtocolo=920316&descTipo=IPE&CodigoInstituicao=1
72;CAML3;25/11/2021;18:47;Aprovação Do Novo Programa De Recompra De Ações;https://www.rad.cvm.gov.br/ENET/frmDownloadDocumento.aspx?Tela=ext&numProtocolo=920313&descTipo=IPE&CodigoInstituicao=1
73;CAML3;18/11/2021;18:07;Conclusão da 11a Emissão de Debêntures de R$650 milhões;https://www.rad.cvm.gov.br/ENET/frmDownloadDocumento.aspx?Tela=ext&numProtocolo=918587&descTipo=IPE&CodigoInstituicao=1
74;CAML3;04/11/2021;18:20;Encerramento do Programa de Recompra de Ações;https://www.rad.cvm.gov.br/ENET/frmDownloadDocumento.aspx?Tela=ext&numProtocolo=913247&descTipo=IPE&CodigoInstituicao=1
75;CAML3;29/10/2021;19:42;Conclusão da Aquisição da Santa Amália;https://www.rad.cvm.gov.br/ENET/frmDownloadDocumento.aspx?Tela=ext&numProtocolo=911560&descTipo=IPE&CodigoInstituicao=1
76;CAML3;25/10/2021;18:43;Conclusão da Aquisição da Marca Seleto;https://www.rad.cvm.gov.br/ENET/frmDownloadDocumento.aspx?Tela=ext&numProtocolo=909881&descTipo=IPE&CodigoInstituicao=1
77;CAML3;18/10/2021;19:42;Aprovação da 11ª Emissão de Debêntures;https://www.rad.cvm.gov.br/ENET/frmDownloadDocumento.aspx?Tela=ext&numProtocolo=908168&descTipo=IPE&CodigoInstituicao=1
78;CAML3;01/10/2021;18:08;Aprovação da Operação de Aquisição das Marcas Seleto pelo CADE;https://www.rad.cvm.gov.br/ENET/frmDownloadDocumento.aspx?Tela=ext&numProtocolo=904777&descTipo=IPE&CodigoInstituicao=1
79;CAML3;27/09/2021;18:26;Aprovação da Operação de Aquisição da Santa Amália pelo CADE;https://www.rad.cvm.gov.br/ENET/frmDownloadDocumento.aspx?Tela=ext&numProtocolo=903703&descTipo=IPE&CodigoInstituicao=1
80;CAML3;15/09/2021;19:31;Conclusão da Aquisição dos Negócios de Arroz no Equador;https://www.rad.cvm.gov.br/ENET/frmDownloadDocumento.aspx?Tela=ext&numProtocolo=901248&descTipo=IPE&CodigoInstituicao=1
81;CAML3;13/09/2021;18:12;Aquisição das Marcas Seleto Inaugurando a Entrada da Companhia no Segmento de Café;https://www.rad.cvm.gov.br/ENET/frmDownloadDocumento.aspx?Tela=ext&numProtocolo=900784&descTipo=IPE&CodigoInstituicao=1
82;CAML3;01/09/2021;19:17;Dividendos/Juros sobre Capital Próprio;https://www.rad.cvm.gov.br/ENET/frmDownloadDocumento.aspx?Tela=ext&numProtocolo=897770&descTipo=IPE&CodigoInstituicao=1
83;CAML3;26/08/2021;19:55;Dividendos/Juros sobre Capital Próprio;https://www.rad.cvm.gov.br/ENET/frmDownloadDocumento.aspx?Tela=ext&numProtocolo=896457&descTipo=IPE&CodigoInstituicao=1
84;CAML3;16/08/2021;18:39;Aquisição da Santa Amália e Entrada na Categoria de Massas no Brasil;https://www.rad.cvm.gov.br/ENET/frmDownloadDocumento.aspx?Tela=ext&numProtocolo=893951&descTipo=IPE&CodigoInstituicao=1
85;CAML3;27/07/2021;20:53;Aquisição no Equador dos Ativos de Arroz Da Agroindustrias DAJAHU S.A. e da TRANSPORTES RONALJAVHU S.A.;https://www.rad.cvm.gov.br/ENET/frmDownloadDocumento.aspx?Tela=ext&numProtocolo=886695&descTipo=IPE&CodigoInstituicao=1
86;CAML3;30/06/2021;20:26;Plano de Outorga de Opção de Compra de Ações;https://www.rad.cvm.gov.br/ENET/frmDownloadDocumento.aspx?Tela=ext&numProtocolo=880161&descTipo=IPE&CodigoInstituicao=1
87;CAML3;07/06/2021;22:59;Dividendos/Juros sobre Capital Próprio;https://www.rad.cvm.gov.br/ENET/frmDownloadDocumento.aspx?Tela=ext&numProtocolo=874382&descTipo=IPE&CodigoInstituicao=1
88;CAML3;27/05/2021;23:54;Dividendos/Juros sobre Capital Próprio;https://www.rad.cvm.gov.br/ENET/frmDownloadDocumento.aspx?Tela=ext&numProtocolo=871661&descTipo=IPE&CodigoInstituicao=1
89;CAML3;07/05/2021;18:48;Conclusão da Décima Emissão de Debêntures Simples, Não Conversíveis em Ações, Da Espécie Quirografária, Em Série Única, para Distribuição Pública com Esforços Restritos;https://www.rad.cvm.gov.br/ENET/frmDownloadDocumento.aspx?Tela=ext&numProtocolo=864430&descTipo=IPE&CodigoInstituicao=1
90;CAML3;30/04/2021;18:19;Aprovação da Décima Emissão de Debêntures;https://www.rad.cvm.gov.br/ENET/frmDownloadDocumento.aspx?Tela=ext&numProtocolo=860938&descTipo=IPE&CodigoInstituicao=1
91;CAML3;31/03/2021;19:50;Aquisição de Ações de Emissão da Própria Companhia;https://www.rad.cvm.gov.br/ENET/frmDownloadDocumento.aspx?Tela=ext&numProtocolo=849236&descTipo=IPE&CodigoInstituicao=1
92;CAML3;22/03/2021;21:42;Dividendos/Juros sobre Capital Próprio;https://www.rad.cvm.gov.br/ENET/frmDownloadDocumento.aspx?Tela=ext&numProtocolo=844850&descTipo=IPE&CodigoInstituicao=1
93;CAML3;09/03/2021;18:48;Aquisição de Ações de Emissão da Própria Companhia;https://www.rad.cvm.gov.br/ENET/frmDownloadDocumento.aspx?Tela=ext&numProtocolo=840157&descTipo=IPE&CodigoInstituicao=1
94;CAML3;03/03/2021;18:07;Política de Integração do Conselho de Administração;https://www.rad.cvm.gov.br/ENET/frmDownloadDocumento.aspx?Tela=ext&numProtocolo=838257&descTipo=IPE&CodigoInstituicao=1
95;CAML3;24/11/2020;20:05;Participações em Lives;https://www.rad.cvm.gov.br/ENET/frmDownloadDocumento.aspx?Tela=ext&numProtocolo=810854&descTipo=IPE&CodigoInstituicao=1
96;CAML3;08/10/2020;19:03;Conclusão da Nona Emissão de Debêntures Simples, não conversíveis em ações, da espécie quirografia, em série única, para distrubuição pública com esforços restritos;https://www.rad.cvm.gov.br/ENET/frmDownloadDocumento.aspx?Tela=ext&numProtocolo=798683&descTipo=IPE&CodigoInstituicao=1
97;CAML3;29/09/2020;21:26;Aprovação da 9ª (nona) emissão de debêntures simples, não conversíveis em ações, da espécie quirografária, em série única, para distribuição pública com esforços restritos;https://www.rad.cvm.gov.br/ENET/frmDownloadDocumento.aspx?Tela=ext&numProtocolo=796321&descTipo=IPE&CodigoInstituicao=1
98;CAML3;27/08/2020;19:09;Aquisição de Ações de Emissão da Própria Companhia;https://www.rad.cvm.gov.br/ENET/frmDownloadDocumento.aspx?Tela=ext&numProtocolo=788457&descTipo=IPE&CodigoInstituicao=1
99;CAML3;22/01/2020;18:02;Aquisição de Unidade de Negócios de Pet Food da Empresas Iansa no Chile;https://www.rad.cvm.gov.br/ENET/frmDownloadDocumento.aspx?Tela=ext&numProtocolo=731533&descTipo=IPE&CodigoInstituicao=1
