;Acao;Data;Hora;Descrição;Link
0;GPIV33;07/07/2023;18:36;Esclarecimento sobre Fato Relevante publicado pela Lupatech S.A.;https://www.rad.cvm.gov.br/ENET/frmDownloadDocumento.aspx?Tela=ext&numProtocolo=1120747&descTipo=IPE&CodigoInstituicao=1
1;GPIV33;16/06/2023;20:49;Informe relacionado à Resolução CVM nº 80/2022 ;https://www.rad.cvm.gov.br/ENET/frmDownloadDocumento.aspx?Tela=ext&numProtocolo=1114452&descTipo=IPE&CodigoInstituicao=1
2;GPIV33;12/04/2023;20:17;Procedimentos para os acionistas da BR Properties para venda de ações remanescentes no contexto da OPA ;https://www.rad.cvm.gov.br/ENET/frmDownloadDocumento.aspx?Tela=ext&numProtocolo=1085655&descTipo=IPE&CodigoInstituicao=1
3;GPIV33;10/04/2023;21:32;Resultado do Leilão da Oferta Pública Voluntária da BR Properties ;https://www.rad.cvm.gov.br/ENET/frmDownloadDocumento.aspx?Tela=ext&numProtocolo=1084917&descTipo=IPE&CodigoInstituicao=1
4;GPIV33;03/04/2023;22:09;Cancelamento da listagem das ações da Spice Private Equity Ltd.;https://www.rad.cvm.gov.br/ENET/frmDownloadDocumento.aspx?Tela=ext&numProtocolo=1082155&descTipo=IPE&CodigoInstituicao=1
5;GPIV33;10/03/2023;01:13;Fato Relevante - Lançamento da Oferta Pública Voluntária para a aquisição de ações da BR Properties;https://www.rad.cvm.gov.br/ENET/frmDownloadDocumento.aspx?Tela=ext&numProtocolo=1071162&descTipo=IPE&CodigoInstituicao=1
6;GPIV33;13/01/2023;20:33;Oferta Pública Voluntária da BR Properties;https://www.rad.cvm.gov.br/ENET/frmDownloadDocumento.aspx?Tela=ext&numProtocolo=1049861&descTipo=IPE&CodigoInstituicao=1
7;GPIV33;22/12/2022;19:38;Investimento em Oferta de Ações da G2D;https://www.rad.cvm.gov.br/ENET/frmDownloadDocumento.aspx?Tela=ext&numProtocolo=1044014&descTipo=IPE&CodigoInstituicao=1
8;GPIV33;22/11/2022;19:52;Intenção de participar da Potencial Oferta Restrita da G2D Investments;https://www.rad.cvm.gov.br/ENET/frmDownloadDocumento.aspx?Tela=ext&numProtocolo=1035029&descTipo=IPE&CodigoInstituicao=1
9;GPIV33;04/11/2022;18:11;Aquisição de Ações de Emissão da Própria Companhia;https://www.rad.cvm.gov.br/ENET/frmDownloadDocumento.aspx?Tela=ext&numProtocolo=1028504&descTipo=IPE&CodigoInstituicao=1
10;GPIV33;30/09/2022;18:09;Liquidação bem-sucedida da oferta pública de aquisição da Spice Private Equity;https://www.rad.cvm.gov.br/ENET/frmDownloadDocumento.aspx?Tela=ext&numProtocolo=1018645&descTipo=IPE&CodigoInstituicao=1
11;GPIV33;21/09/2022;02:03;Resultado Final Definitivo da Oferta Pública de Aquisição da SPICE PE;https://www.rad.cvm.gov.br/ENET/frmDownloadDocumento.aspx?Tela=ext&numProtocolo=1016800&descTipo=IPE&CodigoInstituicao=1
12;GPIV33;01/09/2022;01:55;Resultado Interino Definitivo da Oferta Pública de Aquisição da SPICE PE;https://www.rad.cvm.gov.br/ENET/frmDownloadDocumento.aspx?Tela=ext&numProtocolo=1012245&descTipo=IPE&CodigoInstituicao=1
13;GPIV33;29/08/2022;02:13;Resultado Provisório da Oferta Pública de Aquisição da SPICE PE;https://www.rad.cvm.gov.br/ENET/frmDownloadDocumento.aspx?Tela=ext&numProtocolo=1011410&descTipo=IPE&CodigoInstituicao=1
14;GPIV33;14/07/2022;02:11;Publicação do Prospecto da Oferta Pública de Aquisição Spice PE;https://www.rad.cvm.gov.br/ENET/frmDownloadDocumento.aspx?Tela=ext&numProtocolo=997954&descTipo=IPE&CodigoInstituicao=1
15;GPIV33;02/06/2022;02:13;Oferta Pública de Aquisição Spice PE;https://www.rad.cvm.gov.br/ENET/frmDownloadDocumento.aspx?Tela=ext&numProtocolo=987103&descTipo=IPE&CodigoInstituicao=1
16;GPIV33;29/10/2021;18:47;Cancelamento de ações em tesouraria;https://www.rad.cvm.gov.br/ENET/frmDownloadDocumento.aspx?Tela=ext&numProtocolo=911505&descTipo=IPE&CodigoInstituicao=1
17;GPIV33;24/09/2021;21:30;Cancelamento de ações e programa de compra de ações da Companhia;https://www.rad.cvm.gov.br/ENET/frmDownloadDocumento.aspx?Tela=ext&numProtocolo=903379&descTipo=IPE&CodigoInstituicao=1
18;GPIV33;14/09/2021;19:41;Desinvestimento parcial na Rimini Street;https://www.rad.cvm.gov.br/ENET/frmDownloadDocumento.aspx?Tela=ext&numProtocolo=901030&descTipo=IPE&CodigoInstituicao=1
19;GPIV33;17/08/2021;23:04;Extensão da Recompra de Ações;https://www.rad.cvm.gov.br/ENET/frmDownloadDocumento.aspx?Tela=ext&numProtocolo=894520&descTipo=IPE&CodigoInstituicao=1
20;GPIV33;01/07/2021;08:43;Rodada de investimento na 2TM Participações S.A.;https://www.rad.cvm.gov.br/ENET/frmDownloadDocumento.aspx?Tela=ext&numProtocolo=880234&descTipo=IPE&CodigoInstituicao=1
21;GPIV33;18/06/2021;20:47;Anúncio de Encerramento da Oferta de G2D;https://www.rad.cvm.gov.br/ENET/frmDownloadDocumento.aspx?Tela=ext&numProtocolo=877503&descTipo=IPE&CodigoInstituicao=1
22;GPIV33;13/05/2021;23:51;"G2D Investments Ltd. obteve registro de emissor estrangeiro categoria ""A"" perante a CVM";https://www.rad.cvm.gov.br/ENET/frmDownloadDocumento.aspx?Tela=ext&numProtocolo=867412&descTipo=IPE&CodigoInstituicao=1
23;GPIV33;31/03/2021;21:18;Esclarecimento sobre Fato Relevante publicado pela Lupatech S.A.;https://www.rad.cvm.gov.br/ENET/frmDownloadDocumento.aspx?Tela=ext&numProtocolo=849348&descTipo=IPE&CodigoInstituicao=1
24;GPIV33;01/02/2021;22:18;Investimento em 2TM Participações (MB);https://www.rad.cvm.gov.br/ENET/frmDownloadDocumento.aspx?Tela=ext&numProtocolo=826591&descTipo=IPE&CodigoInstituicao=1
25;GPIV33;08/09/2020;22:13;Apresentação do Pedido de Registro de Oferta Pública da G2D;https://www.rad.cvm.gov.br/ENET/frmDownloadDocumento.aspx?Tela=ext&numProtocolo=791914&descTipo=IPE&CodigoInstituicao=1
26;GPIV33;04/08/2020;08:45;Investimento em CERC;https://www.rad.cvm.gov.br/ENET/frmDownloadDocumento.aspx?Tela=ext&numProtocolo=780868&descTipo=IPE&CodigoInstituicao=1
27;GPIV33;27/07/2020;18:03;Conversão de Debêntures Conversíveis da Quero Educação;https://www.rad.cvm.gov.br/ENET/frmDownloadDocumento.aspx?Tela=ext&numProtocolo=778548&descTipo=IPE&CodigoInstituicao=1
28;GPIV33;17/06/2020;20:24;Aprovação de Recompra de Ações Classe A;https://www.rad.cvm.gov.br/ENET/frmDownloadDocumento.aspx?Tela=ext&numProtocolo=769959&descTipo=IPE&CodigoInstituicao=1
29;GPIV33;16/06/2020;22:28;Aprovação de Recompra de Ações Classe A;https://www.rad.cvm.gov.br/ENET/frmDownloadDocumento.aspx?Tela=ext&numProtocolo=769687&descTipo=IPE&CodigoInstituicao=1
30;GPIV33;11/04/2020;17:46;FoodFirst Global Restaurants: Capítulo 11 do Código de Falência;https://www.rad.cvm.gov.br/ENET/frmDownloadDocumento.aspx?Tela=ext&numProtocolo=753665&descTipo=IPE&CodigoInstituicao=1
31;GPIV33;19/11/2019;08:52;Venda de ações da RHIM;https://www.rad.cvm.gov.br/ENET/frmDownloadDocumento.aspx?Tela=ext&numProtocolo=722094&descTipo=IPE&CodigoInstituicao=1
32;GPIV33;04/11/2019;19:03;Resgate Parcial de Títulos Perpétuos;https://www.rad.cvm.gov.br/ENET/frmDownloadDocumento.aspx?Tela=ext&numProtocolo=719008&descTipo=IPE&CodigoInstituicao=1
33;GPIV33;09/07/2019;12:06;Venda de Ações da RHI Magnesita;https://www.rad.cvm.gov.br/ENET/frmDownloadDocumento.aspx?Tela=ext&numProtocolo=699491&descTipo=IPE&CodigoInstituicao=1
34;GPIV33;23/01/2019;20:49;Resgate Parcial de Títulos Perpétuos;https://www.rad.cvm.gov.br/ENET/frmDownloadDocumento.aspx?Tela=ext&numProtocolo=661887&descTipo=IPE&CodigoInstituicao=1
35;GPIV33;27/11/2018;08:23;Cancelamento do acordo com a Light S.A.;https://www.rad.cvm.gov.br/ENET/frmDownloadDocumento.aspx?Tela=ext&numProtocolo=653214&descTipo=IPE&CodigoInstituicao=1
36;GPIV33;21/11/2018;22:28;Conclusão da venda de BHG;https://www.rad.cvm.gov.br/ENET/frmDownloadDocumento.aspx?Tela=ext&numProtocolo=652666&descTipo=IPE&CodigoInstituicao=1
37;GPIV33;31/10/2018;21:44;Aprovação de programa de recompra de ações;https://www.rad.cvm.gov.br/ENET/frmDownloadDocumento.aspx?Tela=ext&numProtocolo=648443&descTipo=IPE&CodigoInstituicao=1
38;GPIV33;23/10/2018;08:27;Light S.A. - Convocação de AGE para Alteração do Estatuto;https://www.rad.cvm.gov.br/ENET/frmDownloadDocumento.aspx?Tela=ext&numProtocolo=646720&descTipo=IPE&CodigoInstituicao=1
39;GPIV33;21/09/2018;19:11;GP Investments anuncia a venda de BHG;https://www.rad.cvm.gov.br/ENET/frmDownloadDocumento.aspx?Tela=ext&numProtocolo=642642&descTipo=IPE&CodigoInstituicao=1
40;GPIV33;16/08/2018;23:23;Fato Relevante da Light S.A.;https://www.rad.cvm.gov.br/ENET/frmDownloadDocumento.aspx?Tela=ext&numProtocolo=638430&descTipo=IPE&CodigoInstituicao=1
41;GPIV33;24/05/2018;20:00;Conclusão da aquisição de BBRG;https://www.rad.cvm.gov.br/ENET/frmDownloadDocumento.aspx?Tela=ext&numProtocolo=625515&descTipo=IPE&CodigoInstituicao=1
42;GPIV33;22/05/2018;23:54;Aprovação da transação de BBRG por parte dos acionistas.;https://www.rad.cvm.gov.br/ENET/frmDownloadDocumento.aspx?Tela=ext&numProtocolo=625062&descTipo=IPE&CodigoInstituicao=1
43;GPIV33;11/05/2018;20:02;Spice Private Equity, uma subsidiária da GP Investments, anuncia o lançamento da The Craftory;https://www.rad.cvm.gov.br/ENET/frmDownloadDocumento.aspx?Tela=ext&numProtocolo=623125&descTipo=IPE&CodigoInstituicao=1
44;GPIV33;28/03/2018;21:41;Renúncia do Diretor Financeiro e de Relações com Investidores;https://www.rad.cvm.gov.br/ENET/frmDownloadDocumento.aspx?Tela=ext&numProtocolo=604873&descTipo=IPE&CodigoInstituicao=1
45;GPIV33;08/03/2018;05:03;Bravo Brio Restaurant Group é adquirido pela Spice Private Equity, uma subsidiária da GP Investments;https://www.rad.cvm.gov.br/ENET/frmDownloadDocumento.aspx?Tela=ext&numProtocolo=599508&descTipo=IPE&CodigoInstituicao=1
46;GPIV33;23/01/2018;19:31;Resgate parcial dos Títulos Perpétuos.;https://www.rad.cvm.gov.br/ENET/frmDownloadDocumento.aspx?Tela=ext&numProtocolo=594361&descTipo=IPE&CodigoInstituicao=1
47;GPIV33;21/11/2017;20:14;Conclusão de Transação Estratégica entre L.A. FIP, sua controlada BHG, e Accor;https://www.rad.cvm.gov.br/ENET/frmDownloadDocumento.aspx?Tela=ext&numProtocolo=587205&descTipo=IPE&CodigoInstituicao=1
48;GPIV33;27/10/2017;09:44;Conclusão da Transação entre Magnesita e RHI;https://www.rad.cvm.gov.br/ENET/frmDownloadDocumento.aspx?Tela=ext&numProtocolo=583784&descTipo=IPE&CodigoInstituicao=1
49;GPIV33;17/10/2017;08:01;Aprovação do Prospecto para Admissão e Negociação das ações RHI Magnesita;https://www.rad.cvm.gov.br/ENET/frmDownloadDocumento.aspx?Tela=ext&numProtocolo=582881&descTipo=IPE&CodigoInstituicao=1
50;GPIV33;11/10/2017;08:03;Conclusão da transação entre Rimini Street, Inc. e GPIAC;https://www.rad.cvm.gov.br/ENET/frmDownloadDocumento.aspx?Tela=ext&numProtocolo=582488&descTipo=IPE&CodigoInstituicao=1
51;GPIV33;07/08/2017;15:11;Conclusão da Transação entre Spice Private Equity e LEON;https://www.rad.cvm.gov.br/ENET/frmDownloadDocumento.aspx?Tela=ext&numProtocolo=574060&descTipo=IPE&CodigoInstituicao=1
52;GPIV33;07/08/2017;09:16;Aprovação da Transação entre Magnesita e RHI pelos acionistas da RHI;https://www.rad.cvm.gov.br/ENET/frmDownloadDocumento.aspx?Tela=ext&numProtocolo=573969&descTipo=IPE&CodigoInstituicao=1
53;GPIV33;11/07/2017;19:22;Aprovação pelo CADE da transação entre Magnesita e RHI;https://www.rad.cvm.gov.br/ENET/frmDownloadDocumento.aspx?Tela=ext&numProtocolo=571450&descTipo=IPE&CodigoInstituicao=1
54;GPIV33;28/06/2017;20:42;Aprovação pela Comissão Europeia da Transação - Magnesita e RHI;https://www.rad.cvm.gov.br/ENET/frmDownloadDocumento.aspx?Tela=ext&numProtocolo=569512&descTipo=IPE&CodigoInstituicao=1
55;GPIV33;23/05/2017;18:52;Aprovação da Proposta de Extensão da Data de Conclusão de Transação da GP Investments Aquisition Corp.;https://www.rad.cvm.gov.br/ENET/frmDownloadDocumento.aspx?Tela=ext&numProtocolo=565706&descTipo=IPE&CodigoInstituicao=1
56;GPIV33;19/05/2017;02:57;Assinatura de Contrato de Compra entre Spice Private Equity e LEON;https://www.rad.cvm.gov.br/ENET/frmDownloadDocumento.aspx?Tela=ext&numProtocolo=565430&descTipo=IPE&CodigoInstituicao=1
57;GPIV33;16/05/2017;09:29;GPIAC anuncia transação com a Rimini Street, Inc.;https://www.rad.cvm.gov.br/ENET/frmDownloadDocumento.aspx?Tela=ext&numProtocolo=565124&descTipo=IPE&CodigoInstituicao=1
58;GPIV33;17/03/2017;19:34;Pré-pagamento Integral de Dívida;https://www.rad.cvm.gov.br/ENET/frmDownloadDocumento.aspx?Tela=ext&numProtocolo=552658&descTipo=IPE&CodigoInstituicao=1
59;GPIV33;10/03/2017;18:41;Aprovação do Novo Programa de Recompra de Ações;https://www.rad.cvm.gov.br/ENET/frmDownloadDocumento.aspx?Tela=ext&numProtocolo=551599&descTipo=IPE&CodigoInstituicao=1
60;GPIV33;02/03/2017;17:11;Celebração do Share Purchase Agreement entre BHG e Accor;https://www.rad.cvm.gov.br/ENET/frmDownloadDocumento.aspx?Tela=ext&numProtocolo=549936&descTipo=IPE&CodigoInstituicao=1
61;GPIV33;14/11/2016;18:10;Anúncio do distrato do acordo definitivo entre GPIAC e World Kitchen;https://www.rad.cvm.gov.br/ENET/frmDownloadDocumento.aspx?Tela=ext&numProtocolo=538263&descTipo=IPE&CodigoInstituicao=1
62;GPIV33;13/10/2016;15:17;Aprovação do Acordo entre Magnesita e RHI pelo Conselho de Supervisão da RHI;https://www.rad.cvm.gov.br/ENET/frmDownloadDocumento.aspx?Tela=ext&numProtocolo=534258&descTipo=IPE&CodigoInstituicao=1
63;GPIV33;05/10/2016;23:12;Anúncio da Combinação das Operações entre Magnesita e RHI AG;https://www.rad.cvm.gov.br/ENET/frmDownloadDocumento.aspx?Tela=ext&numProtocolo=532992&descTipo=IPE&CodigoInstituicao=1
64;GPIV33;26/09/2016;19:57;Alteração na Base Acionária da Companhia;https://www.rad.cvm.gov.br/ENET/frmDownloadDocumento.aspx?Tela=ext&numProtocolo=532163&descTipo=IPE&CodigoInstituicao=1
65;GPIV33;28/06/2016;08:24;Fechamento de Aquisição de Participação Relevante na Spice Private Equity Ltd.;https://www.rad.cvm.gov.br/ENET/frmDownloadDocumento.aspx?Tela=ext&numProtocolo=521859&descTipo=IPE&CodigoInstituicao=1
66;GPIV33;11/05/2016;18:14;Conclusão da Oferta Pública Voluntária para Aquisição de Ações Ordinárias de Emissão da BR Properties S.A.;https://www.rad.cvm.gov.br/ENET/frmDownloadDocumento.aspx?Tela=ext&numProtocolo=516944&descTipo=IPE&CodigoInstituicao=1
67;GPIV33;05/05/2016;07:56;Aquisição de participação adicional relevante na Spice Private Equity;https://www.rad.cvm.gov.br/ENET/frmDownloadDocumento.aspx?Tela=ext&numProtocolo=515258&descTipo=IPE&CodigoInstituicao=1
68;GPIV33;02/05/2016;20:27;Cancelamento de ações que se encontravam em tesouraria e aprovação do pedido de cancelamento do programa patrocinado de Global Depositary Receipts;https://www.rad.cvm.gov.br/ENET/frmDownloadDocumento.aspx?Tela=ext&numProtocolo=514811&descTipo=IPE&CodigoInstituicao=1
69;GPIV33;02/05/2016;18:52;Aprovação da renúncia à aplicação da poison pill e ao direito de declarar a aceleração do endividamento por parte dos acionista e dos credores da BR Properties;https://www.rad.cvm.gov.br/ENET/frmDownloadDocumento.aspx?Tela=ext&numProtocolo=514760&descTipo=IPE&CodigoInstituicao=1
70;GPIV33;29/04/2016;08:58;Esclarecimento da posição da Eminence em relação à Oferta Publica Voluntaria para aquisição de ações ordinárias de emissão BR Properties S.A.;https://www.rad.cvm.gov.br/ENET/frmDownloadDocumento.aspx?Tela=ext&numProtocolo=513066&descTipo=IPE&CodigoInstituicao=1
71;GPIV33;27/04/2016;08:00;Carta da Eminence Capital de Apoio à Oferta Pública Voluntária para Aquisição de Ações da BR Properties;https://www.rad.cvm.gov.br/ENET/frmDownloadDocumento.aspx?Tela=ext&numProtocolo=512248&descTipo=IPE&CodigoInstituicao=1
72;GPIV33;26/04/2016;00:18;Aditamento ao Edital referente à Oferta Pública Voluntária para Aquisição de Ações Ordinárias de emissão da BR Properties S.A;https://www.rad.cvm.gov.br/ENET/frmDownloadDocumento.aspx?Tela=ext&numProtocolo=512007&descTipo=IPE&CodigoInstituicao=1
73;GPIV33;19/04/2016;19:23;GPIAC anuncia aquisição da WKI Holding Company;https://www.rad.cvm.gov.br/ENET/frmDownloadDocumento.aspx?Tela=ext&numProtocolo=511510&descTipo=IPE&CodigoInstituicao=1
74;GPIV33;13/04/2016;19:27;Conclusão do processo de obtenção de todos os Consentimentos dos Credores referentes à OPA de BR Properties;https://www.rad.cvm.gov.br/ENET/frmDownloadDocumento.aspx?Tela=ext&numProtocolo=510789&descTipo=IPE&CodigoInstituicao=1
75;GPIV33;31/03/2016;20:23;A GP INVESTMENTS ANUNCIA A VENDA DE SUA PARTICIPAÇÃO REMANESCENTE NA TEMPO PARTICIPAÇÕES S.A.;https://www.rad.cvm.gov.br/ENET/frmDownloadDocumento.aspx?Tela=ext&numProtocolo=508367&descTipo=IPE&CodigoInstituicao=1
76;GPIV33;28/03/2016;08:29;Anúncio de Edital de Oferta Pública Voluntária de Ações Ordinárias de emissão da BR Properties;https://www.rad.cvm.gov.br/ENET/frmDownloadDocumento.aspx?Tela=ext&numProtocolo=506698&descTipo=IPE&CodigoInstituicao=1
77;GPIV33;13/03/2016;21:29;Carta em resposta à BR Properties;https://www.rad.cvm.gov.br/ENET/frmDownloadDocumento.aspx?Tela=ext&numProtocolo=504938&descTipo=IPE&CodigoInstituicao=1
78;GPIV33;10/03/2016;01:06;Anúncio de compromisso de subscrição vinculante;https://www.rad.cvm.gov.br/ENET/frmDownloadDocumento.aspx?Tela=ext&numProtocolo=504146&descTipo=IPE&CodigoInstituicao=1
79;GPIV33;11/02/2016;21:35;Reprodução de Ofício nº 37/2016-CVM/SRE/GER da CVM;https://www.rad.cvm.gov.br/ENET/frmDownloadDocumento.aspx?Tela=ext&numProtocolo=501070&descTipo=IPE&CodigoInstituicao=1
80;GPIV33;11/02/2016;08:56;Oferta Pública Voluntária de Ações;https://www.rad.cvm.gov.br/ENET/frmDownloadDocumento.aspx?Tela=ext&numProtocolo=500873&descTipo=IPE&CodigoInstituicao=1
81;GPIV33;18/12/2015;20:11;Resposta ao Conselho de Administração da BR Properties S.A.;https://www.rad.cvm.gov.br/ENET/frmDownloadDocumento.aspx?Tela=ext&numProtocolo=495882&descTipo=IPE&CodigoInstituicao=1
82;GPIV33;11/12/2015;08:34;Aquisição de Ações Ordinárias da BR Properties mediante participação em leilão na BM&F Bovespa;https://www.rad.cvm.gov.br/ENET/frmDownloadDocumento.aspx?Tela=ext&numProtocolo=495014&descTipo=IPE&CodigoInstituicao=1
83;GPIV33;28/10/2015;22:15;Cancelamento de ações mantidas em tesouraria;https://www.rad.cvm.gov.br/ENET/frmDownloadDocumento.aspx?Tela=ext&numProtocolo=488974&descTipo=IPE&CodigoInstituicao=1
84;GPIV33;15/10/2015;23:00;Aprovação de novo programa de recompra de ações;https://www.rad.cvm.gov.br/ENET/frmDownloadDocumento.aspx?Tela=ext&numProtocolo=487961&descTipo=IPE&CodigoInstituicao=1
85;GPIV33;15/10/2015;22:55;Cancelamento de ações mantidas em tesouraria;https://www.rad.cvm.gov.br/ENET/frmDownloadDocumento.aspx?Tela=ext&numProtocolo=487959&descTipo=IPE&CodigoInstituicao=1
86;GPIV33;10/08/2015;21:42;Aprovação do Novo Programa de Recompra de Ações;https://www.rad.cvm.gov.br/ENET/frmDownloadDocumento.aspx?Tela=ext&numProtocolo=480877&descTipo=IPE&CodigoInstituicao=1
87;GPIV33;10/08/2015;21:34;Cancelamento de Ações;https://www.rad.cvm.gov.br/ENET/frmDownloadDocumento.aspx?Tela=ext&numProtocolo=480874&descTipo=IPE&CodigoInstituicao=1
88;GPIV33;27/07/2015;18:21;Anúncio de Pré-pagamento de Dívida;https://www.rad.cvm.gov.br/ENET/frmDownloadDocumento.aspx?Tela=ext&numProtocolo=478569&descTipo=IPE&CodigoInstituicao=1
89;GPIV33;22/06/2015;08:53;Anúncio de Conversão de Debêntures;https://www.rad.cvm.gov.br/ENET/frmDownloadDocumento.aspx?Tela=ext&numProtocolo=475216&descTipo=IPE&CodigoInstituicao=1
90;GPIV33;03/06/2015;08:48;Anúncio de Início da Oferta Pública de Ações da FPC Par Corretora;https://www.rad.cvm.gov.br/ENET/frmDownloadDocumento.aspx?Tela=ext&numProtocolo=473303&descTipo=IPE&CodigoInstituicao=1
91;GPIV33;13/05/2015;09:32;Oferta Pública de Ações de Investida;https://www.rad.cvm.gov.br/ENET/frmDownloadDocumento.aspx?Tela=ext&numProtocolo=471301&descTipo=IPE&CodigoInstituicao=1
92;GPIV33;12/02/2015;20:31;Aprovação no novo programa de recompra de ações da Companhia;https://www.rad.cvm.gov.br/ENET/frmDownloadDocumento.aspx?Tela=ext&numProtocolo=455979&descTipo=IPE&CodigoInstituicao=1
93;GPIV33;12/02/2015;20:29;Cancelamento de Ações em Tesouraria;https://www.rad.cvm.gov.br/ENET/frmDownloadDocumento.aspx?Tela=ext&numProtocolo=455978&descTipo=IPE&CodigoInstituicao=1
94;GPIV33;19/11/2014;18:53;Fechamento da Venda de BR Towers;https://www.rad.cvm.gov.br/ENET/frmDownloadDocumento.aspx?Tela=ext&numProtocolo=446834&descTipo=IPE&CodigoInstituicao=1
95;GPIV33;10/11/2014;19:32;Atualização Política de Divulgação de Ato ou Fato Relevante;https://www.rad.cvm.gov.br/ENET/frmDownloadDocumento.aspx?Tela=ext&numProtocolo=445715&descTipo=IPE&CodigoInstituicao=1
96;GPIV33;27/10/2014;19:23;Novo Programa de Recompra de Ações;https://www.rad.cvm.gov.br/ENET/frmDownloadDocumento.aspx?Tela=ext&numProtocolo=443432&descTipo=IPE&CodigoInstituicao=1
97;GPIV33;27/10/2014;18:42;Cancelamento de Ações em Tesouraria;https://www.rad.cvm.gov.br/ENET/frmDownloadDocumento.aspx?Tela=ext&numProtocolo=443426&descTipo=IPE&CodigoInstituicao=1
98;GPIV33;13/10/2014;19:32;Oferta Inicial de Ações - Empresa Investida;https://www.rad.cvm.gov.br/ENET/frmDownloadDocumento.aspx?Tela=ext&numProtocolo=442496&descTipo=IPE&CodigoInstituicao=1
99;GPIV33;01/09/2014;09:00;GP INVESTMENTS ANUNCIA O FECHAMENTO DA VENDA DA SASCAR;https://www.rad.cvm.gov.br/ENET/frmDownloadDocumento.aspx?Tela=ext&numProtocolo=437584&descTipo=IPE&CodigoInstituicao=1
