;Acao;Data;Hora;Descrição;Link
0;MNDL3;25/02/2023;00:33;Acordo de transação/Parcelamento ;https://www.rad.cvm.gov.br/ENET/frmDownloadDocumento.aspx?Tela=ext&numProtocolo=1065294&descTipo=IPE&CodigoInstituicao=1
1;MNDL3;30/09/2022;18:09;Protocolado propostas individuais de transação tributária ;https://www.rad.cvm.gov.br/ENET/frmDownloadDocumento.aspx?Tela=ext&numProtocolo=1018653&descTipo=IPE&CodigoInstituicao=1
2;MNDL3;14/04/2020;07:18;"Alteração data da AGOE; Alteração data do Edital de Convocação.";https://www.rad.cvm.gov.br/ENET/frmDownloadDocumento.aspx?Tela=ext&numProtocolo=753912&descTipo=IPE&CodigoInstituicao=1
3;MNDL3;29/09/2016;17:33;Período de preferencia para alienação de subsidiarias;https://www.rad.cvm.gov.br/ENET/frmDownloadDocumento.aspx?Tela=ext&numProtocolo=532355&descTipo=IPE&CodigoInstituicao=1
4;MNDL3;25/04/2016;18:37;Cancelamento de Registro de Companhia Aberta;https://www.rad.cvm.gov.br/ENET/frmDownloadDocumento.aspx?Tela=ext&numProtocolo=511945&descTipo=IPE&CodigoInstituicao=1
5;MNDL3;22/12/2015;18:10;Confirmação do protocolo da OPA apresentado pela acionista ZHEPAR.;https://www.rad.cvm.gov.br/ENET/frmDownloadDocumento.aspx?Tela=ext&numProtocolo=496166&descTipo=IPE&CodigoInstituicao=1
6;MNDL3;21/12/2015;18:20;Cancelamento de Registro de Companhia Aberta;https://www.rad.cvm.gov.br/ENET/frmDownloadDocumento.aspx?Tela=ext&numProtocolo=496038&descTipo=IPE&CodigoInstituicao=1
7;MNDL3;26/11/2015;18:33;Cancelamento de Registro de Companhia Aberta;https://www.rad.cvm.gov.br/ENET/frmDownloadDocumento.aspx?Tela=ext&numProtocolo=492745&descTipo=IPE&CodigoInstituicao=1
8;MNDL3;26/11/2015;17:59;Cancelamento de Registro de Companhia Aberta;https://www.rad.cvm.gov.br/ENET/frmDownloadDocumento.aspx?Tela=ext&numProtocolo=492719&descTipo=IPE&CodigoInstituicao=1
9;MNDL3;11/09/2014;10:16;"Cancelamento das deliberações da AGE de 03 de junho de 2013.; Aprovação para emissão de até 50.000 (cinquenta mil) Debêntures com valor nominal unitário de R$ 1.000,00 (um mil) reais.";https://www.rad.cvm.gov.br/ENET/frmDownloadDocumento.aspx?Tela=ext&numProtocolo=439268&descTipo=IPE&CodigoInstituicao=1
10;MNDL3;14/08/2014;18:06;Informação referente atraso na divulgação do segundo trimestre 2014.;https://www.rad.cvm.gov.br/ENET/frmDownloadDocumento.aspx?Tela=ext&numProtocolo=436305&descTipo=IPE&CodigoInstituicao=1
11;MNDL3;08/01/2014;19:08;Incorporação do acionista ZENITH Adm e particip. Ltda.;https://www.rad.cvm.gov.br/ENET/frmDownloadDocumento.aspx?Tela=ext&numProtocolo=406964&descTipo=IPE&CodigoInstituicao=1
12;MNDL3;13/12/2013;18:45;Aquisição de Debentures Simples emitidas pela empresa Hercules S/A - Fábrica de talheres;https://www.rad.cvm.gov.br/ENET/frmDownloadDocumento.aspx?Tela=ext&numProtocolo=404910&descTipo=IPE&CodigoInstituicao=1
13;MNDL3;17/05/2013;10:54;Cancelado a Web Cast de resultados do 1T13. Face incapacidade da empresa contratada de prestar serviços.;https://www.rad.cvm.gov.br/ENET/frmDownloadDocumento.aspx?Tela=ext&numProtocolo=382019&descTipo=IPE&CodigoInstituicao=1
14;MNDL3;14/05/2013;09:54;Informe da apuração das frações do grupamento das ações da Companhia e data do leilão.;https://www.rad.cvm.gov.br/ENET/frmDownloadDocumento.aspx?Tela=ext&numProtocolo=381431&descTipo=IPE&CodigoInstituicao=1
15;MNDL3;15/04/2013;10:50;Material revista Exame.;https://www.rad.cvm.gov.br/ENET/frmDownloadDocumento.aspx?Tela=ext&numProtocolo=375804&descTipo=IPE&CodigoInstituicao=1
16;MNDL3;13/12/2012;18:17;Indeferimento ao pedido de Ingresso Novo Mercado;https://www.rad.cvm.gov.br/ENET/frmDownloadDocumento.aspx?Tela=ext&numProtocolo=361038&descTipo=IPE&CodigoInstituicao=1
17;MNDL3;14/11/2012;19:12;Alienação de Imóvel não operacional;https://www.rad.cvm.gov.br/ENET/frmDownloadDocumento.aspx?Tela=ext&numProtocolo=357867&descTipo=IPE&CodigoInstituicao=1
18;MNDL3;17/10/2012;12:47;Esclarecimentos e informações adicionais ao pedido de ingresso NM.;https://www.rad.cvm.gov.br/ENET/frmDownloadDocumento.aspx?Tela=ext&numProtocolo=354282&descTipo=IPE&CodigoInstituicao=1
19;MNDL3;28/09/2012;15:33;Novo prazo para resposta a esclarecimentos adicionais referente pedido de ingresso no segmento Novo Mercado.;https://www.rad.cvm.gov.br/ENET/frmDownloadDocumento.aspx?Tela=ext&numProtocolo=352330&descTipo=IPE&CodigoInstituicao=1
20;MNDL3;31/08/2012;17:19;Esclarecimentos ao mercado referente pedido de ingresso no segmento Novo Mercado.;https://www.rad.cvm.gov.br/ENET/frmDownloadDocumento.aspx?Tela=ext&numProtocolo=349749&descTipo=IPE&CodigoInstituicao=1
21;MNDL3;01/08/2012;09:04;Esclarecimentos adicionais ao pedido de ingresso no segmento Novo Mercado.;https://www.rad.cvm.gov.br/ENET/frmDownloadDocumento.aspx?Tela=ext&numProtocolo=346058&descTipo=IPE&CodigoInstituicao=1
22;MNDL3;11/07/2012;09:38;Prorrogação do prazo pela BM&FBOVESPA esclarecimentos adicionais ingresso NM.;https://www.rad.cvm.gov.br/ENET/frmDownloadDocumento.aspx?Tela=ext&numProtocolo=344397&descTipo=IPE&CodigoInstituicao=1
23;MNDL3;27/06/2012;09:36;Esclarecimentos adicionais pedido de ingresso no segmento Novo Mercado.;https://www.rad.cvm.gov.br/ENET/frmDownloadDocumento.aspx?Tela=ext&numProtocolo=342343&descTipo=IPE&CodigoInstituicao=1
24;MNDL3;20/06/2012;18:11;Encerramento do péríodo das sobras e homologação do aumento de capital da Companhia.;https://www.rad.cvm.gov.br/ENET/frmDownloadDocumento.aspx?Tela=ext&numProtocolo=341855&descTipo=IPE&CodigoInstituicao=1
25;MNDL3;20/06/2012;09:42;Esclarecimento sobre o pedido de ingresso para o segmento Novo Mercado, informações adicionais solicitadas.;https://www.rad.cvm.gov.br/ENET/frmDownloadDocumento.aspx?Tela=ext&numProtocolo=341801&descTipo=IPE&CodigoInstituicao=1
26;MNDL3;11/06/2012;10:47;Esclarecimento ao mercado.;https://www.rad.cvm.gov.br/ENET/frmDownloadDocumento.aspx?Tela=ext&numProtocolo=340835&descTipo=IPE&CodigoInstituicao=1
27;MNDL3;06/06/2012;09:28;Apuração da subscrição das ações e anuncio do primeiro período das sobras.;https://www.rad.cvm.gov.br/ENET/frmDownloadDocumento.aspx?Tela=ext&numProtocolo=340091&descTipo=IPE&CodigoInstituicao=1
28;MNDL3;30/05/2012;10:53;Encerramento do prazo de 30 dias para o exercício do direito de preferência na subscrição no aumento de capital da Companhia.;https://www.rad.cvm.gov.br/ENET/frmDownloadDocumento.aspx?Tela=ext&numProtocolo=339287&descTipo=IPE&CodigoInstituicao=1
29;MNDL3;29/05/2012;09:29;Aumento de Capital por meio de emissão privada de ações.;https://www.rad.cvm.gov.br/ENET/frmDownloadDocumento.aspx?Tela=ext&numProtocolo=339147&descTipo=IPE&CodigoInstituicao=1
30;MNDL3;17/05/2012;19:37;Incorporação Acionista Hammers;https://www.rad.cvm.gov.br/ENET/frmDownloadDocumento.aspx?Tela=ext&numProtocolo=338196&descTipo=IPE&CodigoInstituicao=1
31;MNDL3;11/05/2012;18:19;Pedido de ingresso no segmento Novo Mercado, protocolado na BM&FBOVESPA.;https://www.rad.cvm.gov.br/ENET/frmDownloadDocumento.aspx?Tela=ext&numProtocolo=337427&descTipo=IPE&CodigoInstituicao=1
32;MNDL3;29/02/2012;10:39;Conversão das Ações Preferencias em Ordinárias.;https://www.rad.cvm.gov.br/ENET/frmDownloadDocumento.aspx?Tela=ext&numProtocolo=321866&descTipo=IPE&CodigoInstituicao=1
33;MNDL3;20/01/2012;19:13;Conversões de Ações, Direito de Retirada e Migração NM.;https://www.rad.cvm.gov.br/ENET/frmDownloadDocumento.aspx?Tela=ext&numProtocolo=318000&descTipo=IPE&CodigoInstituicao=1
34;MNDL3;22/12/2011;19:13;Alteração do prestador de serviço de escrituração de ações.;https://www.rad.cvm.gov.br/ENET/frmDownloadDocumento.aspx?Tela=ext&numProtocolo=315359&descTipo=IPE&CodigoInstituicao=1
35;MNDL3;16/12/2011;17:55;Aquisição de ações preferencias da Companhia.;https://www.rad.cvm.gov.br/ENET/frmDownloadDocumento.aspx?Tela=ext&numProtocolo=314775&descTipo=IPE&CodigoInstituicao=1
36;MNDL3;12/12/2011;19:32;Editais de Convocação Assembleias Especial de preferencialistas.;https://www.rad.cvm.gov.br/ENET/frmDownloadDocumento.aspx?Tela=ext&numProtocolo=314161&descTipo=IPE&CodigoInstituicao=1
37;MNDL3;30/11/2011;19:07;Pedido público de procuração.;https://www.rad.cvm.gov.br/ENET/frmDownloadDocumento.aspx?Tela=ext&numProtocolo=312397&descTipo=IPE&CodigoInstituicao=1
38;MNDL3;17/11/2011;17:45;Intenção de realizar pedido público de procuração.;https://www.rad.cvm.gov.br/ENET/frmDownloadDocumento.aspx?Tela=ext&numProtocolo=311463&descTipo=IPE&CodigoInstituicao=1
39;MNDL3;17/11/2011;09:23;Redução do quórum de deliberação em AGESP para conversão de Ações Preferencias em ordinárias.;https://www.rad.cvm.gov.br/ENET/frmDownloadDocumento.aspx?Tela=ext&numProtocolo=311392&descTipo=IPE&CodigoInstituicao=1
40;MNDL3;29/09/2011;22:09;Alienação judicial dos imóveis não operacionais da Companhia.;https://www.rad.cvm.gov.br/ENET/frmDownloadDocumento.aspx?Tela=ext&numProtocolo=305948&descTipo=IPE&CodigoInstituicao=1
41;MNDL3;29/09/2011;22:01;Alenação judicial dos imóveis não operacionais da Companhia.;https://www.rad.cvm.gov.br/ENET/frmDownloadDocumento.aspx?Tela=ext&numProtocolo=305947&descTipo=IPE&CodigoInstituicao=1
42;MNDL3;29/09/2011;18:21;Alenação judicial dos imóveis não operacionais da Companhia.;https://www.rad.cvm.gov.br/ENET/frmDownloadDocumento.aspx?Tela=ext&numProtocolo=305936&descTipo=IPE&CodigoInstituicao=1
43;MNDL3;15/09/2011;13:46;Noticia sobre investigações das oscilações de preços das Ações da Companhia.;https://www.rad.cvm.gov.br/ENET/frmDownloadDocumento.aspx?Tela=ext&numProtocolo=305017&descTipo=IPE&CodigoInstituicao=1
44;MNDL3;22/08/2011;17:48;Pagamento da terceira parcela JCP exercício encerrado em 31/12/2010.;https://www.rad.cvm.gov.br/ENET/frmDownloadDocumento.aspx?Tela=ext&numProtocolo=302498&descTipo=IPE&CodigoInstituicao=1
45;MNDL3;12/08/2011;17:56;Previsão de divulgação do 2º ITR 2011.;https://www.rad.cvm.gov.br/ENET/frmDownloadDocumento.aspx?Tela=ext&numProtocolo=301688&descTipo=IPE&CodigoInstituicao=1
46;MNDL3;05/08/2011;15:19;Autorização para a redução do quorum de deliberação na terceira convocação da AGESP, nos termos dos parágrafos 2º e 3º do artigo 136 da Lei 6.404/7.;https://www.rad.cvm.gov.br/ENET/frmDownloadDocumento.aspx?Tela=ext&numProtocolo=300081&descTipo=IPE&CodigoInstituicao=1
47;MNDL3;27/07/2011;18:40;Anuncio das próximas convocações das assembléias proposta de ingresso ao Novo Mercado;https://www.rad.cvm.gov.br/ENET/frmDownloadDocumento.aspx?Tela=ext&numProtocolo=299121&descTipo=IPE&CodigoInstituicao=1
48;MNDL3;25/07/2011;13:37;Esclarecimento referente oscilações das ações da Companhia.;https://www.rad.cvm.gov.br/ENET/frmDownloadDocumento.aspx?Tela=ext&numProtocolo=298843&descTipo=IPE&CodigoInstituicao=1
49;MNDL3;22/07/2011;17:04;Pagamento da segunda parcela JCP Exercício encerrado 31/12/2010.;https://www.rad.cvm.gov.br/ENET/frmDownloadDocumento.aspx?Tela=ext&numProtocolo=298783&descTipo=IPE&CodigoInstituicao=1
50;MNDL3;20/07/2011;18:03;Movimentação das ações.;https://www.rad.cvm.gov.br/ENET/frmDownloadDocumento.aspx?Tela=ext&numProtocolo=298567&descTipo=IPE&CodigoInstituicao=1
51;MNDL3;18/07/2011;08:36;Subscrição de ações em emissão privada da Companhia.;https://www.rad.cvm.gov.br/ENET/frmDownloadDocumento.aspx?Tela=ext&numProtocolo=298359&descTipo=IPE&CodigoInstituicao=1
52;MNDL3;06/07/2011;10:31;"Crescimento da base de Acionistas; Informação sobre a Assembléia Geral Especial de Preferencialista";https://www.rad.cvm.gov.br/ENET/frmDownloadDocumento.aspx?Tela=ext&numProtocolo=296825&descTipo=IPE&CodigoInstituicao=1
53;MNDL3;29/06/2011;18:23;Migração para o Novo Mercado;https://www.rad.cvm.gov.br/ENET/frmDownloadDocumento.aspx?Tela=ext&numProtocolo=296053&descTipo=IPE&CodigoInstituicao=1
54;MNDL3;22/06/2011;18:08;Pagamento primeira parcela do JCP;https://www.rad.cvm.gov.br/ENET/frmDownloadDocumento.aspx?Tela=ext&numProtocolo=295710&descTipo=IPE&CodigoInstituicao=1
55;MNDL3;13/05/2011;17:47;Contratação empresa EUROVEST;https://www.rad.cvm.gov.br/ENET/frmDownloadDocumento.aspx?Tela=ext&numProtocolo=291521&descTipo=IPE&CodigoInstituicao=1
56;MNDL3;18/04/2011;19:43;"Receita Líquida primeiro trimestre; Data para próxima AGO/E";https://www.rad.cvm.gov.br/ENET/frmDownloadDocumento.aspx?Tela=ext&numProtocolo=286384&descTipo=IPE&CodigoInstituicao=1
57;MNDL3;05/04/2011;18:04;"Adesão ao Nível 1 de Governança Corporativa; Realização desdobramento de ações";https://www.rad.cvm.gov.br/ENET/frmDownloadDocumento.aspx?Tela=ext&numProtocolo=283637&descTipo=IPE&CodigoInstituicao=1
58;MNDL3;14/02/2011;18:20;Processo de Adjudicação no Estado do RGS de imóvel;https://www.rad.cvm.gov.br/ENET/frmDownloadDocumento.aspx?Tela=ext&numProtocolo=276137&descTipo=IPE&CodigoInstituicao=1
59;MNDL3;25/08/2010;18:10;Adesão ao Programa de parcelamento de Débitos de ICMS do RGS;https://www.rad.cvm.gov.br/ENET/frmDownloadDocumento.aspx?Tela=ext&numProtocolo=257708&descTipo=IPE&CodigoInstituicao=1
60;MNDL3;17/08/2010;16:38;Esclarecimento noticia sobre negociação.;https://www.rad.cvm.gov.br/ENET/frmDownloadDocumento.aspx?Tela=ext&numProtocolo=257161&descTipo=IPE&CodigoInstituicao=1
61;MNDL3;13/08/2009;18:46;Repactuação das Debentures;https://www.rad.cvm.gov.br/ENET/frmDownloadDocumento.aspx?Tela=ext&numProtocolo=212697&descTipo=IPE&CodigoInstituicao=1
62;MNDL3;06/08/2009;12:07;Repactuação das Debentures;https://www.rad.cvm.gov.br/ENET/frmDownloadDocumento.aspx?Tela=ext&numProtocolo=211197&descTipo=IPE&CodigoInstituicao=1
63;MNDL3;27/05/2009;16:11;Comunicado anuncios societários publicados no Jornal Valor Economico;https://www.rad.cvm.gov.br/ENET/frmDownloadDocumento.aspx?Tela=ext&numProtocolo=204172&descTipo=IPE&CodigoInstituicao=1
64;MNDL3;02/10/2008;12:43;Pagamento da quinta e última parcela JCP Mundial.;https://www.rad.cvm.gov.br/ENET/frmDownloadDocumento.aspx?Tela=ext&numProtocolo=177978&descTipo=IPE&CodigoInstituicao=1
65;MNDL3;02/09/2008;10:37;Pagamento da quarta parcela JCP Mundial.;https://www.rad.cvm.gov.br/ENET/frmDownloadDocumento.aspx?Tela=ext&numProtocolo=175213&descTipo=IPE&CodigoInstituicao=1
66;MNDL3;01/08/2008;16:02;Pagamento da terceira parcela JCP Mundial;https://www.rad.cvm.gov.br/ENET/frmDownloadDocumento.aspx?Tela=ext&numProtocolo=171774&descTipo=IPE&CodigoInstituicao=1
67;MNDL3;02/07/2008;13:47;Pagamento segunda parcela JCP;https://www.rad.cvm.gov.br/ENET/frmDownloadDocumento.aspx?Tela=ext&numProtocolo=168678&descTipo=IPE&CodigoInstituicao=1
68;MNDL3;03/06/2008;16:53;Pagamento da primeira parcela JCP 2008;https://www.rad.cvm.gov.br/ENET/frmDownloadDocumento.aspx?Tela=ext&numProtocolo=165710&descTipo=IPE&CodigoInstituicao=1
69;MNDL3;14/04/2008;18:43;Compra da marca Impala.;https://www.rad.cvm.gov.br/ENET/frmDownloadDocumento.aspx?Tela=ext&numProtocolo=159064&descTipo=IPE&CodigoInstituicao=1
70;MNDL3;05/11/2007;10:39;Juros s/ capital própria última parcela.;https://www.rad.cvm.gov.br/ENET/frmDownloadDocumento.aspx?Tela=ext&numProtocolo=139883&descTipo=IPE&CodigoInstituicao=1
71;MNDL3;16/10/2007;09:24;Contrato de Licenciamento;https://www.rad.cvm.gov.br/ENET/frmDownloadDocumento.aspx?Tela=ext&numProtocolo=138446&descTipo=IPE&CodigoInstituicao=1
72;MNDL3;01/10/2007;18:36;Pagamento da parcela 04 dos Juros s/capital própria;https://www.rad.cvm.gov.br/ENET/frmDownloadDocumento.aspx?Tela=ext&numProtocolo=136650&descTipo=IPE&CodigoInstituicao=1
73;MNDL3;04/09/2007;14:50;Informativo pagamento da parcela 03 dos JCP.;https://www.rad.cvm.gov.br/ENET/frmDownloadDocumento.aspx?Tela=ext&numProtocolo=133939&descTipo=IPE&CodigoInstituicao=1
74;MNDL3;03/08/2007;12:23;Aviso de pagamento JCP segunda parcela;https://www.rad.cvm.gov.br/ENET/frmDownloadDocumento.aspx?Tela=ext&numProtocolo=130564&descTipo=IPE&CodigoInstituicao=1
75;MNDL3;05/07/2007;11:26;Alteração da data pagamento da primeira parcela juros s/capital próprio;https://www.rad.cvm.gov.br/ENET/frmDownloadDocumento.aspx?Tela=ext&numProtocolo=127186&descTipo=IPE&CodigoInstituicao=1
76;MNDL3;16/05/2006;17:08;Liquidação dívida junto ao Sesi e Senai;https://www.rad.cvm.gov.br/ENET/frmDownloadDocumento.aspx?Tela=ext&numProtocolo=89935&descTipo=IPE&CodigoInstituicao=1
77;MNDL3;16/05/2006;15:53;Liquidação da dívida com Sesi e Senai;https://www.rad.cvm.gov.br/ENET/frmDownloadDocumento.aspx?Tela=ext&numProtocolo=89920&descTipo=IPE&CodigoInstituicao=1
78;MNDL3;05/12/2005;18:24;"Proposta de incorporação das socied ON Sul e PN Sul; Alienação da Mundial INc., subsidiária integral da Mundial.";https://www.rad.cvm.gov.br/ENET/frmDownloadDocumento.aspx?Tela=ext&numProtocolo=74460&descTipo=IPE&CodigoInstituicao=1
79;MNDL3;17/09/2004;17:12;Alienação de Ativos da Divisão de Motores;https://www.rad.cvm.gov.br/ENET/frmDownloadDocumento.aspx?Tela=ext&numProtocolo=41524&descTipo=IPE&CodigoInstituicao=1
