;Acao;Data;Hora;Descrição;Link
0;NGRD3;26/05/2025;19:16;Mudanças na Diretoria Estatutária;https://www.rad.cvm.gov.br/ENET/frmDownloadDocumento.aspx?Tela=ext&numProtocolo=1383081&descTipo=IPE&CodigoInstituicao=1
1;NGRD3;15/05/2025;21:17;Divulgação Do Relatório Sem Ressalvas Dos Auditores Independentes Sobre As Demonstrações Financeiras Do Exercício Social De 2024;https://www.rad.cvm.gov.br/ENET/frmDownloadDocumento.aspx?Tela=ext&numProtocolo=1379326&descTipo=IPE&CodigoInstituicao=1
2;NGRD3;30/04/2025;19:01;Assembleia Geral Ordinária de 30.04.2025;https://www.rad.cvm.gov.br/ENET/frmDownloadDocumento.aspx?Tela=ext&numProtocolo=1369835&descTipo=IPE&CodigoInstituicao=1
3;NGRD3;31/03/2025;18:53;Assembleia geral ordinária de 30.04.2025 e Não divulgação do parecer dos auditores independentes sobre as demonstrações financeiras do exercício social de 2024;https://www.rad.cvm.gov.br/ENET/frmDownloadDocumento.aspx?Tela=ext&numProtocolo=1354955&descTipo=IPE&CodigoInstituicao=1
4;NGRD3;31/03/2025;18:53; Ajustes contábeis de exercício anterior sem efeito em caixa;https://www.rad.cvm.gov.br/ENET/frmDownloadDocumento.aspx?Tela=ext&numProtocolo=1354957&descTipo=IPE&CodigoInstituicao=1
5;NGRD3;05/03/2025;19:25;Atualização nas Políticas de Divulgação, Negociação e Portal de Notícias;https://www.rad.cvm.gov.br/ENET/frmDownloadDocumento.aspx?Tela=ext&numProtocolo=1342411&descTipo=IPE&CodigoInstituicao=1
6;NGRD3;04/02/2025;17:20;Renúncia de Diretor Estatutário;https://www.rad.cvm.gov.br/ENET/frmDownloadDocumento.aspx?Tela=ext&numProtocolo=1330247&descTipo=IPE&CodigoInstituicao=1
7;NGRD3;03/02/2025;18:03;Renúncia de Diretor Estatutário;https://www.rad.cvm.gov.br/ENET/frmDownloadDocumento.aspx?Tela=ext&numProtocolo=1329751&descTipo=IPE&CodigoInstituicao=1
8;NGRD3;02/01/2025;18:15;Projeção Regra dos 40;https://www.rad.cvm.gov.br/ENET/frmDownloadDocumento.aspx?Tela=ext&numProtocolo=1321254&descTipo=IPE&CodigoInstituicao=1
9;NGRD3;06/09/2024;09:02;Regras Operacionais para Recompra de Ações;https://www.rad.cvm.gov.br/ENET/frmDownloadDocumento.aspx?Tela=ext&numProtocolo=1279474&descTipo=IPE&CodigoInstituicao=1
10;NGRD3;05/09/2024;18:22;Grupamento e Desdobramento de Ações;https://www.rad.cvm.gov.br/ENET/frmDownloadDocumento.aspx?Tela=ext&numProtocolo=1279220&descTipo=IPE&CodigoInstituicao=1
11;NGRD3;25/07/2024;10:09;Alteração no Conselho de Administração;https://www.rad.cvm.gov.br/ENET/frmDownloadDocumento.aspx?Tela=ext&numProtocolo=1262594&descTipo=IPE&CodigoInstituicao=1
12;NGRD3;22/07/2024;10:17;Renúncia de Conselheiro de Administração;https://www.rad.cvm.gov.br/ENET/frmDownloadDocumento.aspx?Tela=ext&numProtocolo=1261454&descTipo=IPE&CodigoInstituicao=1
13;NGRD3;22/07/2024;10:06;Renúncia de Conselheiro de Administração;https://www.rad.cvm.gov.br/ENET/frmDownloadDocumento.aspx?Tela=ext&numProtocolo=1261452&descTipo=IPE&CodigoInstituicao=1
14;NGRD3;11/07/2024;17:59;(i) Cancelamento de ações em tesouraria;https://www.rad.cvm.gov.br/ENET/frmDownloadDocumento.aspx?Tela=ext&numProtocolo=1259067&descTipo=IPE&CodigoInstituicao=1
15;NGRD3;11/07/2024;17:59;(i) cronograma preliminar de implementação do enquadramento da cotação das ações da Companhia, Ofício 492/2024-SLE;https://www.rad.cvm.gov.br/ENET/frmDownloadDocumento.aspx?Tela=ext&numProtocolo=1259069&descTipo=IPE&CodigoInstituicao=1
16;NGRD3;01/07/2024;09:01;Cotação das Ações da Companhia - Ofício B3 492/2024-SLE;https://www.rad.cvm.gov.br/ENET/frmDownloadDocumento.aspx?Tela=ext&numProtocolo=1255086&descTipo=IPE&CodigoInstituicao=1
17;NGRD3;01/04/2024;19:18;Alteração na Diretoria Estatutária;https://www.rad.cvm.gov.br/ENET/frmDownloadDocumento.aspx?Tela=ext&numProtocolo=1216367&descTipo=IPE&CodigoInstituicao=1
18;NGRD3;01/04/2024;18:30;Alteração na Diretoria Estatutária;https://www.rad.cvm.gov.br/ENET/frmDownloadDocumento.aspx?Tela=ext&numProtocolo=1216314&descTipo=IPE&CodigoInstituicao=1
19;NGRD3;29/12/2023;08:36;Aquisição integral da controlada Predify, e coligada Horus;https://www.rad.cvm.gov.br/ENET/frmDownloadDocumento.aspx?Tela=ext&numProtocolo=1178577&descTipo=IPE&CodigoInstituicao=1
20;NGRD3;15/12/2023;18:16;Resgate Antecipado da 1ª Emissão de Debêntures;https://www.rad.cvm.gov.br/ENET/frmDownloadDocumento.aspx?Tela=ext&numProtocolo=1174265&descTipo=IPE&CodigoInstituicao=1
21;NGRD3;30/05/2023;18:53;Mudança na composição do Conselho de Administração;https://www.rad.cvm.gov.br/ENET/frmDownloadDocumento.aspx?Tela=ext&numProtocolo=1107776&descTipo=IPE&CodigoInstituicao=1
22;NGRD3;27/04/2023;18:31;Mudança na composição do CA;https://www.rad.cvm.gov.br/ENET/frmDownloadDocumento.aspx?Tela=ext&numProtocolo=1091634&descTipo=IPE&CodigoInstituicao=1
23;NGRD3;02/03/2023;09:31;Alteração na Diretoria Estatutária;https://www.rad.cvm.gov.br/ENET/frmDownloadDocumento.aspx?Tela=ext&numProtocolo=1067572&descTipo=IPE&CodigoInstituicao=1
24;NGRD3;21/06/2022;18:07;Encerramento do Programa de Recompra;https://www.rad.cvm.gov.br/ENET/frmDownloadDocumento.aspx?Tela=ext&numProtocolo=992104&descTipo=IPE&CodigoInstituicao=1
25;NGRD3;17/05/2022;18:16;Alteração na composição da diretoria estatutária;https://www.rad.cvm.gov.br/ENET/frmDownloadDocumento.aspx?Tela=ext&numProtocolo=982724&descTipo=IPE&CodigoInstituicao=1
26;NGRD3;13/04/2022;18:04;Alteração na Diretoria Estatutária;https://www.rad.cvm.gov.br/ENET/frmDownloadDocumento.aspx?Tela=ext&numProtocolo=967122&descTipo=IPE&CodigoInstituicao=1
27;NGRD3;14/02/2022;17:12;Live com a TradeMap;https://www.rad.cvm.gov.br/ENET/frmDownloadDocumento.aspx?Tela=ext&numProtocolo=943333&descTipo=IPE&CodigoInstituicao=1
28;NGRD3;07/02/2022;18:12;Eleição de CEO;https://www.rad.cvm.gov.br/ENET/frmDownloadDocumento.aspx?Tela=ext&numProtocolo=939501&descTipo=IPE&CodigoInstituicao=1
29;NGRD3;27/01/2022;18:22;Mudança na composição do CA;https://www.rad.cvm.gov.br/ENET/frmDownloadDocumento.aspx?Tela=ext&numProtocolo=936001&descTipo=IPE&CodigoInstituicao=1
30;NGRD3;21/01/2022;18:16;Live com a Condor Insider;https://www.rad.cvm.gov.br/ENET/frmDownloadDocumento.aspx?Tela=ext&numProtocolo=934868&descTipo=IPE&CodigoInstituicao=1
31;NGRD3;18/01/2022;18:24;Programa de Recompra;https://www.rad.cvm.gov.br/ENET/frmDownloadDocumento.aspx?Tela=ext&numProtocolo=934193&descTipo=IPE&CodigoInstituicao=1
32;NGRD3;14/12/2021;09:01;Aquisição de participação na Predify;https://www.rad.cvm.gov.br/ENET/frmDownloadDocumento.aspx?Tela=ext&numProtocolo=925729&descTipo=IPE&CodigoInstituicao=1
33;NGRD3;28/10/2021;18:13;Sucessão do diretor presidente;https://www.rad.cvm.gov.br/ENET/frmDownloadDocumento.aspx?Tela=ext&numProtocolo=910959&descTipo=IPE&CodigoInstituicao=1
34;NGRD3;30/09/2021;18:51;Aquisição da Lett;https://www.rad.cvm.gov.br/ENET/frmDownloadDocumento.aspx?Tela=ext&numProtocolo=904480&descTipo=IPE&CodigoInstituicao=1
35;NGRD3;30/09/2021;16:17;Eleição de diretor estatutario para a Diretoria de Tecnologia;https://www.rad.cvm.gov.br/ENET/frmDownloadDocumento.aspx?Tela=ext&numProtocolo=904418&descTipo=IPE&CodigoInstituicao=1
36;NGRD3;16/09/2021;09:05;Aquisição da Arker Tecnologia;https://www.rad.cvm.gov.br/ENET/frmDownloadDocumento.aspx?Tela=ext&numProtocolo=901411&descTipo=IPE&CodigoInstituicao=1
37;NGRD3;24/08/2021;18:03;Comunicado ao Mercado - Participação em Live BM&C News;https://www.rad.cvm.gov.br/ENET/frmDownloadDocumento.aspx?Tela=ext&numProtocolo=895984&descTipo=IPE&CodigoInstituicao=1
38;NGRD3;19/08/2021;09:32;Participação de executivos da Companhia em live da Infomoney;https://www.rad.cvm.gov.br/ENET/frmDownloadDocumento.aspx?Tela=ext&numProtocolo=894916&descTipo=IPE&CodigoInstituicao=1
39;NGRD3;20/07/2021;09:24;Assinatura do contrato de investimento e aquisição da Horus;https://www.rad.cvm.gov.br/ENET/frmDownloadDocumento.aspx?Tela=ext&numProtocolo=884978&descTipo=IPE&CodigoInstituicao=1
40;NGRD3;25/06/2021;18:09;Alteração na Diretoria Estatutária;https://www.rad.cvm.gov.br/ENET/frmDownloadDocumento.aspx?Tela=ext&numProtocolo=879007&descTipo=IPE&CodigoInstituicao=1
41;NGRD3;26/05/2021;17:50;Participação na live da BM&C Business;https://www.rad.cvm.gov.br/ENET/frmDownloadDocumento.aspx?Tela=ext&numProtocolo=871261&descTipo=IPE&CodigoInstituicao=1
42;NGRD3;24/05/2021;17:59;?Mille com CFO e RI da Neogrid? no canal do YouTube Bastter.com;https://www.rad.cvm.gov.br/ENET/frmDownloadDocumento.aspx?Tela=ext&numProtocolo=870724&descTipo=IPE&CodigoInstituicao=1
43;NGRD3;14/04/2021;18:14;Participação de executivos em live;https://www.rad.cvm.gov.br/ENET/frmDownloadDocumento.aspx?Tela=ext&numProtocolo=853891&descTipo=IPE&CodigoInstituicao=1
44;NGRD3;22/03/2021;09:25;Aquisição da Smarket Solutions;https://www.rad.cvm.gov.br/ENET/frmDownloadDocumento.aspx?Tela=ext&numProtocolo=844581&descTipo=IPE&CodigoInstituicao=1
