;Acao;Data;Hora;Descrição;Link
0;NUTR3;28/06/2023;18:05;Contratação de Formador de Mercado;https://www.rad.cvm.gov.br/ENET/frmDownloadDocumento.aspx?Tela=ext&numProtocolo=1117441&descTipo=IPE&CodigoInstituicao=1
1;NUTR3;27/03/2023;18:11;Desdobramento da totalidade das ações da Companhia;https://www.rad.cvm.gov.br/ENET/frmDownloadDocumento.aspx?Tela=ext&numProtocolo=1077656&descTipo=IPE&CodigoInstituicao=1
2;NUTR3;04/10/2022;20:47;Novo pedido de homologação do plano de recuperação extrajudicial da Companhia;https://www.rad.cvm.gov.br/ENET/frmDownloadDocumento.aspx?Tela=ext&numProtocolo=1019694&descTipo=IPE&CodigoInstituicao=1
3;NUTR3;25/08/2022;17:55;Prazo para reenquadramento do Percentual Mínimo de Ações em Circulação.;https://www.rad.cvm.gov.br/ENET/frmDownloadDocumento.aspx?Tela=ext&numProtocolo=1010933&descTipo=IPE&CodigoInstituicao=1
4;NUTR3;28/06/2022;18:25;Aprovado o aumento de capital social da Companhia em razão dos exercícios de opções de compra de ações ;https://www.rad.cvm.gov.br/ENET/frmDownloadDocumento.aspx?Tela=ext&numProtocolo=993625&descTipo=IPE&CodigoInstituicao=1
5;NUTR3;28/03/2022;14:30;Aprovado jornal de grande circulação para publicação de documentos;https://www.rad.cvm.gov.br/ENET/frmDownloadDocumento.aspx?Tela=ext&numProtocolo=959224&descTipo=IPE&CodigoInstituicao=1
6;NUTR3;02/12/2020;19:53;Revogação do plano de recuperação extrajudicial da Companhia;https://www.rad.cvm.gov.br/ENET/frmDownloadDocumento.aspx?Tela=ext&numProtocolo=812579&descTipo=IPE&CodigoInstituicao=1
7;NUTR3;15/04/2020;12:14;Reapresentação do Boletim de Voto a Distância da AGO de 30/04/20;https://www.rad.cvm.gov.br/ENET/frmDownloadDocumento.aspx?Tela=ext&numProtocolo=754324&descTipo=IPE&CodigoInstituicao=1
8;NUTR3;15/01/2020;19:07;Penhora de ações da Tripto Participações Ltda;https://www.rad.cvm.gov.br/ENET/frmDownloadDocumento.aspx?Tela=ext&numProtocolo=730733&descTipo=IPE&CodigoInstituicao=1
9;NUTR3;05/11/2018;17:56;Homologação Recuperação Extrajudicial;https://www.rad.cvm.gov.br/ENET/frmDownloadDocumento.aspx?Tela=ext&numProtocolo=648853&descTipo=IPE&CodigoInstituicao=1
10;NUTR3;02/02/2018;21:46;Rreenquadramento do Percentual Mínimo de Ações em Circulação;https://www.rad.cvm.gov.br/ENET/frmDownloadDocumento.aspx?Tela=ext&numProtocolo=595146&descTipo=IPE&CodigoInstituicao=1
11;NUTR3;03/10/2017;08:14;Protocolo de pedido de recuperação extrajudicial da Companhia;https://www.rad.cvm.gov.br/ENET/frmDownloadDocumento.aspx?Tela=ext&numProtocolo=581005&descTipo=IPE&CodigoInstituicao=1
12;NUTR3;23/12/2016;18:26;Rescisão do Memorando de Entendimentos com a Herbioeste Herbicidas Ltda. e seu controlador, o Grupo Wilhem Marques Dib;https://www.rad.cvm.gov.br/ENET/frmDownloadDocumento.aspx?Tela=ext&numProtocolo=542899&descTipo=IPE&CodigoInstituicao=1
13;NUTR3;14/10/2016;20:03;Apresentação de pedido de falência por fornecedores da Companhia;https://www.rad.cvm.gov.br/ENET/frmDownloadDocumento.aspx?Tela=ext&numProtocolo=534460&descTipo=IPE&CodigoInstituicao=1
14;NUTR3;23/10/2015;19:31;OPERAÇÃO DE EMISSÃO DE DEBÊNTURES E OUTRAS AVENÇAS COM A EMPRESA HERBIOESTE HERBICIDAS LTDA. E SEU CONTROLADOR, GRUPO WILHEM MARQUES DIB;https://www.rad.cvm.gov.br/ENET/frmDownloadDocumento.aspx?Tela=ext&numProtocolo=488616&descTipo=IPE&CodigoInstituicao=1
15;NUTR3;06/08/2015;17:24;Grupamento de ações da Companhia;https://www.rad.cvm.gov.br/ENET/frmDownloadDocumento.aspx?Tela=ext&numProtocolo=479868&descTipo=IPE&CodigoInstituicao=1
16;NUTR3;05/08/2015;14:38;Grupamento de ações da Companhia;https://www.rad.cvm.gov.br/ENET/frmDownloadDocumento.aspx?Tela=ext&numProtocolo=479565&descTipo=IPE&CodigoInstituicao=1
17;NUTR3;31/07/2015;18:10;Renúncia de membro do Conselho de Administração;https://www.rad.cvm.gov.br/ENET/frmDownloadDocumento.aspx?Tela=ext&numProtocolo=479190&descTipo=IPE&CodigoInstituicao=1
18;NUTR3;01/07/2015;10:26;Prazo para recomposição do Percentual Mínimo de Ações em Circulação da Companhia.;https://www.rad.cvm.gov.br/ENET/frmDownloadDocumento.aspx?Tela=ext&numProtocolo=476028&descTipo=IPE&CodigoInstituicao=1
19;NUTR3;15/04/2015;23:05;Celebração de Memorando de Entendimentos entre a Companhia, Herbioeste Herbicidas Ltda e Grupo WM Dib;https://www.rad.cvm.gov.br/ENET/frmDownloadDocumento.aspx?Tela=ext&numProtocolo=465513&descTipo=IPE&CodigoInstituicao=1
20;NUTR3;26/01/2015;10:09;Encerramento contrato Formador de Mercado;https://www.rad.cvm.gov.br/ENET/frmDownloadDocumento.aspx?Tela=ext&numProtocolo=453307&descTipo=IPE&CodigoInstituicao=1
21;NUTR3;12/01/2015;18:01;Prazo suspenso para atingir o float minimo da Companhia;https://www.rad.cvm.gov.br/ENET/frmDownloadDocumento.aspx?Tela=ext&numProtocolo=452523&descTipo=IPE&CodigoInstituicao=1
22;NUTR3;16/09/2014;10:47;Adiamento da realização da Assembleia Geral Extraordinária;https://www.rad.cvm.gov.br/ENET/frmDownloadDocumento.aspx?Tela=ext&numProtocolo=439609&descTipo=IPE&CodigoInstituicao=1
23;NUTR3;20/08/2014;16:37;Alteração da Política de Divulgação de Informações da Companhia;https://www.rad.cvm.gov.br/ENET/frmDownloadDocumento.aspx?Tela=ext&numProtocolo=436851&descTipo=IPE&CodigoInstituicao=1
24;NUTR3;04/08/2014;21:27;Eleição e renúncia de membros da Diretoria.;https://www.rad.cvm.gov.br/ENET/frmDownloadDocumento.aspx?Tela=ext&numProtocolo=434171&descTipo=IPE&CodigoInstituicao=1
25;NUTR3;04/03/2013;18:54;Antecipação da data de divulgação dos resultados de 2012;https://www.rad.cvm.gov.br/ENET/frmDownloadDocumento.aspx?Tela=ext&numProtocolo=368117&descTipo=IPE&CodigoInstituicao=1
26;NUTR3;18/01/2013;19:10;Alteração do endereço da sede da Companhia.;https://www.rad.cvm.gov.br/ENET/frmDownloadDocumento.aspx?Tela=ext&numProtocolo=364012&descTipo=IPE&CodigoInstituicao=1
27;NUTR3;26/06/2012;21:01;Venda de Ativos e Readequação da Estrutura de Capitais;https://www.rad.cvm.gov.br/ENET/frmDownloadDocumento.aspx?Tela=ext&numProtocolo=342329&descTipo=IPE&CodigoInstituicao=1
28;NUTR3;30/04/2012;17:43;"Reorganização Societária - Incorporação, Cisão ou Fusão da Companhia; Ratificação da proposta de incorporação das ações da Quirios Produtos Químicos por unanimidade dos votos dos presentes, com abstenção dos controladores";https://www.rad.cvm.gov.br/ENET/frmDownloadDocumento.aspx?Tela=ext&numProtocolo=334237&descTipo=IPE&CodigoInstituicao=1
29;NUTR3;12/04/2012;20:22;Reorganização Societária - Incorporação, Cisão ou Fusão da Companhia;https://www.rad.cvm.gov.br/ENET/frmDownloadDocumento.aspx?Tela=ext&numProtocolo=330847&descTipo=IPE&CodigoInstituicao=1
30;NUTR3;13/01/2012;18:23;Eleição de Diretor Presidente e de Relações com Investidores da Companhia.;https://www.rad.cvm.gov.br/ENET/frmDownloadDocumento.aspx?Tela=ext&numProtocolo=317636&descTipo=IPE&CodigoInstituicao=1
31;NUTR3;30/12/2011;08:54;Renúncia membro da diretoria.;https://www.rad.cvm.gov.br/ENET/frmDownloadDocumento.aspx?Tela=ext&numProtocolo=315835&descTipo=IPE&CodigoInstituicao=1
32;NUTR3;14/10/2011;19:22;Contrato com Formador de Mercado.;https://www.rad.cvm.gov.br/ENET/frmDownloadDocumento.aspx?Tela=ext&numProtocolo=307798&descTipo=IPE&CodigoInstituicao=1
33;NUTR3;23/09/2011;08:07;Mudança para negociação contínua de ações;https://www.rad.cvm.gov.br/ENET/frmDownloadDocumento.aspx?Tela=ext&numProtocolo=305532&descTipo=IPE&CodigoInstituicao=1
34;NUTR3;23/09/2011;08:07;Mudança para negociação contínua de ações;https://www.rad.cvm.gov.br/ENET/frmDownloadDocumento.aspx?Tela=ext&numProtocolo=305531&descTipo=IPE&CodigoInstituicao=1
35;NUTR3;07/07/2011;16:55;Renúncia de membros do Conselho de Administração.;https://www.rad.cvm.gov.br/ENET/frmDownloadDocumento.aspx?Tela=ext&numProtocolo=297110&descTipo=IPE&CodigoInstituicao=1
36;NUTR3;07/07/2011;16:53;Alterações na composição da Diretoria da Companhia.;https://www.rad.cvm.gov.br/ENET/frmDownloadDocumento.aspx?Tela=ext&numProtocolo=297108&descTipo=IPE&CodigoInstituicao=1
37;NUTR3;09/02/2011;09:40;RCA aprova inicio de estudos com potenciais investidores para emissão de debêntures conversíveis em ações.;https://www.rad.cvm.gov.br/ENET/frmDownloadDocumento.aspx?Tela=ext&numProtocolo=275171&descTipo=IPE&CodigoInstituicao=1
38;NUTR3;12/07/2010;17:34;Alienaçãodo imóvel sede da empresa e contratação de operação de leasing.;https://www.rad.cvm.gov.br/ENET/frmDownloadDocumento.aspx?Tela=ext&numProtocolo=253227&descTipo=IPE&CodigoInstituicao=1
39;NUTR3;08/07/2010;10:49;Comunicado de renuncia de membros do Conselho de Administração;https://www.rad.cvm.gov.br/ENET/frmDownloadDocumento.aspx?Tela=ext&numProtocolo=252540&descTipo=IPE&CodigoInstituicao=1
40;NUTR3;30/03/2010;11:49;Nova Agenda de Divulgação;https://www.rad.cvm.gov.br/ENET/frmDownloadDocumento.aspx?Tela=ext&numProtocolo=236837&descTipo=IPE&CodigoInstituicao=1
41;NUTR3;15/03/2010;16:54;Renúncia do Diretor de Suprimentos;https://www.rad.cvm.gov.br/ENET/frmDownloadDocumento.aspx?Tela=ext&numProtocolo=234622&descTipo=IPE&CodigoInstituicao=1
42;NUTR3;09/02/2010;09:06;Renuncia de membro do Conselho de Administração;https://www.rad.cvm.gov.br/ENET/frmDownloadDocumento.aspx?Tela=ext&numProtocolo=229981&descTipo=IPE&CodigoInstituicao=1
43;NUTR3;14/09/2009;08:02;Constituição do Nutriplant Fundo de Investimento em Direitos Creditórios Agroindustriais (FDIC).;https://www.rad.cvm.gov.br/ENET/frmDownloadDocumento.aspx?Tela=ext&numProtocolo=215737&descTipo=IPE&CodigoInstituicao=1
44;NUTR3;16/12/2008;16:08;Mudança no período do Exercício Social da Companhia;https://www.rad.cvm.gov.br/ENET/frmDownloadDocumento.aspx?Tela=ext&numProtocolo=185853&descTipo=IPE&CodigoInstituicao=1
45;NUTR3;12/11/2008;13:36;Complemento das deliberações da ata da RCA de 11 de novembro de 2008, com relação ao aumento de capital social.;https://www.rad.cvm.gov.br/ENET/frmDownloadDocumento.aspx?Tela=ext&numProtocolo=182522&descTipo=IPE&CodigoInstituicao=1
46;NUTR3;14/10/2008;15:21;Comunicado de Desligamento do Diretor Financeiro e de Relações com Investidores da Nutriplant;https://www.rad.cvm.gov.br/ENET/frmDownloadDocumento.aspx?Tela=ext&numProtocolo=179555&descTipo=IPE&CodigoInstituicao=1
47;NUTR3;07/10/2008;16:15;Apresentação efetuada no evento da J.P.Morgan Business Conference - São Paulo;https://www.rad.cvm.gov.br/ENET/frmDownloadDocumento.aspx?Tela=ext&numProtocolo=178392&descTipo=IPE&CodigoInstituicao=1
48;NUTR3;18/08/2008;10:15;Apresentação dos Resultados do 1T09;https://www.rad.cvm.gov.br/ENET/frmDownloadDocumento.aspx?Tela=ext&numProtocolo=174279&descTipo=IPE&CodigoInstituicao=1
49;NUTR3;11/06/2008;11:47;Apresentação efetuada no 2o. Seminário ANBID de Finanças Corporativas;https://www.rad.cvm.gov.br/ENET/frmDownloadDocumento.aspx?Tela=ext&numProtocolo=167188&descTipo=IPE&CodigoInstituicao=1
50;NUTR3;29/05/2008;10:10;Apresentação do Resultado do 4T08 e 12M08.;https://www.rad.cvm.gov.br/ENET/frmDownloadDocumento.aspx?Tela=ext&numProtocolo=165267&descTipo=IPE&CodigoInstituicao=1
51;NUTR3;17/03/2008;16:57;Apresentação 3T08 efetuada na Reunião APIMEC - São Paulo;https://www.rad.cvm.gov.br/ENET/frmDownloadDocumento.aspx?Tela=ext&numProtocolo=154686&descTipo=IPE&CodigoInstituicao=1
52;NUTR3;29/02/2008;09:09;Apresentação dos Resultados do 3T08 e 9M08;https://www.rad.cvm.gov.br/ENET/frmDownloadDocumento.aspx?Tela=ext&numProtocolo=152075&descTipo=IPE&CodigoInstituicao=1
53;NUTR3;20/02/2008;17:02;Anúncio de Encerramento da Oferta Pública de Distribuição Primária de Ações Ordinárias;https://www.rad.cvm.gov.br/ENET/frmDownloadDocumento.aspx?Tela=ext&numProtocolo=151274&descTipo=IPE&CodigoInstituicao=1
54;NUTR3;12/02/2008;17:22;Anúncio de Início de Distribuição Pública;https://www.rad.cvm.gov.br/ENET/frmDownloadDocumento.aspx?Tela=ext&numProtocolo=150585&descTipo=IPE&CodigoInstituicao=1
55;NUTR3;12/02/2008;17:18;Distribuição Publica de Ações;https://www.rad.cvm.gov.br/ENET/frmDownloadDocumento.aspx?Tela=ext&numProtocolo=150583&descTipo=IPE&CodigoInstituicao=1
56;NUTR3;12/02/2008;17:12;Distribuição Publica de Ações;https://www.rad.cvm.gov.br/ENET/frmDownloadDocumento.aspx?Tela=ext&numProtocolo=150580&descTipo=IPE&CodigoInstituicao=1
57;NUTR3;12/02/2008;17:10;Anúncio de Início de Distribuição Pública;https://www.rad.cvm.gov.br/ENET/frmDownloadDocumento.aspx?Tela=ext&numProtocolo=150579&descTipo=IPE&CodigoInstituicao=1
