;Acao;Data;Hora;Descrição;Link
0;PDGR3;10/07/2023;19:12;Aumento de Capital Privado;https://www.rad.cvm.gov.br/ENET/frmDownloadDocumento.aspx?Tela=ext&numProtocolo=1121505&descTipo=IPE&CodigoInstituicao=1
1;PDGR3;28/06/2023;23:02;Eleição dos membros do Conselho de Administração;https://www.rad.cvm.gov.br/ENET/frmDownloadDocumento.aspx?Tela=ext&numProtocolo=1117648&descTipo=IPE&CodigoInstituicao=1
2;PDGR3;08/05/2023;19:48;Alterações no Conselho de Administração;https://www.rad.cvm.gov.br/ENET/frmDownloadDocumento.aspx?Tela=ext&numProtocolo=1098706&descTipo=IPE&CodigoInstituicao=1
3;PDGR3;24/03/2023;22:43;Informações sobre Aumento de Capital Privado nos termos do Plano de Recuperação Judicial;https://www.rad.cvm.gov.br/ENET/frmDownloadDocumento.aspx?Tela=ext&numProtocolo=1077212&descTipo=IPE&CodigoInstituicao=1
4;PDGR3;01/02/2023;19:57;Grupamento de Ações;https://www.rad.cvm.gov.br/ENET/frmDownloadDocumento.aspx?Tela=ext&numProtocolo=1054302&descTipo=IPE&CodigoInstituicao=1
5;PDGR3;22/12/2022;19:38;Cancelamento de AGE e Nova Proposta de Grupamento de Ações;https://www.rad.cvm.gov.br/ENET/frmDownloadDocumento.aspx?Tela=ext&numProtocolo=1044016&descTipo=IPE&CodigoInstituicao=1
6;PDGR3;22/11/2022;20:58;Grupamento de Ações;https://www.rad.cvm.gov.br/ENET/frmDownloadDocumento.aspx?Tela=ext&numProtocolo=1035090&descTipo=IPE&CodigoInstituicao=1
7;PDGR3;29/08/2022;21:17;Grupamento de Ações;https://www.rad.cvm.gov.br/ENET/frmDownloadDocumento.aspx?Tela=ext&numProtocolo=1011672&descTipo=IPE&CodigoInstituicao=1
8;PDGR3;11/08/2022;18:14;Aumento de Capital Privado ;https://www.rad.cvm.gov.br/ENET/frmDownloadDocumento.aspx?Tela=ext&numProtocolo=1006838&descTipo=IPE&CodigoInstituicao=1
9;PDGR3;01/08/2022;22:28;Mudança de marca de Subsidiária;https://www.rad.cvm.gov.br/ENET/frmDownloadDocumento.aspx?Tela=ext&numProtocolo=1002461&descTipo=IPE&CodigoInstituicao=1
10;PDGR3;13/07/2022;18:18;Alteração do canal de divulgação de Atos e Fatos Relevantes da Companhia;https://www.rad.cvm.gov.br/ENET/frmDownloadDocumento.aspx?Tela=ext&numProtocolo=997891&descTipo=IPE&CodigoInstituicao=1
11;PDGR3;30/06/2022;18:27;Aumento de Capital Privado;https://www.rad.cvm.gov.br/ENET/frmDownloadDocumento.aspx?Tela=ext&numProtocolo=994394&descTipo=IPE&CodigoInstituicao=1
12;PDGR3;11/04/2022;20:14;Informações sobre Aumento de Capital Privado nos termos do Plano de Recuperação Judicial;https://www.rad.cvm.gov.br/ENET/frmDownloadDocumento.aspx?Tela=ext&numProtocolo=966477&descTipo=IPE&CodigoInstituicao=1
13;PDGR3;11/04/2022;20:03;Esclarecimento sobre decretação de falência de SPE;https://www.rad.cvm.gov.br/ENET/frmDownloadDocumento.aspx?Tela=ext&numProtocolo=966469&descTipo=IPE&CodigoInstituicao=1
14;PDGR3;05/04/2022;21:14;Esclarecimento sobre decretação de falência de SPE;https://www.rad.cvm.gov.br/ENET/frmDownloadDocumento.aspx?Tela=ext&numProtocolo=964229&descTipo=IPE&CodigoInstituicao=1
15;PDGR3;14/01/2022;18:31;PDG passa a integrar os índices IGNM, ITAG e IGCX da B3;https://www.rad.cvm.gov.br/ENET/frmDownloadDocumento.aspx?Tela=ext&numProtocolo=933720&descTipo=IPE&CodigoInstituicao=1
16;PDGR3;03/12/2021;19:28;Lançamento do novo site de Relações com Investidores da PDG;https://www.rad.cvm.gov.br/ENET/frmDownloadDocumento.aspx?Tela=ext&numProtocolo=922344&descTipo=IPE&CodigoInstituicao=1
17;PDGR3;14/10/2021;18:43;Encerramento da Recuperação Judicial;https://www.rad.cvm.gov.br/ENET/frmDownloadDocumento.aspx?Tela=ext&numProtocolo=907585&descTipo=IPE&CodigoInstituicao=1
18;PDGR3;14/09/2021;19:19;Esclarecimentos sobre consultas da B3 - Negociações atípicas de valores mobiliários;https://www.rad.cvm.gov.br/ENET/frmDownloadDocumento.aspx?Tela=ext&numProtocolo=901019&descTipo=IPE&CodigoInstituicao=1
19;PDGR3;24/06/2021;22:10;Transferência de Ações do FIDC VKR para o FIM VKR;https://www.rad.cvm.gov.br/ENET/frmDownloadDocumento.aspx?Tela=ext&numProtocolo=878777&descTipo=IPE&CodigoInstituicao=1
20;PDGR3;24/06/2021;22:10;Não assunção de Conselheiro Fiscal Suplente ;https://www.rad.cvm.gov.br/ENET/frmDownloadDocumento.aspx?Tela=ext&numProtocolo=878778&descTipo=IPE&CodigoInstituicao=1
21;PDGR3;24/06/2021;21:37;Renuncia suplente conselho fiscal;https://www.rad.cvm.gov.br/ENET/frmDownloadDocumento.aspx?Tela=ext&numProtocolo=878774&descTipo=IPE&CodigoInstituicao=1
22;PDGR3;21/06/2021;22:07;Nova unidade de negócios - Vernyy;https://www.rad.cvm.gov.br/ENET/frmDownloadDocumento.aspx?Tela=ext&numProtocolo=877718&descTipo=IPE&CodigoInstituicao=1
23;PDGR3;28/04/2021;22:49;"- Participação Relevante; ";https://www.rad.cvm.gov.br/ENET/frmDownloadDocumento.aspx?Tela=ext&numProtocolo=858908&descTipo=IPE&CodigoInstituicao=1
24;PDGR3;19/03/2021;19:49;AUMENTO DE CAPITAL PRIVADO;https://www.rad.cvm.gov.br/ENET/frmDownloadDocumento.aspx?Tela=ext&numProtocolo=844445&descTipo=IPE&CodigoInstituicao=1
25;PDGR3;05/02/2021;23:13;Aumento de Capital Privado (português e inglês);https://www.rad.cvm.gov.br/ENET/frmDownloadDocumento.aspx?Tela=ext&numProtocolo=828272&descTipo=IPE&CodigoInstituicao=1
26;PDGR3;15/01/2021;18:54;Concluída Etapa do Aditamento ao Plano de Recuperação Judicial;https://www.rad.cvm.gov.br/ENET/frmDownloadDocumento.aspx?Tela=ext&numProtocolo=823168&descTipo=IPE&CodigoInstituicao=1
27;PDGR3;18/12/2020;18:59;Informações sobre Aumento de Capital Privado;https://www.rad.cvm.gov.br/ENET/frmDownloadDocumento.aspx?Tela=ext&numProtocolo=818090&descTipo=IPE&CodigoInstituicao=1
28;PDGR3;15/12/2020;07:29;Homologação do Aditamento ao Plano de Recuperação Judicial;https://www.rad.cvm.gov.br/ENET/frmDownloadDocumento.aspx?Tela=ext&numProtocolo=816645&descTipo=IPE&CodigoInstituicao=1
29;PDGR3;30/11/2020;19:06;Aprovação do Aditamento ao Plano de Recuperação Judicial (português e inglês);https://www.rad.cvm.gov.br/ENET/frmDownloadDocumento.aspx?Tela=ext&numProtocolo=812050&descTipo=IPE&CodigoInstituicao=1
30;PDGR3;23/11/2020;18:45;Não instalação de Assembleia Geral de Credores;https://www.rad.cvm.gov.br/ENET/frmDownloadDocumento.aspx?Tela=ext&numProtocolo=810526&descTipo=IPE&CodigoInstituicao=1
31;PDGR3;30/10/2020;19:24;CONVOCAÇÃO DE ASSEMBLEIRA GERAL DE CREDORES;https://www.rad.cvm.gov.br/ENET/frmDownloadDocumento.aspx?Tela=ext&numProtocolo=804289&descTipo=IPE&CodigoInstituicao=1
32;PDGR3;16/10/2020;20:02;Informações sobre Aumento de Capital Privado;https://www.rad.cvm.gov.br/ENET/frmDownloadDocumento.aspx?Tela=ext&numProtocolo=800682&descTipo=IPE&CodigoInstituicao=1
33;PDGR3;15/10/2020;19:08;Eleição do Conselho de Administração;https://www.rad.cvm.gov.br/ENET/frmDownloadDocumento.aspx?Tela=ext&numProtocolo=800244&descTipo=IPE&CodigoInstituicao=1
34;PDGR3;11/09/2020;22:23;ADITAMENTO AO PLANO DE RECUPERAÇÃO JUDICIAL;https://www.rad.cvm.gov.br/ENET/frmDownloadDocumento.aspx?Tela=ext&numProtocolo=792992&descTipo=IPE&CodigoInstituicao=1
35;PDGR3;04/09/2020;20:55;Ajuste ao Boletim de Voto a Distância;https://www.rad.cvm.gov.br/ENET/frmDownloadDocumento.aspx?Tela=ext&numProtocolo=791409&descTipo=IPE&CodigoInstituicao=1
36;PDGR3;31/08/2020;21:10;Alterações no Conselho de Administração;https://www.rad.cvm.gov.br/ENET/frmDownloadDocumento.aspx?Tela=ext&numProtocolo=789744&descTipo=IPE&CodigoInstituicao=1
37;PDGR3;21/08/2020;19:51;ASSEMBLEIA GERAL EXTRAORDINÁRIA;https://www.rad.cvm.gov.br/ENET/frmDownloadDocumento.aspx?Tela=ext&numProtocolo=786617&descTipo=IPE&CodigoInstituicao=1
38;PDGR3;18/08/2020;18:34;ALTERAÇÕES NA ADMINISTRAÇÃO;https://www.rad.cvm.gov.br/ENET/frmDownloadDocumento.aspx?Tela=ext&numProtocolo=785803&descTipo=IPE&CodigoInstituicao=1
39;PDGR3;08/04/2020;18:29;Cancelamento AGOE;https://www.rad.cvm.gov.br/ENET/frmDownloadDocumento.aspx?Tela=ext&numProtocolo=752934&descTipo=IPE&CodigoInstituicao=1
40;PDGR3;16/01/2020;23:23;ALTERAÇÕES NA ADMINISTRAÇÃO DA COMPANHIA;https://www.rad.cvm.gov.br/ENET/frmDownloadDocumento.aspx?Tela=ext&numProtocolo=730887&descTipo=IPE&CodigoInstituicao=1
41;PDGR3;16/01/2020;19:41;"Alteração de Membros do Conselho de Administração; Alteração de Membros do Conselho de Diretoria";https://www.rad.cvm.gov.br/ENET/frmDownloadDocumento.aspx?Tela=ext&numProtocolo=730878&descTipo=IPE&CodigoInstituicao=1
42;PDGR3;10/06/2019;20:02;Atualização sobre o Recuperação de Recuperação Judicial;https://www.rad.cvm.gov.br/ENET/frmDownloadDocumento.aspx?Tela=ext&numProtocolo=695443&descTipo=IPE&CodigoInstituicao=1
43;PDGR3;09/01/2019;19:34;Grupamento de ações: Período para recomposição de frações;https://www.rad.cvm.gov.br/ENET/frmDownloadDocumento.aspx?Tela=ext&numProtocolo=659872&descTipo=IPE&CodigoInstituicao=1
44;PDGR3;12/12/2018;19:47;Grupamento de Ações;https://www.rad.cvm.gov.br/ENET/frmDownloadDocumento.aspx?Tela=ext&numProtocolo=656681&descTipo=IPE&CodigoInstituicao=1
45;PDGR3;30/11/2018;18:43;Grupamento de Ações;https://www.rad.cvm.gov.br/ENET/frmDownloadDocumento.aspx?Tela=ext&numProtocolo=653922&descTipo=IPE&CodigoInstituicao=1
46;PDGR3;22/11/2018;20:41;Concluída Etapa Fundamental do Plano de Recuperação Judicial;https://www.rad.cvm.gov.br/ENET/frmDownloadDocumento.aspx?Tela=ext&numProtocolo=652849&descTipo=IPE&CodigoInstituicao=1
47;PDGR3;05/11/2018;23:20;"- Grupamento de Ações.; - Sobre a Segunda Convocação para Assembleia Geral Extraordinária;";https://www.rad.cvm.gov.br/ENET/frmDownloadDocumento.aspx?Tela=ext&numProtocolo=648991&descTipo=IPE&CodigoInstituicao=1
48;PDGR3;26/09/2018;22:44;"Grupamento de Ações; Reverse Stock Split";https://www.rad.cvm.gov.br/ENET/frmDownloadDocumento.aspx?Tela=ext&numProtocolo=643031&descTipo=IPE&CodigoInstituicao=1
49;PDGR3;29/08/2018;21:32;Reverse Stock Split;https://www.rad.cvm.gov.br/ENET/frmDownloadDocumento.aspx?Tela=ext&numProtocolo=639533&descTipo=IPE&CodigoInstituicao=1
50;PDGR3;29/08/2018;18:33;Grupamento de Ações;https://www.rad.cvm.gov.br/ENET/frmDownloadDocumento.aspx?Tela=ext&numProtocolo=639518&descTipo=IPE&CodigoInstituicao=1
51;PDGR3;19/06/2018;22:48;Mudança de Auditor (art. 28, Instr. CVM no308/99);https://www.rad.cvm.gov.br/ENET/frmDownloadDocumento.aspx?Tela=ext&numProtocolo=629702&descTipo=IPE&CodigoInstituicao=1
52;PDGR3;05/04/2018;18:24;NOTICE TO THE MARKET - PDGR11 Warrants;https://www.rad.cvm.gov.br/ENET/frmDownloadDocumento.aspx?Tela=ext&numProtocolo=606999&descTipo=IPE&CodigoInstituicao=1
53;PDGR3;05/04/2018;18:23;COMUNICADO AO MERCADO  BÔNUS DE SUBSCRIÇÃO PDGR11;https://www.rad.cvm.gov.br/ENET/frmDownloadDocumento.aspx?Tela=ext&numProtocolo=606996&descTipo=IPE&CodigoInstituicao=1
54;PDGR3;28/03/2018;15:55;Alteração da data da reunião do Conselho de Administração da Companhia para aprovação das contas do exercício de 2017;https://www.rad.cvm.gov.br/ENET/frmDownloadDocumento.aspx?Tela=ext&numProtocolo=604586&descTipo=IPE&CodigoInstituicao=1
55;PDGR3;28/03/2018;15:54;Alteração da data da reunião do Conselho de Administração da Companhia para aprovação das contas do exercício de 2017;https://www.rad.cvm.gov.br/ENET/frmDownloadDocumento.aspx?Tela=ext&numProtocolo=604584&descTipo=IPE&CodigoInstituicao=1
56;PDGR3;26/03/2018;12:38;Alteração nas datas de divulgação dos Resultados do 4T2017;https://www.rad.cvm.gov.br/ENET/frmDownloadDocumento.aspx?Tela=ext&numProtocolo=603238&descTipo=IPE&CodigoInstituicao=1
57;PDGR3;26/03/2018;12:37;Alteração no Calendário de Divulgação dos Resultados do 4T17;https://www.rad.cvm.gov.br/ENET/frmDownloadDocumento.aspx?Tela=ext&numProtocolo=603236&descTipo=IPE&CodigoInstituicao=1
58;PDGR3;15/03/2018;21:31;Capital Increase;https://www.rad.cvm.gov.br/ENET/frmDownloadDocumento.aspx?Tela=ext&numProtocolo=601435&descTipo=IPE&CodigoInstituicao=1
59;PDGR3;15/03/2018;21:26;Aumento de Capital;https://www.rad.cvm.gov.br/ENET/frmDownloadDocumento.aspx?Tela=ext&numProtocolo=601431&descTipo=IPE&CodigoInstituicao=1
60;PDGR3;15/03/2018;19:04;Aviso aos acionistas - Aumento de Capital;https://www.rad.cvm.gov.br/ENET/frmDownloadDocumento.aspx?Tela=ext&numProtocolo=601380&descTipo=IPE&CodigoInstituicao=1
61;PDGR3;06/03/2018;18:23;Termo de Não Instalação - AGE 06/03/2018;https://www.rad.cvm.gov.br/ENET/frmDownloadDocumento.aspx?Tela=ext&numProtocolo=599190&descTipo=IPE&CodigoInstituicao=1
62;PDGR3;06/02/2018;18:57;"Call an Extraordinary Shareholders Meeting to deliberate about the above subjects; Increase the authorized capital limit to 50,000,000 common shares; Modify the Company´s Bylaw; Modify the minimum and maximum numbers of members of the Board of Directors to, respectively, 3 (three) members and 5 (five) members; Modify the minimum number of independent directors to at least 2 (two)  or 20% (twenty per cent), whichever is the greater  members of the Board of Directors; Modify the term of the members of the Board of Directors from 1 (one) to 2 (two) years; The Company´s Capital Increase by the means of preemptive rights";https://www.rad.cvm.gov.br/ENET/frmDownloadDocumento.aspx?Tela=ext&numProtocolo=595465&descTipo=IPE&CodigoInstituicao=1
63;PDGR3;02/02/2018;19:28;"Alteração do Estatuto Social da Companhia; Alteração do número mínimo de membros independentes do Conselho de Administração;; Alteração do número mínimo e máximo de membros do Conselho de Administração;; Alteração do prazo do mandato dos membros do Conselho de Administração;; Aumento do capital social da Companhia, mediante subscrição privada de novas ações;; Aumento do limite do capital autorizado da Companhia;; Convocação de Assembleia Geral Extraordinária";https://www.rad.cvm.gov.br/ENET/frmDownloadDocumento.aspx?Tela=ext&numProtocolo=595134&descTipo=IPE&CodigoInstituicao=1
64;PDGR3;06/12/2017;21:35;Homologação do Plano de Recuperação Judicial;https://www.rad.cvm.gov.br/ENET/frmDownloadDocumento.aspx?Tela=ext&numProtocolo=588754&descTipo=IPE&CodigoInstituicao=1
65;PDGR3;30/11/2017;20:49;Aprovação do Plano de Recuperação Judicial em Assembleia Geral de Credores;https://www.rad.cvm.gov.br/ENET/frmDownloadDocumento.aspx?Tela=ext&numProtocolo=588040&descTipo=IPE&CodigoInstituicao=1
66;PDGR3;22/11/2017;18:39;Não instalação de Assembleia Geral de Credores;https://www.rad.cvm.gov.br/ENET/frmDownloadDocumento.aspx?Tela=ext&numProtocolo=587290&descTipo=IPE&CodigoInstituicao=1
67;PDGR3;17/11/2017;22:18;Atualização sobre o Processo de Recuperação Judicial;https://www.rad.cvm.gov.br/ENET/frmDownloadDocumento.aspx?Tela=ext&numProtocolo=587047&descTipo=IPE&CodigoInstituicao=1
68;PDGR3;25/10/2017;07:10;Convocação Assembleia Geral de Credores;https://www.rad.cvm.gov.br/ENET/frmDownloadDocumento.aspx?Tela=ext&numProtocolo=583503&descTipo=IPE&CodigoInstituicao=1
69;PDGR3;29/09/2017;21:34;Reapresentação de Plano de Recuperação Judicial;https://www.rad.cvm.gov.br/ENET/frmDownloadDocumento.aspx?Tela=ext&numProtocolo=580840&descTipo=IPE&CodigoInstituicao=1
70;PDGR3;15/09/2017;09:59;Eleição de Presidente do Conselho e membro do conselho;https://www.rad.cvm.gov.br/ENET/frmDownloadDocumento.aspx?Tela=ext&numProtocolo=579557&descTipo=IPE&CodigoInstituicao=1
71;PDGR3;11/08/2017;19:03;Renuncia Membro do Conselho de Administração;https://www.rad.cvm.gov.br/ENET/frmDownloadDocumento.aspx?Tela=ext&numProtocolo=575709&descTipo=IPE&CodigoInstituicao=1
72;PDGR3;04/08/2017;22:49;Esclarecimento sobre petição protocolada no processo de recuperação judicial;https://www.rad.cvm.gov.br/ENET/frmDownloadDocumento.aspx?Tela=ext&numProtocolo=573937&descTipo=IPE&CodigoInstituicao=1
73;PDGR3;06/06/2017;23:05;Protocolo Plano de Recuperação Judicial;https://www.rad.cvm.gov.br/ENET/frmDownloadDocumento.aspx?Tela=ext&numProtocolo=566997&descTipo=IPE&CodigoInstituicao=1
74;PDGR3;27/03/2017;22:09;Ratificação do Pedido de Recuperação Judicial;https://www.rad.cvm.gov.br/ENET/frmDownloadDocumento.aspx?Tela=ext&numProtocolo=554166&descTipo=IPE&CodigoInstituicao=1
75;PDGR3;07/03/2017;18:53;Alteração de Auditor, conforme previsto no art. 31 da Instrução CVM nº 308/1999;https://www.rad.cvm.gov.br/ENET/frmDownloadDocumento.aspx?Tela=ext&numProtocolo=550513&descTipo=IPE&CodigoInstituicao=1
76;PDGR3;02/03/2017;20:28;- Deferimento do Pedido de Recuperação Judicial;https://www.rad.cvm.gov.br/ENET/frmDownloadDocumento.aspx?Tela=ext&numProtocolo=549988&descTipo=IPE&CodigoInstituicao=1
77;PDGR3;22/02/2017;10:22;Informações sobre o Ajuizamento do Pedido de Recuperação Judicial;https://www.rad.cvm.gov.br/ENET/frmDownloadDocumento.aspx?Tela=ext&numProtocolo=549195&descTipo=IPE&CodigoInstituicao=1
78;PDGR3;14/02/2017;21:32;Esclarecimento acerca de matéria veiculada;https://www.rad.cvm.gov.br/ENET/frmDownloadDocumento.aspx?Tela=ext&numProtocolo=548380&descTipo=IPE&CodigoInstituicao=1
79;PDGR3;13/02/2017;20:27;Esclarecimento acerca de matéria veiculada;https://www.rad.cvm.gov.br/ENET/frmDownloadDocumento.aspx?Tela=ext&numProtocolo=548193&descTipo=IPE&CodigoInstituicao=1
80;PDGR3;20/12/2016;22:03;Vencimento Antecipado de Debêntures;https://www.rad.cvm.gov.br/ENET/frmDownloadDocumento.aspx?Tela=ext&numProtocolo=542558&descTipo=IPE&CodigoInstituicao=1
81;PDGR3;19/12/2016;09:08;Esclarecimento sobre notícias recentemente veiculadas na mídia.;https://www.rad.cvm.gov.br/ENET/frmDownloadDocumento.aspx?Tela=ext&numProtocolo=542329&descTipo=IPE&CodigoInstituicao=1
82;PDGR3;29/11/2016;22:24;Fechamento da operação de descruzamento societário entre sociedades controladas pela Companhia e a HM1 Empreendimentos e Participações S.A.;https://www.rad.cvm.gov.br/ENET/frmDownloadDocumento.aspx?Tela=ext&numProtocolo=539655&descTipo=IPE&CodigoInstituicao=1
83;PDGR3;22/11/2016;22:28;"Aprovação de Convocação de AGE a ser realizada no dia 23/12/2016 para deliberar sobre a eleição de novos membros efetivos e suplentes para recompor o número mínimo legal de membros.; Renuncia de membros do Conselho Fiscal";https://www.rad.cvm.gov.br/ENET/frmDownloadDocumento.aspx?Tela=ext&numProtocolo=539055&descTipo=IPE&CodigoInstituicao=1
84;PDGR3;09/11/2016;19:21;Alteração da data da divulgação das informações trimestrais da Companhia relativas ao 3º trimestre de 2016;https://www.rad.cvm.gov.br/ENET/frmDownloadDocumento.aspx?Tela=ext&numProtocolo=537206&descTipo=IPE&CodigoInstituicao=1
85;PDGR3;08/11/2016;20:42;Substituição de membros do Conselho de Administração;https://www.rad.cvm.gov.br/ENET/frmDownloadDocumento.aspx?Tela=ext&numProtocolo=536861&descTipo=IPE&CodigoInstituicao=1
86;PDGR3;03/11/2016;19:10;"Aprovação do contrato a ser firmado com a RK Partners Assessoria Financeira e Gestão de Recursos Ltda.; Substituição de membros da Diretoria; Substituição de membros do Conselho de Administração";https://www.rad.cvm.gov.br/ENET/frmDownloadDocumento.aspx?Tela=ext&numProtocolo=536137&descTipo=IPE&CodigoInstituicao=1
87;PDGR3;01/11/2016;22:13;Comunicar sobre acordo entre a Companhia e a HM1 Empreendimentos e Participações S.A. para permuta de participações societárias em determinados empreendimentos imobiliários.;https://www.rad.cvm.gov.br/ENET/frmDownloadDocumento.aspx?Tela=ext&numProtocolo=536003&descTipo=IPE&CodigoInstituicao=1
88;PDGR3;10/08/2016;22:12;Reestruturação de Dívidas;https://www.rad.cvm.gov.br/ENET/frmDownloadDocumento.aspx?Tela=ext&numProtocolo=527480&descTipo=IPE&CodigoInstituicao=1
89;PDGR3;04/08/2016;08:45;Esclarecimento sobre notícia divulgada na imprensa;https://www.rad.cvm.gov.br/ENET/frmDownloadDocumento.aspx?Tela=ext&numProtocolo=526014&descTipo=IPE&CodigoInstituicao=1
90;PDGR3;14/07/2016;19:03;Reestruturação das notas promissórias comerciais e encerramento de negociações relativas a alienação de ativos BV;https://www.rad.cvm.gov.br/ENET/frmDownloadDocumento.aspx?Tela=ext&numProtocolo=524124&descTipo=IPE&CodigoInstituicao=1
91;PDGR3;04/07/2016;08:34;Comunicado de 10ª Emissão de Debêntures simples, não conversíveis em ações;https://www.rad.cvm.gov.br/ENET/frmDownloadDocumento.aspx?Tela=ext&numProtocolo=522389&descTipo=IPE&CodigoInstituicao=1
92;PDGR3;01/07/2016;23:36;Comunicado de 10ª Emissão de Debêntures simples, não conversíveis em ações;https://www.rad.cvm.gov.br/ENET/frmDownloadDocumento.aspx?Tela=ext&numProtocolo=522382&descTipo=IPE&CodigoInstituicao=1
93;PDGR3;08/06/2016;21:28;Comunicado de 9ª Emissão de Debêntures simples, não conversíveis em ações;https://www.rad.cvm.gov.br/ENET/frmDownloadDocumento.aspx?Tela=ext&numProtocolo=519928&descTipo=IPE&CodigoInstituicao=1
94;PDGR3;01/06/2016;01:47;Alteração de Endereço da Sede Social da Companhia;https://www.rad.cvm.gov.br/ENET/frmDownloadDocumento.aspx?Tela=ext&numProtocolo=518883&descTipo=IPE&CodigoInstituicao=1
95;PDGR3;16/05/2016;18:57;Celebração de Contratos de Compra e Venda de Quotas e Outras Avenças de duas sociedades de propósito específico;https://www.rad.cvm.gov.br/ENET/frmDownloadDocumento.aspx?Tela=ext&numProtocolo=517677&descTipo=IPE&CodigoInstituicao=1
96;PDGR3;04/05/2016;21:11;Alienação da participação societária no capital social da REP Real Estate Partners - Desenvolvimento Imobiliário S.A.;https://www.rad.cvm.gov.br/ENET/frmDownloadDocumento.aspx?Tela=ext&numProtocolo=515240&descTipo=IPE&CodigoInstituicao=1
97;PDGR3;04/05/2016;21:03;Memorando de Entendimento com Bancos;https://www.rad.cvm.gov.br/ENET/frmDownloadDocumento.aspx?Tela=ext&numProtocolo=515239&descTipo=IPE&CodigoInstituicao=1
98;PDGR3;15/01/2016;18:32;Alteração do Diretor de Relações com Investidores;https://www.rad.cvm.gov.br/ENET/frmDownloadDocumento.aspx?Tela=ext&numProtocolo=498406&descTipo=IPE&CodigoInstituicao=1
99;PDGR3;07/01/2016;18:42;Memorando de Entendimentos não vinculante em relação a possibilidade de alienação de ativos;https://www.rad.cvm.gov.br/ENET/frmDownloadDocumento.aspx?Tela=ext&numProtocolo=497293&descTipo=IPE&CodigoInstituicao=1
