;Acao;Data;Hora;Descrição;Link
0;PETR4;06/02/2025;09:07;Petrobras e Régia Capital criam Fundo de Bioeconomia;https://www.rad.cvm.gov.br/ENET/frmDownloadDocumento.aspx?Tela=ext&numProtocolo=1330999&descTipo=IPE&CodigoInstituicao=1
1;PETR4;03/02/2025;19:21;Petrobras recebe parcela de pagamentos contingentes (earnout);https://www.rad.cvm.gov.br/ENET/frmDownloadDocumento.aspx?Tela=ext&numProtocolo=1329816&descTipo=IPE&CodigoInstituicao=1
2;PETR4;03/02/2025;18:25;Relatório de Produção e Vendas 4T24;https://www.rad.cvm.gov.br/ENET/frmDownloadDocumento.aspx?Tela=ext&numProtocolo=1329780&descTipo=IPE&CodigoInstituicao=1
3;PETR4;31/01/2025;18:11;Petrobras recebe parcela de pagamento contingente referente à venda de sua participação no campo de Albacora Leste;https://www.rad.cvm.gov.br/ENET/frmDownloadDocumento.aspx?Tela=ext&numProtocolo=1329347&descTipo=IPE&CodigoInstituicao=1
4;PETR4;29/01/2025;19:19;Petrobras informa sobre cancelamento de ações em tesouraria;https://www.rad.cvm.gov.br/ENET/frmDownloadDocumento.aspx?Tela=ext&numProtocolo=1328611&descTipo=IPE&CodigoInstituicao=1
5;PETR4;29/01/2025;18:31;Petrobras informa sobre Reservas Provadas em 2024;https://www.rad.cvm.gov.br/ENET/frmDownloadDocumento.aspx?Tela=ext&numProtocolo=1328570&descTipo=IPE&CodigoInstituicao=1
6;PETR4;29/01/2025;08:15;Petrobras  informa  sobre  resultado  do  4º  trimestre  de  2024  ;https://www.rad.cvm.gov.br/ENET/frmDownloadDocumento.aspx?Tela=ext&numProtocolo=1328357&descTipo=IPE&CodigoInstituicao=1
7;PETR4;27/01/2025;19:46;Petrobras atinge meta de produção anual de 2024;https://www.rad.cvm.gov.br/ENET/frmDownloadDocumento.aspx?Tela=ext&numProtocolo=1327783&descTipo=IPE&CodigoInstituicao=1
8;PETR4;24/01/2025;18:37;Petrobras informa sobre decisão da ANP em relação aos campos de Berbigão e Sururu;https://www.rad.cvm.gov.br/ENET/frmDownloadDocumento.aspx?Tela=ext&numProtocolo=1327460&descTipo=IPE&CodigoInstituicao=1
9;PETR4;23/01/2025;18:47;Petrobras inicia Fase Vinculante do Campo de Tartaruga na Bacia Sergipe-Alagoas;https://www.rad.cvm.gov.br/ENET/frmDownloadDocumento.aspx?Tela=ext&numProtocolo=1327019&descTipo=IPE&CodigoInstituicao=1
10;PETR4;22/01/2025;09:03;Produção do FPSO Cidade de Angra dos Reis;https://www.rad.cvm.gov.br/ENET/frmDownloadDocumento.aspx?Tela=ext&numProtocolo=1326566&descTipo=IPE&CodigoInstituicao=1
11;PETR4;17/01/2025;10:04;Produção Refinarias 2024;https://www.rad.cvm.gov.br/ENET/frmDownloadDocumento.aspx?Tela=ext&numProtocolo=1325823&descTipo=IPE&CodigoInstituicao=1
12;PETR4;13/01/2025;08:54;Petrobras esclarece sobre contratos com a Unigel;https://www.rad.cvm.gov.br/ENET/frmDownloadDocumento.aspx?Tela=ext&numProtocolo=1324346&descTipo=IPE&CodigoInstituicao=1
13;PETR4;09/01/2025;22:57;Petrobras informa sobre decisão favorável em arbitragem ;https://www.rad.cvm.gov.br/ENET/frmDownloadDocumento.aspx?Tela=ext&numProtocolo=1323576&descTipo=IPE&CodigoInstituicao=1
14;PETR4;27/12/2024;12:17;Petrobras informa sobre nova Lei para o setor de óleo e gás;https://www.rad.cvm.gov.br/ENET/frmDownloadDocumento.aspx?Tela=ext&numProtocolo=1319891&descTipo=IPE&CodigoInstituicao=1
15;PETR4;23/12/2024;19:38;Petrobras informa sobre precificação do resgate de títulos globais em dólares;https://www.rad.cvm.gov.br/ENET/frmDownloadDocumento.aspx?Tela=ext&numProtocolo=1318914&descTipo=IPE&CodigoInstituicao=1
16;PETR4;23/12/2024;08:11;Pagamento de Dividendos Extraordinários;https://www.rad.cvm.gov.br/ENET/frmDownloadDocumento.aspx?Tela=ext&numProtocolo=1318437&descTipo=IPE&CodigoInstituicao=1
17;PETR4;23/12/2024;08:11;Rescisão de contrato de desinvestimento dos campos de Uruguá e Tambaú;https://www.rad.cvm.gov.br/ENET/frmDownloadDocumento.aspx?Tela=ext&numProtocolo=1318438&descTipo=IPE&CodigoInstituicao=1
18;PETR4;20/12/2024;08:41;Pagamento de Remuneração aos Acionistas;https://www.rad.cvm.gov.br/ENET/frmDownloadDocumento.aspx?Tela=ext&numProtocolo=1317849&descTipo=IPE&CodigoInstituicao=1
19;PETR4;19/12/2024;18:23;Petrobras inicia operação da Unidade de SNOX na RNEST;https://www.rad.cvm.gov.br/ENET/frmDownloadDocumento.aspx?Tela=ext&numProtocolo=1317630&descTipo=IPE&CodigoInstituicao=1
20;PETR4;19/12/2024;18:12;Petrobras assina Protocolo de Intenções com a CSN;https://www.rad.cvm.gov.br/ENET/frmDownloadDocumento.aspx?Tela=ext&numProtocolo=1317612&descTipo=IPE&CodigoInstituicao=1
21;PETR4;18/12/2024;09:23;Petrobras informa sobre precificação do resgate de títulos globais em libras esterlinas;https://www.rad.cvm.gov.br/ENET/frmDownloadDocumento.aspx?Tela=ext&numProtocolo=1316947&descTipo=IPE&CodigoInstituicao=1
22;PETR4;16/12/2024;22:44;Presidente do Conselho de Administração;https://www.rad.cvm.gov.br/ENET/frmDownloadDocumento.aspx?Tela=ext&numProtocolo=1316278&descTipo=IPE&CodigoInstituicao=1
23;PETR4;16/12/2024;15:46;Petrobras volta a integrar o Índice Dow Jones de Sustentabilidade;https://www.rad.cvm.gov.br/ENET/frmDownloadDocumento.aspx?Tela=ext&numProtocolo=1315960&descTipo=IPE&CodigoInstituicao=1
24;PETR4;10/12/2024;19:19;Petrobras informa sobre a forma de distribuição da remuneração aos acionistas relativa ao 3T24;https://www.rad.cvm.gov.br/ENET/frmDownloadDocumento.aspx?Tela=ext&numProtocolo=1313959&descTipo=IPE&CodigoInstituicao=1
25;PETR4;05/12/2024;09:54;Petrobras e Ecopetrol confirmam a maior descoberta de gás da Colômbia;https://www.rad.cvm.gov.br/ENET/frmDownloadDocumento.aspx?Tela=ext&numProtocolo=1311627&descTipo=IPE&CodigoInstituicao=1
26;PETR4;04/12/2024;20:53;Petrobras informa sobre Presidente do Conselho de Administração;https://www.rad.cvm.gov.br/ENET/frmDownloadDocumento.aspx?Tela=ext&numProtocolo=1311449&descTipo=IPE&CodigoInstituicao=1
27;PETR4;29/11/2024;23:33;Petrobras inicia contratação de plataformas do projeto Sergipe Águas Profundas;https://www.rad.cvm.gov.br/ENET/frmDownloadDocumento.aspx?Tela=ext&numProtocolo=1309795&descTipo=IPE&CodigoInstituicao=1
28;PETR4;27/11/2024;19:12;Petrobras divulga teaser para cessão de participação minoritária do Campo de Tartaruga na Bacia Sergipe-Alagoas;https://www.rad.cvm.gov.br/ENET/frmDownloadDocumento.aspx?Tela=ext&numProtocolo=1308653&descTipo=IPE&CodigoInstituicao=1
29;PETR4;27/11/2024;18:12;Petrobras assina Acordo de Princípios com a European Energy;https://www.rad.cvm.gov.br/ENET/frmDownloadDocumento.aspx?Tela=ext&numProtocolo=1308624&descTipo=IPE&CodigoInstituicao=1
30;PETR4;23/11/2024;19:58;Petrobras informa sobre parcerias em etanol;https://www.rad.cvm.gov.br/ENET/frmDownloadDocumento.aspx?Tela=ext&numProtocolo=1307518&descTipo=IPE&CodigoInstituicao=1
31;PETR4;22/11/2024;19:21;Petrobras aprova Plano Estratégico 2050 e Plano de Negócios 2025-2029;https://www.rad.cvm.gov.br/ENET/frmDownloadDocumento.aspx?Tela=ext&numProtocolo=1307328&descTipo=IPE&CodigoInstituicao=1
32;PETR4;21/11/2024;21:02;Petrobras aprova Plano Estratégico 2050 e Plano de Negócios 2025-2029;https://www.rad.cvm.gov.br/ENET/frmDownloadDocumento.aspx?Tela=ext&numProtocolo=1306767&descTipo=IPE&CodigoInstituicao=1
33;PETR4;21/11/2024;20:18;Petrobras aprova Plano Estratégico 2050 e Plano de Negócios 2025-2029;https://www.rad.cvm.gov.br/ENET/frmDownloadDocumento.aspx?Tela=ext&numProtocolo=1306727&descTipo=IPE&CodigoInstituicao=1
34;PETR4;21/11/2024;20:07;Petrobras sobre remuneração extraordinária aos acionistas;https://www.rad.cvm.gov.br/ENET/frmDownloadDocumento.aspx?Tela=ext&numProtocolo=1306715&descTipo=IPE&CodigoInstituicao=1
35;PETR4;21/11/2024;08:34;Petrobras informa sobre pagamento de remuneração aos acionistas;https://www.rad.cvm.gov.br/ENET/frmDownloadDocumento.aspx?Tela=ext&numProtocolo=1306283&descTipo=IPE&CodigoInstituicao=1
36;PETR4;18/11/2024;22:05;Petrobras esclarece notícia sobre Plano de Negócios 2025-2029;https://www.rad.cvm.gov.br/ENET/frmDownloadDocumento.aspx?Tela=ext&numProtocolo=1305739&descTipo=IPE&CodigoInstituicao=1
37;PETR4;18/11/2024;18:36;Petrobras informa sobre resgate de títulos globais;https://www.rad.cvm.gov.br/ENET/frmDownloadDocumento.aspx?Tela=ext&numProtocolo=1305570&descTipo=IPE&CodigoInstituicao=1
38;PETR4;18/11/2024;14:45;Petrobras esclarece notícia sobre Plano de Negócios 2025-2029;https://www.rad.cvm.gov.br/ENET/frmDownloadDocumento.aspx?Tela=ext&numProtocolo=1305453&descTipo=IPE&CodigoInstituicao=1
39;PETR4;18/11/2024;08:42;Webcast PE e PN;https://www.rad.cvm.gov.br/ENET/frmDownloadDocumento.aspx?Tela=ext&numProtocolo=1305327&descTipo=IPE&CodigoInstituicao=1
40;PETR4;18/11/2024;08:31;Acordo com Yara e Ansa;https://www.rad.cvm.gov.br/ENET/frmDownloadDocumento.aspx?Tela=ext&numProtocolo=1305326&descTipo=IPE&CodigoInstituicao=1
41;PETR4;11/11/2024;08:35;Petrobras inicia operação comercial da Unidade de Processamento de Gás Natural (UPGN) no Rio de Janeiro;https://www.rad.cvm.gov.br/ENET/frmDownloadDocumento.aspx?Tela=ext&numProtocolo=1301957&descTipo=IPE&CodigoInstituicao=1
42;PETR4;07/11/2024;20:04;Relatório Fiscal 3T24;https://www.rad.cvm.gov.br/ENET/frmDownloadDocumento.aspx?Tela=ext&numProtocolo=1300326&descTipo=IPE&CodigoInstituicao=1
43;PETR4;07/11/2024;19:46;Petrobras informa sobre remuneração aos acionistas;https://www.rad.cvm.gov.br/ENET/frmDownloadDocumento.aspx?Tela=ext&numProtocolo=1300307&descTipo=IPE&CodigoInstituicao=1
44;PETR4;06/11/2024;18:24;Petrobras informa sobre Petrobras Biocombustível (PBio);https://www.rad.cvm.gov.br/ENET/frmDownloadDocumento.aspx?Tela=ext&numProtocolo=1299110&descTipo=IPE&CodigoInstituicao=1
45;PETR4;05/11/2024;18:12;Petrobras informa sobre novo horário do webcast de resultado do 3T24;https://www.rad.cvm.gov.br/ENET/frmDownloadDocumento.aspx?Tela=ext&numProtocolo=1298504&descTipo=IPE&CodigoInstituicao=1
46;PETR4;01/11/2024;11:15;Petrobras esclarece notícia divulgada na mídia sobre dividendos e Plano Estratégico;https://www.rad.cvm.gov.br/ENET/frmDownloadDocumento.aspx?Tela=ext&numProtocolo=1297164&descTipo=IPE&CodigoInstituicao=1
47;PETR4;30/10/2024;13:58;Petrobras informa sobre sentença da ação coletiva da Holanda;https://www.rad.cvm.gov.br/ENET/frmDownloadDocumento.aspx?Tela=ext&numProtocolo=1296085&descTipo=IPE&CodigoInstituicao=1
48;PETR4;30/10/2024;12:19;Navio-plataforma Marechal Duque de Caxias começa a produzir no pré-sal;https://www.rad.cvm.gov.br/ENET/frmDownloadDocumento.aspx?Tela=ext&numProtocolo=1296063&descTipo=IPE&CodigoInstituicao=1
49;PETR4;28/10/2024;19:20;Relatório de Produção e Vendas 3T24;https://www.rad.cvm.gov.br/ENET/frmDownloadDocumento.aspx?Tela=ext&numProtocolo=1295326&descTipo=IPE&CodigoInstituicao=1
50;PETR4;25/10/2024;17:11;Petrobras informa sobre Projeto UFN-III;https://www.rad.cvm.gov.br/ENET/frmDownloadDocumento.aspx?Tela=ext&numProtocolo=1294828&descTipo=IPE&CodigoInstituicao=1
51;PETR4;21/10/2024;18:13;Petrobras informa sobre resultado do 3º trimestre de 2024;https://www.rad.cvm.gov.br/ENET/frmDownloadDocumento.aspx?Tela=ext&numProtocolo=1293225&descTipo=IPE&CodigoInstituicao=1
52;PETR4;15/10/2024;09:41;FPSO Maria Quitéria entra em operação no pré-sal da Bacia de Campos;https://www.rad.cvm.gov.br/ENET/frmDownloadDocumento.aspx?Tela=ext&numProtocolo=1291422&descTipo=IPE&CodigoInstituicao=1
53;PETR4;14/10/2024;09:07;Petrobras assina três contratos de concessão na Bacia de Pelotas;https://www.rad.cvm.gov.br/ENET/frmDownloadDocumento.aspx?Tela=ext&numProtocolo=1291199&descTipo=IPE&CodigoInstituicao=1
54;PETR4;07/10/2024;17:15;Petrobras atinge novos recordes de produção em suas refinarias;https://www.rad.cvm.gov.br/ENET/frmDownloadDocumento.aspx?Tela=ext&numProtocolo=1289141&descTipo=IPE&CodigoInstituicao=1
55;PETR4;03/10/2024;19:23;Petrobras informa sobre descoberta de gás na Colômbia;https://www.rad.cvm.gov.br/ENET/frmDownloadDocumento.aspx?Tela=ext&numProtocolo=1288251&descTipo=IPE&CodigoInstituicao=1
56;PETR4;02/10/2024;19:44;Moody?s eleva perspectiva da Petrobras para positiva;https://www.rad.cvm.gov.br/ENET/frmDownloadDocumento.aspx?Tela=ext&numProtocolo=1287721&descTipo=IPE&CodigoInstituicao=1
57;PETR4;01/10/2024;18:15;Petrobras informa sobre atuação na África do Sul;https://www.rad.cvm.gov.br/ENET/frmDownloadDocumento.aspx?Tela=ext&numProtocolo=1287014&descTipo=IPE&CodigoInstituicao=1
58;PETR4;26/09/2024;17:15;Petrobras e YPF assinam memorando de entendimento para análise de negócios em E&P;https://www.rad.cvm.gov.br/ENET/frmDownloadDocumento.aspx?Tela=ext&numProtocolo=1285524&descTipo=IPE&CodigoInstituicao=1
59;PETR4;26/09/2024;13:35;Petrobras e Staatsolie Maatschappij Suriname N.V. assinam Memorando de Entendimentos;https://www.rad.cvm.gov.br/ENET/frmDownloadDocumento.aspx?Tela=ext&numProtocolo=1285449&descTipo=IPE&CodigoInstituicao=1
60;PETR4;20/09/2024;08:32;Petrobras informa sobre pagamento de remuneração aos acionistas;https://www.rad.cvm.gov.br/ENET/frmDownloadDocumento.aspx?Tela=ext&numProtocolo=1283966&descTipo=IPE&CodigoInstituicao=1
61;PETR4;18/09/2024;16:12;Petrobras esclarece notícia divulgada na mídia sobre preços dos combustíveis;https://www.rad.cvm.gov.br/ENET/frmDownloadDocumento.aspx?Tela=ext&numProtocolo=1283344&descTipo=IPE&CodigoInstituicao=1
62;PETR4;16/09/2024;08:06;Petrobras informa sobre oferta de títulos globais e oferta de recompra;https://www.rad.cvm.gov.br/ENET/frmDownloadDocumento.aspx?Tela=ext&numProtocolo=1282381&descTipo=IPE&CodigoInstituicao=1
63;PETR4;12/09/2024;10:03;Petrobras informa sobre decisão favorável em arbitragem;https://www.rad.cvm.gov.br/ENET/frmDownloadDocumento.aspx?Tela=ext&numProtocolo=1281665&descTipo=IPE&CodigoInstituicao=1
64;PETR4;11/09/2024;17:11;Petrobras inicia procedimentos para entrada em operação da Unidade de Processamento de Gás Natural (UPGN) no Rio de Janeiro;https://www.rad.cvm.gov.br/ENET/frmDownloadDocumento.aspx?Tela=ext&numProtocolo=1281389&descTipo=IPE&CodigoInstituicao=1
65;PETR4;10/09/2024;08:11;Petrobras informa sobre resultado da oferta de recompra de títulos;https://www.rad.cvm.gov.br/ENET/frmDownloadDocumento.aspx?Tela=ext&numProtocolo=1280486&descTipo=IPE&CodigoInstituicao=1
66;PETR4;09/09/2024;18:26;Petrobras e Gerdau estabelecem acordo para estudos de negócios de baixo carbono;https://www.rad.cvm.gov.br/ENET/frmDownloadDocumento.aspx?Tela=ext&numProtocolo=1280236&descTipo=IPE&CodigoInstituicao=1
67;PETR4;03/09/2024;20:10;Petrobras informa sobre precificação de títulos globais;https://www.rad.cvm.gov.br/ENET/frmDownloadDocumento.aspx?Tela=ext&numProtocolo=1278267&descTipo=IPE&CodigoInstituicao=1
68;PETR4;03/09/2024;09:43;Petrobras informa sobre oferta de títulos globais e oferta de recompra;https://www.rad.cvm.gov.br/ENET/frmDownloadDocumento.aspx?Tela=ext&numProtocolo=1277974&descTipo=IPE&CodigoInstituicao=1
69;PETR4;30/08/2024;18:27;Petrobras assina 26 contratos de concessão na Bacia de Pelotas;https://www.rad.cvm.gov.br/ENET/frmDownloadDocumento.aspx?Tela=ext&numProtocolo=1277453&descTipo=IPE&CodigoInstituicao=1
70;PETR4;20/08/2024;08:34;Pagamento de remuneração aos acionistas.;https://www.rad.cvm.gov.br/ENET/frmDownloadDocumento.aspx?Tela=ext&numProtocolo=1273894&descTipo=IPE&CodigoInstituicao=1
71;PETR4;15/08/2024;09:02;Petrobras inicia processo de reativação da fábrica de fertilizantes de Araucária (PR);https://www.rad.cvm.gov.br/ENET/frmDownloadDocumento.aspx?Tela=ext&numProtocolo=1272324&descTipo=IPE&CodigoInstituicao=1
72;PETR4;08/08/2024;22:07;Relatório Fiscal 2T24;https://www.rad.cvm.gov.br/ENET/frmDownloadDocumento.aspx?Tela=ext&numProtocolo=1269270&descTipo=IPE&CodigoInstituicao=1
73;PETR4;08/08/2024;21:34;Petrobras revisa projeção de CAPEX para 2024;https://www.rad.cvm.gov.br/ENET/frmDownloadDocumento.aspx?Tela=ext&numProtocolo=1269251&descTipo=IPE&CodigoInstituicao=1
74;PETR4;08/08/2024;21:23;Petrobras informa sobre remuneração aos acionistas;https://www.rad.cvm.gov.br/ENET/frmDownloadDocumento.aspx?Tela=ext&numProtocolo=1269248&descTipo=IPE&CodigoInstituicao=1
75;PETR4;05/08/2024;08:41;Petrobras confirma descoberta de gás na Colômbia;https://www.rad.cvm.gov.br/ENET/frmDownloadDocumento.aspx?Tela=ext&numProtocolo=1266548&descTipo=IPE&CodigoInstituicao=1
76;PETR4;05/08/2024;08:08;Encerramento do Programa de Recompra de Ações;https://www.rad.cvm.gov.br/ENET/frmDownloadDocumento.aspx?Tela=ext&numProtocolo=1266546&descTipo=IPE&CodigoInstituicao=1
77;PETR4;01/08/2024;18:20;Petrobras informa sobre resultado do 2º trimestre de 2024;https://www.rad.cvm.gov.br/ENET/frmDownloadDocumento.aspx?Tela=ext&numProtocolo=1265497&descTipo=IPE&CodigoInstituicao=1
78;PETR4;29/07/2024;19:56;Relatório de Produção e Vendas 2T24;https://www.rad.cvm.gov.br/ENET/frmDownloadDocumento.aspx?Tela=ext&numProtocolo=1263968&descTipo=IPE&CodigoInstituicao=1
79;PETR4;24/07/2024;20:02;Petrobras informa sobre precificação do resgate de títulos globais;https://www.rad.cvm.gov.br/ENET/frmDownloadDocumento.aspx?Tela=ext&numProtocolo=1262475&descTipo=IPE&CodigoInstituicao=1
80;PETR4;19/07/2024;18:18;Petrobras informa sobre ressarcimento de parceiros relacionado ao edital de Transação Tributária;https://www.rad.cvm.gov.br/ENET/frmDownloadDocumento.aspx?Tela=ext&numProtocolo=1261259&descTipo=IPE&CodigoInstituicao=1
81;PETR4;09/07/2024;18:52;Petrobras assina Master Agreement com a Yara Brasil Fertilizantes S.A.;https://www.rad.cvm.gov.br/ENET/frmDownloadDocumento.aspx?Tela=ext&numProtocolo=1258054&descTipo=IPE&CodigoInstituicao=1
82;PETR4;03/07/2024;20:25;Petrobras informa sobre assinatura de aditivo ao TCC do gás firmado com o CADE;https://www.rad.cvm.gov.br/ENET/frmDownloadDocumento.aspx?Tela=ext&numProtocolo=1256631&descTipo=IPE&CodigoInstituicao=1
83;PETR4;03/07/2024;20:14;Petrobras e CADE assinam aditivo ao TCC para o mercado de refino;https://www.rad.cvm.gov.br/ENET/frmDownloadDocumento.aspx?Tela=ext&numProtocolo=1256621&descTipo=IPE&CodigoInstituicao=1
84;PETR4;01/07/2024;20:01;Petrobras informa sobre transferência de participação minoritária na UEG Araucária S.A. (UEGA);https://www.rad.cvm.gov.br/ENET/frmDownloadDocumento.aspx?Tela=ext&numProtocolo=1255536&descTipo=IPE&CodigoInstituicao=1
85;PETR4;28/06/2024;18:41;Petrobras informa sobre resgate de títulos globais;https://www.rad.cvm.gov.br/ENET/frmDownloadDocumento.aspx?Tela=ext&numProtocolo=1254887&descTipo=IPE&CodigoInstituicao=1
86;PETR4;28/06/2024;18:30;Petrobras informa sobre contrato com a Unigel;https://www.rad.cvm.gov.br/ENET/frmDownloadDocumento.aspx?Tela=ext&numProtocolo=1254858&descTipo=IPE&CodigoInstituicao=1
87;PETR4;28/06/2024;10:15;Petrobras informa sobre eleição de novas Diretoras e de novo Diretor;https://www.rad.cvm.gov.br/ENET/frmDownloadDocumento.aspx?Tela=ext&numProtocolo=1254590&descTipo=IPE&CodigoInstituicao=1
88;PETR4;27/06/2024;20:02;Petrobras aprova alteração do percentual de participação no custeio do plano de saúde;https://www.rad.cvm.gov.br/ENET/frmDownloadDocumento.aspx?Tela=ext&numProtocolo=1254430&descTipo=IPE&CodigoInstituicao=1
89;PETR4;20/06/2024;08:40;Petrobras sobre pagamento de remuneração aos acionistas;https://www.rad.cvm.gov.br/ENET/frmDownloadDocumento.aspx?Tela=ext&numProtocolo=1251870&descTipo=IPE&CodigoInstituicao=1
90;PETR4;19/06/2024;17:15;Petrobras informa sobre FPSO Maria Quitéria;https://www.rad.cvm.gov.br/ENET/frmDownloadDocumento.aspx?Tela=ext&numProtocolo=1251737&descTipo=IPE&CodigoInstituicao=1
91;PETR4;18/06/2024;18:09;Petrobras assina Protocolo de Intenções com o Governo do Rio de Janeiro;https://www.rad.cvm.gov.br/ENET/frmDownloadDocumento.aspx?Tela=ext&numProtocolo=1251352&descTipo=IPE&CodigoInstituicao=1
92;PETR4;17/06/2024;19:20;Petrobras informa sobre adesão ao edital de Transação PGFN-RFB 6/2024;https://www.rad.cvm.gov.br/ENET/frmDownloadDocumento.aspx?Tela=ext&numProtocolo=1250846&descTipo=IPE&CodigoInstituicao=1
93;PETR4;14/06/2024;15:20;Petrobras sobre indicações para a Diretoria Executiva;https://www.rad.cvm.gov.br/ENET/frmDownloadDocumento.aspx?Tela=ext&numProtocolo=1250157&descTipo=IPE&CodigoInstituicao=1
94;PETR4;13/06/2024;21:33;Petrobras sobre atualização monetária de dividendos relativos a 2023;https://www.rad.cvm.gov.br/ENET/frmDownloadDocumento.aspx?Tela=ext&numProtocolo=1249940&descTipo=IPE&CodigoInstituicao=1
95;PETR4;13/06/2024;20:49;Petrobras informa sobre encerramento de processo de alienação da Metanor;https://www.rad.cvm.gov.br/ENET/frmDownloadDocumento.aspx?Tela=ext&numProtocolo=1249929&descTipo=IPE&CodigoInstituicao=1
96;PETR4;12/06/2024;21:43;TST homologa acordo para convocação de ex-trabalhadores da ANSA;https://www.rad.cvm.gov.br/ENET/frmDownloadDocumento.aspx?Tela=ext&numProtocolo=1249566&descTipo=IPE&CodigoInstituicao=1
97;PETR4;11/06/2024;19:30;Atualização do valor por ação de dividendos e JCP do 1T24 ;https://www.rad.cvm.gov.br/ENET/frmDownloadDocumento.aspx?Tela=ext&numProtocolo=1249122&descTipo=IPE&CodigoInstituicao=1
98;PETR4;10/06/2024;09:35;Petrobras publica Relatório de Sustentabilidade 2023;https://www.rad.cvm.gov.br/ENET/frmDownloadDocumento.aspx?Tela=ext&numProtocolo=1248027&descTipo=IPE&CodigoInstituicao=1
99;PETR4;07/06/2024;19:21;Petrobras informa sobre pedido de convocação de Assembleia;https://www.rad.cvm.gov.br/ENET/frmDownloadDocumento.aspx?Tela=ext&numProtocolo=1247820&descTipo=IPE&CodigoInstituicao=1
