;Acao;Data;Hora;Descrição;Link
0;SOND5;03/06/2020;08:29;Negociação de direitos sobre Precatório nº 5002421- 45.2020.4.02.9388;https://www.rad.cvm.gov.br/ENET/frmDownloadDocumento.aspx?Tela=ext&numProtocolo=766208&descTipo=IPE&CodigoInstituicao=1
1;SOND5;02/06/2020;07:31;Negociação de direitos sobre Precatório nº 5002421- 45.2020.4.02.9388;https://www.rad.cvm.gov.br/ENET/frmDownloadDocumento.aspx?Tela=ext&numProtocolo=765901&descTipo=IPE&CodigoInstituicao=1
2;SOND5;23/10/2019;09:27;Falecimento do Presidente do Conselho de Administração, Diretor-Presidente e acionista majoritário, Dr. Jaime Rotstein;https://www.rad.cvm.gov.br/ENET/frmDownloadDocumento.aspx?Tela=ext&numProtocolo=717095&descTipo=IPE&CodigoInstituicao=1
3;SOND5;31/07/2018;18:29;Pagamento acordo judicial.;https://www.rad.cvm.gov.br/ENET/frmDownloadDocumento.aspx?Tela=ext&numProtocolo=634709&descTipo=IPE&CodigoInstituicao=1
4;SOND5;18/05/2017;17:16;Reapresentação de cifras comparativas.;https://www.rad.cvm.gov.br/ENET/frmDownloadDocumento.aspx?Tela=ext&numProtocolo=565371&descTipo=IPE&CodigoInstituicao=1
5;SOND5;11/06/2013;17:11;Aquisição de Ações de Emissão da Própria Companhia;https://www.rad.cvm.gov.br/ENET/frmDownloadDocumento.aspx?Tela=ext&numProtocolo=384586&descTipo=IPE&CodigoInstituicao=1
6;SOND5;18/12/2012;17:37;Comunicação de acordo judicial para recebimento de créditos;https://www.rad.cvm.gov.br/ENET/frmDownloadDocumento.aspx?Tela=ext&numProtocolo=361431&descTipo=IPE&CodigoInstituicao=1
7;SOND5;15/07/2008;15:27;Informação sobre auditores externos;https://www.rad.cvm.gov.br/ENET/frmDownloadDocumento.aspx?Tela=ext&numProtocolo=170443&descTipo=IPE&CodigoInstituicao=1
